Tag,Text,Markers
yes,"You may wonder how you can produce this much content, and how you can compete with others that may publish even more than you do.",label_sentences__4_25_21_1000_
no,"The complexity of the topic and study limitations, such as the absence of data about individuals' social networks, diet and degree of objective social isolation versus subjective reports of loneliness, argue for larger, longer studies, wrote the authors.by Keita Umejima, Takuya Ibaraki, Takahiro Yamazaki, Kuniyoshi L. Sakai in Frontiers in Behavioral Neuroscience'Actually, paper is more advanced and useful compared to electronic documents because paper contains more one-of-a-kind information for stronger memory recall,' said Professor Kuniyoshi L. Sakai, a neuroscientist at the University of Tokyo and corresponding author of the research.",label_sentences__4_25_21_1000_
yes,"He watches from the sidelines as Reggie hits the game winner, and the Pacers go on to win in five before falling to the Lakers in the anticlimactic Finals.",label_sentences__4_25_21_1000_
yes,Embrace where you're at and find things to love about your life right here and now.,label_sentences__4_25_21_1000_
yes,"Heck, you can even help save the holidays in the Netherworld by recovering stolen Christmas presents!",label_sentences__4_25_21_1000_
no,Albert's 'Motivation' RoutineYour routine does not have to be the same as mine.,label_sentences__4_25_21_1000_
no:yes,Worst case is market give negative feedback.,label_sentences__4_25_21_1000_
no,Wireframing is about research and engineering.,label_sentences__4_25_21_1000_
yes,"From start to finish, there are no loading screens or fade to black transitions from cutscene to gameplay, the only exception being when you die but other than that it's one continuous journey.",label_sentences__4_25_21_1000_
no,"Users should not have to wonder whether different words, situations, or actions mean the same thing.",label_sentences__4_25_21_1000_
no,"They are usually about politics, crime, religion, trolling, etc.",label_sentences__4_25_21_1000_
no,I have been writing on Medium for a few months now and I am at school full time,label_sentences__4_25_21_1000_
yes,"But also, don't forget to exercise, to shower, to eat well, to clean your room.",label_sentences__4_25_21_1000_
yes,"Building a wireframe means deciding on content priorities, interactive details, and ways users can use your product.",label_sentences__4_25_21_1000_
yes,Our bodies know when we move.,label_sentences__4_25_21_1000_
no,"I applaud these writers for encouraging their readers to travel, to take stock of the things that really matter in life, of appreciating experiences over things.",label_sentences__4_25_21_1000_
yes,"It's the most cost-effective, direct-to-consumer way to engage, educate and empower your community,' she said.",label_sentences__4_25_21_1000_
no,"What could an NPS look like for inclusion?The three frameworks above are great, but they can lead you astray if used in insolation.",label_sentences__4_25_21_1000_
yes,"The street was turning sleepy again, and at some point a guy came up to us saying he had a bar around the corner and would we come play a few songs there?",label_sentences__4_25_21_1000_
yes,Allowing people to shift their working hours and not being rigid about such a thing (maybe they work part of the day in the office and are allowed to leave early and can finish out the day remotely).,label_sentences__4_25_21_1000_
yes,His name was David Graeber - and his work has influenced me like almost no one else's.,label_sentences__4_25_21_1000_
no,"Yes, that's a lot of TAM - all of SMB and enterprise - but, by definition, it is not all monetizable by Shopify alone.",label_sentences__4_25_21_1000_
yes,"I take an entire hour every morning for reflection and introspection through meditation, journaling and yoga.",label_sentences__4_25_21_1000_
no,You can read more about this research at the University of California site here.,label_sentences__4_25_21_1000_
no,"Nick Francis, the chief executive of Boston-based customer service platform Help Scout, tweeted that localizing pay 'isn't the right way to do it.'",label_sentences__4_25_21_1000_
yes,"While the causes of situational depression and clinical depression are different, they both result in the same sort of symptoms.",label_sentences__4_25_21_1000_
no,"Don't stop on my account,' she teased in a monotone.",label_sentences__4_25_21_1000_
no,"Instead of opting for more levels in the original game like the rereleases of Super Mario Bros. U, Bowser's Fury offers something different that maintains the themes of the original game.",label_sentences__4_25_21_1000_
yes,"Jesse and Arielle's new startup, Rella, is a complete suite of wedding planning tools from automated budgeting to guest list and RSVP tracker, from centralized notes to vendor conversation tracking.",label_sentences__4_25_21_1000_
yes,"The easiest way to think about it is that publishers control the sheet music, and the labels control the recordings of people playing that sheet music.",label_sentences__4_25_21_1000_
yes,"If taxation is a badge of freedom,' stormed Bryan during a House debate, 'let me assure my friend that the poor people of this country are covered all over with the insignia of freedom.'",label_sentences__4_25_21_1000_
yes,I believe in the power of education to transform lives.,label_sentences__4_25_21_1000_
yes,Your mental health will thank you when it no longer feels the 'weight of the world' daily.,label_sentences__4_25_21_1000_
no,"that's not enough, there's even a catchy anime-like theme song to accompany the manga-style artwork used throughout the game.",label_sentences__4_25_21_1000_
yes,"Even more, consumers are also making their purchases with greater awareness of health, cost, and environment.",label_sentences__4_25_21_1000_
yes,Many believe it's not fair that Jake Paul can make millions in boxing because athletes have spent years in the sport and have gotten nowhere.,label_sentences__4_25_21_1000_
no,"I chose not to mention the multitude of discrepancies which convinced me to hand in my resignation, had I not been beaten to it.",label_sentences__4_25_21_1000_
no,Dungeons and Dragons Made Me a Better Scrum Master,label_sentences__4_25_21_1000_
no,Once I understood that it changed my approach to leading the unit.,label_sentences__4_25_21_1000_
yes,"Yes, maybe they've found a way to exploit these techniques in a way that works for them, but what you're not seeing and what they're not telling you is the amount of work, effort and time spent before they managed to succeed.",label_sentences__4_25_21_1000_
yes,Then you can use a risk management function that uses stops and profit orders.,label_sentences__4_25_21_1000_
no,Yet the Trump administration wants to open without serious containment.,label_sentences__4_25_21_1000_
no,Can you share 3 things that most excite you about the modern beauty industry?The 3 things that most excite me about the modern beauty industry,label_sentences__4_25_21_1000_
no,This article originally appeared in the Design Week Portland online journal.,label_sentences__4_25_21_1000_
yes,"She seems different, moody and distracted.",label_sentences__4_25_21_1000_
no,"All the reasons that somebody would choose to make it a habit after they've gotten through that sticky, difficult point that brought them in the first place.",label_sentences__4_25_21_1000_
no,"escape out that door, realizing it was not always locked, the prison was in my mind.",label_sentences__4_25_21_1000_
yes,His face was cherry red and the vein in his temple thrashed up and down as if there were a wild animal trapped in his head.,label_sentences__4_25_21_1000_
yes,Both these sites offered data for over 7000+ companies for the past 30 years and had all kinds of financial ratios and metrics possible.,label_sentences__4_25_21_1000_
yes,We need to trust principals to hire their team.,label_sentences__4_25_21_1000_
no,The Sad Problem With Today's Stock Market,label_sentences__4_25_21_1000_
no,The sentiment is a polarity towards the target and the aspect.,label_sentences__4_25_21_1000_
yes,"he thought about funding for a project, his will, and finally, his wife.",label_sentences__4_25_21_1000_
yes,"As we experienced in the fall of 2008 and the spring of 2020, such loss of funding can cascade through the financial system, driving sharp declines in economic activity and employment.",label_sentences__4_25_21_1000_
no,"Hence, please refrain from doing so.",label_sentences__4_25_21_1000_
no,You know what to do already.,label_sentences__4_25_21_1000_
yes,"If you can find a way to sustain the lifestyle you have right now, by making your own money instead of relying on your boss to send you a pay check every month, then you've successfully created financial independence for yourself.",label_sentences__4_25_21_1000_
yes,"I'm not going to focus on credentialism or any of the pipeline benefits from going from high school, to a good university, to a great job.",label_sentences__4_25_21_1000_
yes,"There we are essentially using e to the power of minus, and then not the L2-norm but the L1-norm,",label_sentences__4_25_21_1000_
no,"Sometimes, I hold one or another piece of it.",label_sentences__4_25_21_1000_
yes,They are informed of the final decision.,label_sentences__4_25_21_1000_
yes,I noticed a whole neighborhood I had not noticed before.,label_sentences__4_25_21_1000_
yes,One thing I know for sure: FOREO's designs are inspiring for the UX designers of any industry.,label_sentences__4_25_21_1000_
no,"I promise, this content always seems to do the best in the long run.",label_sentences__4_25_21_1000_
yes,"That is incorrect, particularly because we haven't been focusing on the female body enough, especially before the twenty-first century.",label_sentences__4_25_21_1000_
no,(this last one is key really):1),label_sentences__4_25_21_1000_
yes,"You see, now everything is just about price.",label_sentences__4_25_21_1000_
no,"It was special, but not in the way everyone thought.",label_sentences__4_25_21_1000_
no,like you actually want to be there. ',label_sentences__4_25_21_1000_
no,"While this might be true, I don't think that it makes the friendships any less legitimate.",label_sentences__4_25_21_1000_
no,"Bowser's Fury is a bundled add-on to Super Mario 3D World, thus being dubbed by Nintendo Super Mario 3D World + Bowser's Fury.",label_sentences__4_25_21_1000_
no,"Beyond this, though, everyone's journey is individual.",label_sentences__4_25_21_1000_
no,"Boo's position can be anywhere, which means the possible states are continuous.",label_sentences__4_25_21_1000_
no,"So how were these complete unknowns doing this, out of nowhere?",label_sentences__4_25_21_1000_
no,Yet a topic that is so important to discuss.,label_sentences__4_25_21_1000_
yes,"This part consists of tile-roofed terraced townhouses and three-story blocks, which seem pretty rural.",label_sentences__4_25_21_1000_
no,do you use for doing it?Users,label_sentences__4_25_21_1000_
yes,"Ironically, observing and accepting your emotions can end up changing them a great deal, or at the very least, can reduce their intensity.",label_sentences__4_25_21_1000_
yes,"Accepting our flaws and that we can only do so much, only grade so much, and forgive ourselves is another solution way to do what's best for the students.",label_sentences__4_25_21_1000_
yes,We often neglect that women can exist beyond the parameters of our pain.,label_sentences__4_25_21_1000_
no,"It's not a land where mirror versions of ourselves would be living mirrored lives, sleeping in copies of our houses and with copies of our family.",label_sentences__4_25_21_1000_
yes,The easiest step you can take is actually the most powerful.,label_sentences__4_25_21_1000_
yes,In earlier times when laws were first being created it seems to have been with the intention of protecting people and discouraging bad behavior.,label_sentences__4_25_21_1000_
yes,"Since the speculative activities Wall Street engaged in pre the 2008 financial crisis broke the system in two, they had to copy the politicians and the central bankers and embrace financial insanity.",label_sentences__4_25_21_1000_
no,but what I found was that it was difficult to find store bought items that tasted good WHILE meeting my health requirements.,label_sentences__4_25_21_1000_
yes,My guide bobbing up and down gently and gliding down the slope as he 'scree skied' through the loose rocks.,label_sentences__4_25_21_1000_
yes,Blockchain technology is presently the most secure and transparent technology in the world because it stores data in several databases by using peer-peer nodes thus by-passing any central authority by giving every user absolute autonomy.,label_sentences__4_25_21_1000_
yes,"Covid-19 feels like we are busy fixing the plane while flying it, and there are still many unknowns which doesn't bode well for our already increasing anxiety levels.",label_sentences__4_25_21_1000_
yes,Can you blame a person looking for a way out of their financial problems?,label_sentences__4_25_21_1000_
yes,It doesn't mean things need to get boring.,label_sentences__4_25_21_1000_
no,The one certainty with most side hustles is they eat into any free hours and then some.,label_sentences__4_25_21_1000_
yes,It helps to give users feedback when creating a password of this sort with a progress bar or another indicator rather than leave them guessing until a general error message tells them where they've gone astray.,label_sentences__4_25_21_1000_
no,"After some time, Boo's probability of catching Mario is 100%.",label_sentences__4_25_21_1000_
yes,"Still, the Roccat software offers so much more flexibility and control over the sound, and you can store multiple user profiles.",label_sentences__4_25_21_1000_
yes,For all those years I believed I wasn't trying hard enough.,label_sentences__4_25_21_1000_
yes,"She was waiting for Ramundo, and would fantasize about brushing against the baker's welcoming, chilled face to gently thaw him out.",label_sentences__4_25_21_1000_
yes,"The presence of COVID has made digital conferences a casual thing, so make sure to capitalize on this trend, as this significantly reduces the costs necessary to host a digital meet-up.",label_sentences__4_25_21_1000_
no,"I used it the moment she gifted it to me, and",label_sentences__4_25_21_1000_
no,I thought about walking across I35 in Austin during rush hour.,label_sentences__4_25_21_1000_
no,The short of it is that a game consists of layers:,label_sentences__4_25_21_1000_
no,That being said as a high school senior I had absolutely no clue where to start.,label_sentences__4_25_21_1000_
yes,"Because of the expense required to drill for water, many black folks just moved away.",label_sentences__4_25_21_1000_
no,but if you're not clearly explaining your offer to your audience... who is?,label_sentences__4_25_21_1000_
yes,The massive fiscal and monetary stimulus injected into the economy throughout the pandemic was spectacularly successful at adding fuel to large companies with access public markets (to the point that several companies saw their stocks soar even after filing for bankruptcy).,label_sentences__4_25_21_1000_
no,The numerator is the same: total known deaths attributed to COVID-19.,label_sentences__4_25_21_1000_
yes,"I felt stabbed in the stomach, but at least Paul tried to protect me.",label_sentences__4_25_21_1000_
yes,"In Finland, the attitude towards education doesn't start with the student.",label_sentences__4_25_21_1000_
yes,At the end we realized that none of the learning he told us about was happening in school.,label_sentences__4_25_21_1000_
yes,Clubhouse's allure came from being an invite-only social app where you can talk to celebrities.,label_sentences__4_25_21_1000_
no,A little color theory explains why.,label_sentences__4_25_21_1000_
no,"On the other side of the pond sat an older man, most likely retired thought",label_sentences__4_25_21_1000_
no,Product positioning is a large topic in itself.,label_sentences__4_25_21_1000_
yes,You start talking about your idea with your audience.,label_sentences__4_25_21_1000_
no,But you do want them to remember certain targeted interactions with you.,label_sentences__4_25_21_1000_
yes,"You, as a parent, do know your child better than you have ever known them before.",label_sentences__4_25_21_1000_
yes,It's part of the MVP process where the goal is to collect behavioral feedback on your product.,label_sentences__4_25_21_1000_
yes,"If everything is reduced to numbers, won't we lose sight of the human context?",label_sentences__4_25_21_1000_
no,"A very apt quotation about breathing may be cited - 'When the breath is unsteady, all is unsteady, when the breath is still, all is still.",label_sentences__4_25_21_1000_
no,"Despite not being even remotely famous, I was convinced I was going to be imminently cancelled online.",label_sentences__4_25_21_1000_
no,"If something happens during the day, and my brain goes into auto-response mode, I stop and remember the card by thinking:",label_sentences__4_25_21_1000_
no,"From shooting music videos at The Hype House to packaging a challenge with each single, record labels are trying every tactic at their disposal to make their songs the next 'TikTok Song.",label_sentences__4_25_21_1000_
no,For a committed capital base invested across funds this doesn't matter; for a dispersed capital base it matters a lot.[11],label_sentences__4_25_21_1000_
no,but I caved in last weekend and ended up buying it,label_sentences__4_25_21_1000_
yes,"Satisfied, I came to the conclusion that no longer being around was the only way to avoid the regret, humiliation, and disappointment that was surely coming my way in retribution for a crime I had never once even thought about committing.",label_sentences__4_25_21_1000_
yes,"So, get your ass over to Google, put yourself in your customer's shoes, and start searching for what they may be searching.",label_sentences__4_25_21_1000_
yes,A partnership is a type of business structure where two or more people share in the ownership of a business.,label_sentences__4_25_21_1000_
no,"And then back at the deer for reminding us of our purpose, and what we need to give back for all that we've taken.",label_sentences__4_25_21_1000_
no,This brings us to the next economic paradigm - Enabling a person to flourish as a citizen - Universal Basic Assets (UBA) and Guaranteed Job rather than unemployment insurance.,label_sentences__4_25_21_1000_
yes,Throughout the whole design phase we tested our various iterations with 5 people.,label_sentences__4_25_21_1000_
yes,They spoke little English and Sol-Luz served as an unofficial translator in situations where their English didn't suffice.,label_sentences__4_25_21_1000_
yes,We don't want to be deplatformed for false information in the group.,label_sentences__4_25_21_1000_
yes,"Some genes give instructions for making proteins, while others do not.",label_sentences__4_25_21_1000_
yes,"She licked her chapped lips, ignoring the dry feeling of her lips and met the worried look of her mother.",label_sentences__4_25_21_1000_
no,Facebook also isn't very far behind.,label_sentences__4_25_21_1000_
yes,"People love to explore, see new places, treat themselves to luxurious honeymoons and celebratory trips.",label_sentences__4_25_21_1000_
yes,Here are 4 of the most common ways successful freelancers say you can start your business today but fail to explain what can go wrong.,label_sentences__4_25_21_1000_
yes,It remains to be seen how far artificial intelligence and robotics will penetrate into the workforce.,label_sentences__4_25_21_1000_
yes,"Instead of focusing on hands-on work, leaders devote themselves more to creating the environment and conditions that bring the best out of everyone to accomplish something bigger and greater.",label_sentences__4_25_21_1000_
yes,They collaborate on cross-functional processes that allow them to bridge the gaps between teams where friction frequently festers.,label_sentences__4_25_21_1000_
no,"We can find this by finding the minimum date from the 'time_id' column for each user, which gives me the date they started using services.2.",label_sentences__4_25_21_1000_
yes,Too many people dream that they will suddenly become rich.,label_sentences__4_25_21_1000_
yes,The book goes into much more detail into the specifics of what flow is and how to induce it.,label_sentences__4_25_21_1000_
no,"Spiders, beetles, wasps are crawling upon my skin.",label_sentences__4_25_21_1000_
no,This also can cause trouble when it comes to managing your mental health.,label_sentences__4_25_21_1000_
no,"Notably, collectively, these rules not only diminish the amount of capital that existing broker-dealers are able to supply but also operate as a formidable barrier to entry or expansion by any other bank-affiliated firm, and as an incentive for existing players to exit.[17]Rationalization of these rules would likely restore significant liquidity to fixed-income markets.",label_sentences__4_25_21_1000_
no,"Her Yoruba was never that perfect, that strong.",label_sentences__4_25_21_1000_
no,He is not a big social media person and pieced together my habits.,label_sentences__4_25_21_1000_
no,What Happened When I 'Quit' Social Media,label_sentences__4_25_21_1000_
yes,"They watched the news, absorbed the misguided media portrayal of what was happening with GameStop, and got in at absolutely the wrong time as the stock quickly cratered from roughly $400 to, at last check, $50.31.Can you blame the same person for following Elon Musk into Dogecoin, another pump and dump (for all intents and purposes)",label_sentences__4_25_21_1000_
yes,"This is probably because all three disorders share a common symptom: cognitive distortions, or irrational thoughts that can affect your emotions.",label_sentences__4_25_21_1000_
yes,This mind-muscle connection not only aids proper relaxation in rest periods but also promotes better muscle growth.,label_sentences__4_25_21_1000_
yes,She yawned a lion's yawn and her eyes squeezed shut.,label_sentences__4_25_21_1000_
yes,"You can barely support your own - how can you support anyone, everyone, else?So how was America left too poor to afford anything but collapse?",label_sentences__4_25_21_1000_
yes,"That is why they need you to get back to work, to 're-open' the economy, despite the unhealthy working conditions.",label_sentences__4_25_21_1000_
no,The response from Writesonic suggested an example of another company's product.,label_sentences__4_25_21_1000_
no,If the average fall-out time for your resolutions is six weeks... and the average habit takes two months to form...,label_sentences__4_25_21_1000_
no,"the depression has been lurking, ready to pounce at the sign of the tiniest crack or the most minor divot in my mental armor.",label_sentences__4_25_21_1000_
yes,"If for example a DLC needs to me made, G-Man will do what's necessary so that the game has a plot and a reason for existence.",label_sentences__4_25_21_1000_
no,"After all, it is his bed,' she said.",label_sentences__4_25_21_1000_
yes,"Nevertheless, the people who remained had to be open-minded, they had to get behind the collective aims of the organisations they worked for, they had to take and give criticism, and they had to patiently persist at what they did.",label_sentences__4_25_21_1000_
yes,Because I'm pretty sure the reason ketamine worked on me had less to do with the chemical changes to my brain and more to do with it allowing me to see my life completely differently.,label_sentences__4_25_21_1000_
yes,"The debate is no longer over whether:But what we do have to recognize is - as in the case with many mathematical equations that we know how to write down - that we cannot compute everything with the same straightforward, brute-force approach.",label_sentences__4_25_21_1000_
yes,"'Erm, Sammy,' he edged away from her and tried to put down the glass he was holding.",label_sentences__4_25_21_1000_
no,This portion of MLB's business model is under siege.,label_sentences__4_25_21_1000_
yes,"So here are some photos that best summarize our whirlwind journey since leaving Cape Town - a good timeline of laughs and tears through squalls and storms, unknown waters, medicanes, dangerous straits and a crossing or two.",label_sentences__4_25_21_1000_
yes,A friend of mine reached out to me for advice on getting his business off the ground.,label_sentences__4_25_21_1000_
yes,"Even though tuition costs were rising, many people viewed college as a segue into better employment prospects.",label_sentences__4_25_21_1000_
yes,"Furthermore, we should always bear in mind that a formally perfect theory will not describe reality well if it is founded on false facts.",label_sentences__4_25_21_1000_
no,Facts are great and there is nothing wrong with a simple review for the latest Fortnite season pass.,label_sentences__4_25_21_1000_
no,"and I knew that to do it well, I would need a few hours of focused work.",label_sentences__4_25_21_1000_
no,"On the other hand, if you choose the other option and do not declare to the girl, you live in an eternal what-",label_sentences__4_25_21_1000_
no,"I wrote it for me, to help me - hoping to help somebody else too in the process.",label_sentences__4_25_21_1000_
yes,"Hence, I decided to buy a used eGPU to test what benefit it would give to my system.",label_sentences__4_25_21_1000_
no,"By accepting, you are letting these triggers exist and just be; without trying to change anything, judge it or get rid of it.",label_sentences__4_25_21_1000_
yes,"As soon as it was confirmed for the Saturn it was game over for any other system, I had to have Sega's newest machine.",label_sentences__4_25_21_1000_
yes,You can do this so everyone pays attention to the stories you tell at parties - or become a great writer of fiction.,label_sentences__4_25_21_1000_
no,Pony up another $30k to $60k.,label_sentences__4_25_21_1000_
