Tag,Text,Markers
no,"When Sam Bridges experiences the memories of the BB that he is transporting, he discovers that Clifford Unger (Mads Mikkelsen), the man he's been running away from, was actually nothing more than a worried father doing his best to save his wife and newborn child.",label_sentences__4_25_21_1000_
no,"I don't know how I didn't notice,' Cole blurted. '",label_sentences__4_25_21_1000_
no,Ji-sung Park routinely covered every blade of grass for the team.,label_sentences__4_25_21_1000_
yes,I smiled and said hello as I pulled a couple of postcards out of my backpack and set it on the counter.,label_sentences__4_25_21_1000_
yes,"The difference between now and next is in whether we want to see this reality for what it really is and what it really can be, or, if we want to see this reality for what it really isn't or can be.",label_sentences__4_25_21_1000_
no,Now that we understand the basic concepts let's move to a real-world example.,label_sentences__4_25_21_1000_
yes,"Regardless, here are 10 things I wish I would have known before starting therapy.",label_sentences__4_25_21_1000_
no,"It is the foundation of what makes us human, how we live and find our place in the world,",label_sentences__4_25_21_1000_
yes,"Since we were trying to predict whether a blight compliance fine would be paid or not, this was a binary classification problem with the following target variables:",label_sentences__4_25_21_1000_
yes:no,"By asking open-ended questions, we learned about users' social habits pre/during Covid-19, experiences with virtual events, interactions with other attendees, and their general attitude towards virtual events.3 of our key interview findings:",label_sentences__4_25_21_1000_
no,"As we descended the bumpy road into a sweeping valley, my breath caught.",label_sentences__4_25_21_1000_
no,"We also got great advice, at the right time, and we listened.",label_sentences__4_25_21_1000_
yes,Noise-canceling headphones are an excellent way to block out distractions and tell the world you aren't available.,label_sentences__4_25_21_1000_
yes,My strategy moving forward will be to dive deeper and apply storytelling in my videos and use the techniques such as a 3 part narrative to make the story worth watching.,label_sentences__4_25_21_1000_
no,People used to be described as 'in touch with their genius.',label_sentences__4_25_21_1000_
no,"But I think some people internally have a hope that the place will become, you may have described it, a nicer place.",label_sentences__4_25_21_1000_
yes,"Google OCR was somehow worse, around 60%.In recognition, they were about on par - about 70% on character level, which made them not so good on word or book level.",label_sentences__4_25_21_1000_
yes,"NOW.Or, maybe, you've lead an internal process to gather feedback from everyone under the sun at your firm about what they want the software to do.",label_sentences__4_25_21_1000_
yes,The research above shows that those who speak out often likely aren't speaking out about everything.,label_sentences__4_25_21_1000_
no:yes,I was glad when the downstairs neighbor moved out.,label_sentences__4_25_21_1000_
yes,Congress and state legislatures and agencies will continue to enact and propose legislation and regulations.,label_sentences__4_25_21_1000_
no,Here you can also see why you need to have a Facebook page connected to your Instagram account.,label_sentences__4_25_21_1000_
yes,"While turning your passion into a side hustle has many benefits, it also has drawbacks.",label_sentences__4_25_21_1000_
yes,"Yes, you can make sales in your sleep, but you must remember that to sell these resources online you need to:",label_sentences__4_25_21_1000_
no,"Humans are highly tactile, physical creatures.",label_sentences__4_25_21_1000_
yes,"If you don't hold yourself accountable, then you're going to have lots of credibility problems.",label_sentences__4_25_21_1000_
no,"It's great to remember the good times, before that bastard Christopher Chapman got to them.",label_sentences__4_25_21_1000_
yes,"Write it down, no matter if it's from your sector, but if you really are not concerned about it, welcome it.",label_sentences__4_25_21_1000_
no,"But it won't be easy, and it won't happen on your first day.",label_sentences__4_25_21_1000_
no,"Secondly, exercise can lead to a shape change: cycling, horse riding, using exercise machines at the gym, et cetera.",label_sentences__4_25_21_1000_
yes,"It is difficult to come back to focus when something interrupts our focus, so if you have some questions for the developers, it is better to take half an hour with them and ask them all the questions.",label_sentences__4_25_21_1000_
yes,"Cole said a neighbor reported them for illegally dumping blackwater waste, even though their camper does not have any blackwater.",label_sentences__4_25_21_1000_
no,"Sure, it's not as comprehensive as getting a formal education on it, but you can still get by, especially since in game design you need to know quite a wide variety of things.",label_sentences__4_25_21_1000_
no,"That's why we have decided to create a new, strategic internal position to support our portfolio companies even more comprehensively and hire a Head of Talent for Creandum.",label_sentences__4_25_21_1000_
yes,"Hopefully, parts of my system spark ideas that will work well for you.",label_sentences__4_25_21_1000_
yes,"The tangle of stained glass held onto the heavy plate glass with one heavy, undulating line of lead and each apple, each grape and even the leaves of stained glass were molded in the most exquisite bas-relief.",label_sentences__4_25_21_1000_
no,"We're growing in New Zealand,' or like a certain industry, 'We're trying to grow in Biotech or Pharm?'Scott Mordell:",label_sentences__4_25_21_1000_
yes,How many of us can remember using a stick to measure how much gas we have left?,label_sentences__4_25_21_1000_
no,Another indicator that his preparation didn't end on move 10 is that he played the next 6 moves in an instant.,label_sentences__4_25_21_1000_
yes,Most times to effectively launch something you want to plan for around four weeks.,label_sentences__4_25_21_1000_
yes,It still makes sense to aggressively build up a financial cushion that can carry you through months - or even a year - if your client work slows.,label_sentences__4_25_21_1000_
yes,"That night, they snuggled under the same blanket they'd first kissed on and traced on each other's chest.",label_sentences__4_25_21_1000_
no,That video game that saved your life is your favorite because it gave you strength when you needed it the most.,label_sentences__4_25_21_1000_
yes,We drank wine that we normally wouldn't even think to order.,label_sentences__4_25_21_1000_
no,"It was an in-depth, thoughtful email, one of those that you can't expect, that only come around every once in a while.",label_sentences__4_25_21_1000_
no,"Your shadow contains things you do not want others to see, and things you do not want yourself to see.",label_sentences__4_25_21_1000_
yes,When you don't have to spend any time thinking 'what comes next' it's when you begin to enjoy your life.,label_sentences__4_25_21_1000_
no,When this happens I follow Eckhart Tolle's advice and shift my attention to the emotion.,label_sentences__4_25_21_1000_
no,"So if Kobe can be in the flow state on the basketball court, it should be easier for you when meditating in a quiet room, right?Here's Kobe Bryant from a 2019 interview with NBA player Jalen Rose - on playing in the zone.",label_sentences__4_25_21_1000_
yes,"Not only will you be more equipped to deliver results, but you'll also believe in your abilities.",label_sentences__4_25_21_1000_
yes,"Prematurely hiking will slow expansion and threaten to create another 'jobless recovery,' something the country can ill-afford.",label_sentences__4_25_21_1000_
no,all know that life after the pandemic will never be the same.,label_sentences__4_25_21_1000_
yes,The concept popularized by Eric Reis in the book Lean Startup is great for companies entering an entirely new market where they lack existing products and customers.,label_sentences__4_25_21_1000_
yes,And what did it matter what I said about the mattress?,label_sentences__4_25_21_1000_
yes,"Once past the basics of reading and number sense, which generally solidify by 8th grade in most people, skills and knowledge fracture and diverge.",label_sentences__4_25_21_1000_
no,The study focussed on an FRB source first detected in 2018 by the CHIME radio telescope in British Columbia.,label_sentences__4_25_21_1000_
no,21 Savage was in the room.,label_sentences__4_25_21_1000_
yes,"As Dr. Amen says, 'the best mental exercises involve acquiring new knowledge and doing things you haven't done before.'",label_sentences__4_25_21_1000_
no,"Don't think that when you turn it on it will blow out residual particles waiting to infect,' he says.",label_sentences__4_25_21_1000_
yes,Choosing to increase your goal isn't a decision to be made lightly.,label_sentences__4_25_21_1000_
no,"For a moment, I even think I'm hearing seagulls.",label_sentences__4_25_21_1000_
yes,It equally means that I can't just sit down in front of a text editor and write about whatever comes to mind.,label_sentences__4_25_21_1000_
yes,Dr. Smith long served as a spokesman for the head of the Central Intelligence Agency's (CIA's) ',label_sentences__4_25_21_1000_
yes,"He took a step outside the formation, fixed me with a sideways glance and said, 'Watch what he does when I ask him if he is ready for school.",label_sentences__4_25_21_1000_
no,"You get the idea, but if not feel free to check the Twitter feed.",label_sentences__4_25_21_1000_
no,"He didn't even know what he would do when he got to the other side because he didn't know what to expect, but if the experience lasted only a night or the rest of his life, it would be worth it.",label_sentences__4_25_21_1000_
yes,"I built that dream, and I can take it apart.",label_sentences__4_25_21_1000_
no,"But if they don't know you, they might not quite tell you enough at first... or give you the context needed to understand the nature of the problem.",label_sentences__4_25_21_1000_
yes,No one ever got fired for failing to keep their lead records up to date.,label_sentences__4_25_21_1000_
no,following chart shows the overall flow for sharing content to Instagram.,label_sentences__4_25_21_1000_
yes,Plants are also incredibly important for purifying the space and adding comfort.,label_sentences__4_25_21_1000_
yes,"Learn a little bit of the language, and you'll see the real Turkey, far away from negative media portrayals and politics.",label_sentences__4_25_21_1000_
no,"I recommend taking to see quickly and easily, if the field is something to move into.",label_sentences__4_25_21_1000_
yes,"Coming to think about it, being a great comedian means being a good observer and a good storyteller.",label_sentences__4_25_21_1000_
no,"And who doesn't love ABBA?'He hated ABBA.Marcel sighed again, but this time there was truth laced within his exhale.",label_sentences__4_25_21_1000_
yes,"He too fails to note that Ferguson's predictions were well within the bounds of other models and in broad accordance with the reality of what has actually happened - 34,636 confirmed deaths from COVID-19 in the U.K. in two months, and likely about 20,000 more.",label_sentences__4_25_21_1000_
no,"Netflix's own outlook on the US market isn't too optimistic either, they think it maybe, might be just possible, if the stars align and everything is perfect - to get another 30 million households.",label_sentences__4_25_21_1000_
yes,I entered my room and climbed up on the windowsill looking out the window at the parking lot below.,label_sentences__4_25_21_1000_
yes,Chilling a rental house will theoretically mean the virus can live longer on cloth or plastic or counters.,label_sentences__4_25_21_1000_
yes,"This work takes time, patience, and a heck of a lot of emotional intelligence.",label_sentences__4_25_21_1000_
yes,"It's an evolutionary asset that has allowed us to form communities, protect ourselves against enemies, and navigate a world that is growing more and more distant and complex by the day.",label_sentences__4_25_21_1000_
no,"Whatever happens next, in both scenarios - a conflict between the centralists and the decentralists or the collapse of the 'stonks going up' machine - our fate has been decided.",label_sentences__4_25_21_1000_
yes,"What do Seth Godin, Pablo Picasso, and Johann Sebastian Bach all have in common?",label_sentences__4_25_21_1000_
yes,"So whatever is happening right now that is not going well, the learning from it will support my future growth.",label_sentences__4_25_21_1000_
no,"I guess I didn't look too good on that final ascent,",label_sentences__4_25_21_1000_
no,"No matter how they curate and how many shows there are, people are always going to be unsatisfied with selection.",label_sentences__4_25_21_1000_
yes,"By insisting on using an outfitter that provides fair and ethical treatment for their porters, camp cooks, and guides, a traveler has the power to affect lasting change.",label_sentences__4_25_21_1000_
yes,The user does not need to rediscover the video they were watching.,label_sentences__4_25_21_1000_
no,"no, I can't be content giving up this dream forever, and no, I can't even be fully me without trying -",label_sentences__4_25_21_1000_
no,"now (we will call this the immediate reward), but it would rather maximize the rewards he receives across all the interactions he has now and has with the environment in the future.",label_sentences__4_25_21_1000_
yes,"Our relationship wasn't the best for a variety of reasons, but one particular argument came to a head and",label_sentences__4_25_21_1000_
yes,"You 100% have the right to feel upset, but don't let that opportunity go to waste.",label_sentences__4_25_21_1000_
yes,"Since your final aim is to create a product that will be in high demand, you need to know precisely what user issues you are going to resolve.",label_sentences__4_25_21_1000_
yes,The spreadsheet format met my needs better than a JSON format would have.,label_sentences__4_25_21_1000_
yes,"Before we are students, employees, leaders, CEO's or business-owners, we are human.",label_sentences__4_25_21_1000_
no,"And as we saw with finding four-leaf clovers, your RAS can give you laser-sharp focus once it knows exactly what you're looking for.",label_sentences__4_25_21_1000_
yes,"I am a writer (3 published books, plus over a hundred articles at Medium).",label_sentences__4_25_21_1000_
no,"There is another trial next month, in the death of Ahmaud Arbery, who was killed while jogging in Georgia in February 2020.",label_sentences__4_25_21_1000_
yes,We were all in high spirits and the banter among us took the edge off the fear throughout the day.,label_sentences__4_25_21_1000_
yes,Transform matrix normalizes warp face area.,label_sentences__4_25_21_1000_
no,"So scrupulous, in fact, that one teacher told me that she washed her hands so often now",label_sentences__4_25_21_1000_
yes,"At the same time, there are thousands upon thousands of companies (and speculators) who own contracts set to expire in a day.",label_sentences__4_25_21_1000_
no,"It became something important, and permanent.",label_sentences__4_25_21_1000_
no,I just needed to place an emergency order with you for this morning.',label_sentences__4_25_21_1000_
yes,"Chris doubled down: 'The claim of being sapiosexual and the extremely overused quote I think mostly attributed to Marilyn Monroe about 'if you can't handle me at my worst, then you don't deserve me at my best' make me want to throw my phone in a toilet.",label_sentences__4_25_21_1000_
yes,"The maximum length of a TikTok video is 60 seconds, but most trending videos are shorter.",label_sentences__4_25_21_1000_
no,"When the restrictions are lowered, we will make sure to fully experience all that this route has to offer.",label_sentences__4_25_21_1000_
yes,Philanthropy is far from being a purely altruistic effort.,label_sentences__4_25_21_1000_
yes,"In this new different, global communities are acknowledged and differences are leveraged rather than obliterated; education about specific and sometimes conflicting histories and actions taken are dispersed; concrete innovative strategies are developed based on research to re-imagine a world where everyone can thrive.",label_sentences__4_25_21_1000_
no,"Characterised by textured stone walls, tactile wood paneling and simple yet rustic design, Josephus is an elegant modern alpine lodge.",label_sentences__4_25_21_1000_
no,"the materials they buy will help the economy heal itself, lifting us all.",label_sentences__4_25_21_1000_
yes,I did extensive research and taught myself from the ground up -,label_sentences__4_25_21_1000_
no,"As a former teacher, I was used to someone telling me where I had to be, when I had to be there, and what I had to do while I was there.",label_sentences__4_25_21_1000_
yes,"So if I'm writing for $200 per piece, then the rate would be $20/hour.",label_sentences__4_25_21_1000_
no,"The President stated there would be testing done at several major chains such as Target, Walmart and CVS.",label_sentences__4_25_21_1000_
yes,They have just taken time out to help you-by dropping them a simple reply saying 'thank you' you'll build the relationship and vastly increase the potential for future sales.,label_sentences__4_25_21_1000_
yes,I don't want to share anything fancy with you guys at this point and make this blog lengthy and complicated.,label_sentences__4_25_21_1000_
yes,"In ring species, each population in the geographical ring can breed with its neighbors, but populations separated by one or more populations cannot.",label_sentences__4_25_21_1000_
no,"Instead, divinity was very much alive and well in everything that exists within our world.",label_sentences__4_25_21_1000_
yes,"If you want more direct startup answers, look into Teaching Startup.",label_sentences__4_25_21_1000_
no,"However, that didn't stop me from trying.",label_sentences__4_25_21_1000_
no,Here are a few ways to do it:,label_sentences__4_25_21_1000_
yes,"We quickly validated Noto Sans through testing on our homepage, and began implementing it into our product design system.",label_sentences__4_25_21_1000_
no,I've got all the answers for you.,label_sentences__4_25_21_1000_
yes,"When we considered how to approach ML Ops, we knew that we would soon have to put a lot of machine learning models in production, in particular recommender systems and natural language processing systems.",label_sentences__4_25_21_1000_
no,That's their answer to our problems.,label_sentences__4_25_21_1000_
yes,"She replied, 'for designers to keep tech feasibility in mind, I would advise to keep in mind the flow and keep it as simple as possible in UI and flow.",label_sentences__4_25_21_1000_
no,"how, within your existing model, can you engage customers in ways that are more contextually relevant, more timely, and ultimately, more valuable?That's not about channels or technology, or campaigns for that matter, so you'll need a transformation of mindsets.",label_sentences__4_25_21_1000_
no,"I was going to use this time for the best, and get the most out of it possible.",label_sentences__4_25_21_1000_
yes,"However, it was a radical new approach to teaching the subject; an ambitious attempt to modernise an outdated math curriculum with an enlightened emphasis on understanding rather than rote memorization.",label_sentences__4_25_21_1000_
yes,"Now, you may be thinking, 'Okay, if my friend didn't ask me about my life just because they've seen my Instagram updates, they're not really my friend.'",label_sentences__4_25_21_1000_
yes,The key to a water bear's survival is all but shutting down its life processes and metabolism and desiccating whilst maintaining its cellular structure.,label_sentences__4_25_21_1000_
yes,"As the way Facebook functioned and the way people used it changed over the years, new friends no longer reached out.",label_sentences__4_25_21_1000_
yes,"Suddenly she was beside him, he wanted to lie close to her, wanted to feel her body against his.",label_sentences__4_25_21_1000_
yes,"You then create a store with something like Shopify and when someone buys something from your store, your provider will print, package and ship your order without you having to do anything.",label_sentences__4_25_21_1000_
no,That's what repurposing content can do for you.,label_sentences__4_25_21_1000_
yes,It is a simple matter to receive a vaccine in early childhood to prevent more serious and possibly fatal diseases.,label_sentences__4_25_21_1000_
no,(Ours is still the best - don't get it twisted.),label_sentences__4_25_21_1000_
no,This makes it a brilliant place to explore in full.,label_sentences__4_25_21_1000_
no,This article is for all of the impatient people out there.,label_sentences__4_25_21_1000_
yes,It's during this transitional moment that we need to develop the skill and confidence to welcome this scary journey.,label_sentences__4_25_21_1000_
yes,"As kids, we all probably exchanged one thing for another thing that we thought was more valuable to us than what we had at that particular time; I, in particular, exchanged toys that I didn't like or I have gotten tired of.",label_sentences__4_25_21_1000_
yes,"People here love sitting out on these patios that jut out into the street, eating and drinking and talking.",label_sentences__4_25_21_1000_
yes,Her video has been watched by billions of people; it led to an explosion of social justice activism unmatched in this country for decades.,label_sentences__4_25_21_1000_
yes,"In order to use date-time data, we have extracted the relevant year in which the user became the member and we will use this year as a categorical variable.",label_sentences__4_25_21_1000_
no,Many people will tell you to 'write only what you know.',label_sentences__4_25_21_1000_
yes,"When I began to reach out to people this time around, I knew that I had to acknowledge their pain rather than washing my hands of it.",label_sentences__4_25_21_1000_
yes,"The pandemic effectively put the world on hold, prompting the need for proper health precautions.",label_sentences__4_25_21_1000_
yes,"'If I can develop something with AI that might reasonably predict someone's likelihood of defaulting on a payment, is that something we should be doing?",label_sentences__4_25_21_1000_
yes,The rain was pouring down and there were bursts of lightning amongst rumbles of thunder.,label_sentences__4_25_21_1000_
yes,"Not only can we increase the basic income, but we must increase the basic income to bring it to its new natural level.",label_sentences__4_25_21_1000_
yes,"However, there is one lesser-understood ally hidden in the midst of our new normal, and that's artificial intelligence (AI).",label_sentences__4_25_21_1000_
no,The first language switch toggle button was as follows.,label_sentences__4_25_21_1000_
yes,"Indeed, usually for a WGS project, we can afford to sequence around ~1000 samples (see e.g. 1000 genomes project), while we discover millions of mutational differences across individual genomes, so the feature space is million-dimensional.",label_sentences__4_25_21_1000_
no,"One that redefines leadership as the quality of empowering others, such that it reduces the inequality .Most",label_sentences__4_25_21_1000_
yes,"For RNA-seq data, this means using RNA that has a high RIN value to avoid the RNA degradation problem.",label_sentences__4_25_21_1000_
no,Dan Brotzel is author of Hotel du Jack (Sandstone Press) and Work in Progress (Unbound),label_sentences__4_25_21_1000_
yes,"In the article, he supports the idea that modular design systems can scale better, make design faster, and be less likely to fail.",label_sentences__4_25_21_1000_
no,Why isn't this counterargument gaining traction?,label_sentences__4_25_21_1000_
yes,These digital technologies and COVID-19 are going to accelerate technological adoption which will destroy jobs and lead to unemployment and a dearth of high paying jobs.,label_sentences__4_25_21_1000_
no,"Each of those entries has 10, 50, 100, 500 likes and retweets.",label_sentences__4_25_21_1000_
yes,The multi-tasking costs arise from shared bottlenecks in cognitive processing.,label_sentences__4_25_21_1000_
yes,"Depending on what we wanted to know, there are many improvements that could be made over simply showing the summary plot above.",label_sentences__4_25_21_1000_
yes,"the anesthesiologist looked at my masked face hesitantly, and I wondered to myself what the bottom half of his face looked like.",label_sentences__4_25_21_1000_
yes,I can take advantage of their comfort and interest in the platform they select to discuss with them how they will share the data most efficiently in that mode and for that audience.,label_sentences__4_25_21_1000_
yes,There is no point blaming anyone.,label_sentences__4_25_21_1000_
yes,"Apparently, discussing the strategy of a company in which you have ownership is micromanaging?",label_sentences__4_25_21_1000_
yes,We may be wrong or weird at times but that is entirely normal.,label_sentences__4_25_21_1000_
yes,"This endeavor is the continuation of their previous research, where they created liquid-coated nanorobots that could be remotely propelled through the jelly-like fluid of the eye.",label_sentences__4_25_21_1000_
no,but I am going to focus on the two that have given me results so far to keep it simple and stay on course.,label_sentences__4_25_21_1000_
yes,"Suppressing the memory, he unbuckled himself and sat next to Lottie, putting his arm around her.",label_sentences__4_25_21_1000_
no,but it takes too long to execute (,label_sentences__4_25_21_1000_
yes,"Suddenly, I smelled the fresh pastries from a bakery on the corner.",label_sentences__4_25_21_1000_
yes,It takes time for scientists to fully understand something.,label_sentences__4_25_21_1000_
yes,Focused groups can provide help with specific issues of that demographic.,label_sentences__4_25_21_1000_
