Text,Tag
"As you're inhaling, think to yourself'Breathing in, I am aware of my in-breath.",no
"it was something else - a little sprout of confidence, a boldness that bloomed within me from years of my avid jet-setting lifestyle.",yes
And I'm not saying that all the characters have to be date-able to all genders.,yes
"Barnum states, 'there's no complete national data yet - that will take years, if it ever comes.",yes
It's unclear whether Facebook's own vaccine guidelines are capable of navigating these nuances.,no
"It relates to the first misconception about UX, 'They just draw boxes on pages,",no
"Foreo's UFO™, for example, integrates thermotherapy, cryotherapy, chromotherapy.",yes
"Mark WilsonIt's easy to forget that before Jony Ive remade Apple's aesthetic in cool aluminum during the mid-aughts, the company's design comeback actually started in 1998, with the...",no
"If this just doesn't seem possible to do in your situation, then you may need to reflect on whether you're in the right place.",yes
Which means I will have to make sacrifices somewhere.,yes
", you can see that the puzzle isn't as clear cut as Elon makes it out to be, and that he makes some astonishing assumptions and leaps to come to his conclusion.",no
Then we can go to a country like Italy.,no
"Guth proposed inflation, a gigantic and near instantaneous leap from near nothingness to space, time, matter and energy suddenly becoming gargantuan.",yes
market!The research stands to highlight the fact that even supposedly 'fringe' phenomena like synesthesia offer valuable information about the pressures that shaped the development of our minds.,no
What if I can only ask questions in a biased way because my vocabulary is limited?Thankfully the project went well.,yes
Every creature will be tested and re-tested because the environment includes not just the weather and the terrain but competitive fellow creatures.,yes
"Generally, the first requirement of this process is for the company to determine the minimum actual requirements for the role that is the subject of the Green Card filing.",yes
They don't leave their results to chance or luck.,yes
"There are devices scattered all over the place, however, that can be struck with arrows to turn the tides of battle.",yes
"You can normally deduct 100% of the cost, provided the services are exclusively for your freelance business.",yes
