Tag,Text,Markers
yes,"Instead, try:As a place to start, teams can review usability feedback from users with disabilities together, acquaint themselves with the assistive tech available on the devices they support, and look at any reported issues for their product.",label_sentences__4_25_21_1000_
no,Those things are a part of yourself.,label_sentences__4_25_21_1000_
no,YPO has a lot of those.,label_sentences__4_25_21_1000_
yes,I knew that I wasn't alone.,label_sentences__4_25_21_1000_
no,Boo chases Mario if Mario is not facing Boo.,label_sentences__4_25_21_1000_
yes,"When you forget the user in your purchase decision, you're far more likely to wind up with software that has terrible UX.",label_sentences__4_25_21_1000_
yes,Do we revert all the above when things 'return to normal'?There are more questions than answers at this stage.,label_sentences__4_25_21_1000_
no,"so we may better understand ourselves and how we react to situations and relationships, for the future.",label_sentences__4_25_21_1000_
no,But who on earth thought they should enter right after that?,label_sentences__4_25_21_1000_
no,so they're not popping up every day.,label_sentences__4_25_21_1000_
yes,Keep in mind that gifted learners are born with their gift so they will probably start standing out and advancing at a very young age.,label_sentences__4_25_21_1000_
no,and I was one of them.,label_sentences__4_25_21_1000_
no,Those two people aren't the same.,label_sentences__4_25_21_1000_
no,This keeps things simpler for you.,label_sentences__4_25_21_1000_
no,"This was true in Alicia's experience, too.",label_sentences__4_25_21_1000_
yes,He hopped down the three steps from her front door to the pavement and began to cry.,label_sentences__4_25_21_1000_
no,it's easy to see that it's not indomitable.,label_sentences__4_25_21_1000_
no,This sounded logical to us in our 'tropo' state.,label_sentences__4_25_21_1000_
yes,We think we can build more trust with our users if they actually see what they get in return.,label_sentences__4_25_21_1000_
yes,It might seem easy to perform manually but suppose you have 200-300 features.,label_sentences__4_25_21_1000_
yes,A single wrong-handed molecule in DNA can destroy its spiral structure.,label_sentences__4_25_21_1000_
yes,"Students get excited about learning, develop critical thinking skills, gain a sense of autonomy, and become self-managed, independent learners.",label_sentences__4_25_21_1000_
yes,"And as you can probably imagine, I've had plenty of time for contemplation lately.",label_sentences__4_25_21_1000_
no,"Maybe the really good candidates sleep late, or have morning classes, or something.",label_sentences__4_25_21_1000_
yes,"In addition, the survey noted that one of these major obstacles is often compounded by the other, making this a very concerning one-two punch for corporate counsel.",label_sentences__4_25_21_1000_
no,"To illustrate this point, I will use myself as an example.",label_sentences__4_25_21_1000_
yes,One of the most revolting aspects of the COVID-19 pandemic in the United States is the vastly unequal impact it has had on different communities.,label_sentences__4_25_21_1000_
yes,At the heart of the EQ is the idea that control over one's own emotions starts with the ability to perceive them.,label_sentences__4_25_21_1000_
yes,The bad thing is that the property has only one bedroom.,label_sentences__4_25_21_1000_
yes,"If you are interested in a detailed comparison of the two roles, you can find them in the remainder of the article.",label_sentences__4_25_21_1000_
yes,"My assessment matters as a first step, but only a first step.",label_sentences__4_25_21_1000_
yes,"Pretty much like a kaiseki meal, microlearning essentially means delivering your content in small units, each one clearly targeting a specific learning objective, either knowledge or skill-related.",label_sentences__4_25_21_1000_
no,"The purpose of a market, after all, is to find the right price for an asset whether that's a barrel of oil, a carton of frozen orange juice, or a share of Amazon, Netflix, or J.C Penney.",label_sentences__4_25_21_1000_
no,"As we drank our first untaxed beer, we talked about how our newly acquired motorcycle driving skills had been put to the test.",label_sentences__4_25_21_1000_
no,If it is not a perfect fit - we never lie -,label_sentences__4_25_21_1000_
yes,"Fortunately, you're not broken, so there's really nothing to fix.",label_sentences__4_25_21_1000_
yes,"When I was growing up, in pop culture the archetypal hero was male, yoked as hell, infinitely cool under pressure, and his strength was exhibited by his willingness to deploy effective violence and brutality against his enemies.",label_sentences__4_25_21_1000_
no,"Most importantly, every single one of them had a problem they wanted to solve.",label_sentences__4_25_21_1000_
yes,What if I blinked harder with one eye than the other?,label_sentences__4_25_21_1000_
yes,"We are implicitly promised that the more we invest into the product, the better the experience will become in the long run.",label_sentences__4_25_21_1000_
no,are now on top of each other as putting them side by side would make the UI seem very cramped.,label_sentences__4_25_21_1000_
yes,"Depending on how they have grown up, they can accept another human as part of their family.",label_sentences__4_25_21_1000_
no,There's really never a dull moment in Dark Souls 2 for this reason.,label_sentences__4_25_21_1000_
yes,I decided to take her up on her offer as a guide and companion to a very challenging locale as a last hurrah in the wild.,label_sentences__4_25_21_1000_
no,You'll also want to copy the contents of the latest version of D3.js and paste them into a .js file in your text editor.,label_sentences__4_25_21_1000_
yes,"'Well, we're a bookstore,' Camden replies. '",label_sentences__4_25_21_1000_
no,"For people thinking the public was being too sensitive, consider the idea of waking up in a haze not knowing what happened, and then realizing you'd been violated.",label_sentences__4_25_21_1000_
yes,"However, reading some of these arguments against university made me realise how much benefit I got from further education.",label_sentences__4_25_21_1000_
no,But that was ok because I had found a wasp nest hanging from the eave of the abandoned shed near school.,label_sentences__4_25_21_1000_
yes,You may also notice that the values in the scikit-learn implementation range between 0 and 1 and not exactly the value we got with your simplified version of the formula.,label_sentences__4_25_21_1000_
yes,"Some unexpected thing came up, and so my son I rarely saw spent the day with me at work, waiting, and bored.",label_sentences__4_25_21_1000_
yes,"Happiness is the end goal for every project, but money does matter.",label_sentences__4_25_21_1000_
yes,"The threading approach can be deemed more dangerous because the switching between the threads can happen at any time, even in the middle of a statement execution due to the pre-emptive multitasking, whereas asyncio tasks signal themselves when they are ready to switch over -a mechanism that is known as cooperative multitasking.",label_sentences__4_25_21_1000_
yes,The tightly built Apple EcoSystem simply works.,label_sentences__4_25_21_1000_
no,Cluster 3 represents stores that are priced very low and are under-performing.,label_sentences__4_25_21_1000_
no,I can't truly share their feelings.,label_sentences__4_25_21_1000_
yes,"SAFe Scrum Masters foster an environment for high-performing team dynamics, continuous flow, and relentless improvement.",label_sentences__4_25_21_1000_
yes,All this did was help in showing that ByteDance has more robust censorship policies than many of its counterparts.,label_sentences__4_25_21_1000_
yes,"The process is called neuroplasticity, and it's your brain's ability to rewire itself according to your daily experience - in particular, what you learn.",label_sentences__4_25_21_1000_
no,"are so many lighthouses in Maine; you have to see Pemaquid and Portland Head Lighthouse, though.",label_sentences__4_25_21_1000_
yes,A new social science now wants to put data at the service of human innovation.,label_sentences__4_25_21_1000_
no,Synesthetes are among the top remote viewers in our nation and have served in its defense with their extraordinary senses.,label_sentences__4_25_21_1000_
yes,"This brings us to the notion of incommensurability - the idea that successive scientific theories are conceptually incompatible and logically disjoint, due to the change in the meanings of the observation statements used to test them.",label_sentences__4_25_21_1000_
yes,"You can be mindful and sad, angry, or frustrated.",label_sentences__4_25_21_1000_
no,Here's an example of a map depicting the differences regarding the Power Distance Index:,label_sentences__4_25_21_1000_
yes,It's hard to say: fixing social problems with apps seems ill-advised.,label_sentences__4_25_21_1000_
yes,I used the Frugal Strategy Canvas in over 40 workshops to help companies think and brainstorm in a systemic way about frugal innovation across it's value chain.,label_sentences__4_25_21_1000_
yes,"What are our users' biggest unmet needs, pains and motivations?'.",label_sentences__4_25_21_1000_
no,"1.78]If the resulting confidence interval contains 0, the difference in CSAT scores is not statistically significant (i.e., if the interval could be 0, it's possible that there's no real difference).",label_sentences__4_25_21_1000_
yes,"Instead of healing you, this hospital will reward you for harming your own party.",label_sentences__4_25_21_1000_
yes,"It wasn't a surprise when I found him amongst the ruins of my family's farm, surrounded by the still-burning carcasses of his brothers and sisters.",label_sentences__4_25_21_1000_
no,You'll notice that a lot of my boundaries are work-related but they don't have to be.,label_sentences__4_25_21_1000_
yes,"Moreno and Mali co-founded the spinoff company Navega Therapeutics to work on translating this gene therapy approach, which they developed at UC San Diego, into the clinic.",label_sentences__4_25_21_1000_
yes,"Since therapy is an ongoing thing, I'm hoping that I'll find the courage and the words to explain myself better to my therapist.",label_sentences__4_25_21_1000_
yes,I wasted a lot of people's money and time trying to help me out of my abusive marriage or get me off drugs.,label_sentences__4_25_21_1000_
yes,And the blame goes to a virus.,label_sentences__4_25_21_1000_
yes,Dropshipping includes collaborating with a wholesaler or dealer who provides this service.,label_sentences__4_25_21_1000_
no,"But until the agency does so, its results will be suspect and difficult to interpret, says William Hanage, an epidemiology professor at Harvard.",label_sentences__4_25_21_1000_
yes,"If we're going to create this safe space for people to truly be with peers, it's important that they be peers and we don't apologize for that.",label_sentences__4_25_21_1000_
yes,It's natural to pine for the bygone days of concerts and movie theaters and sitting down to eat at an actual restaurant.,label_sentences__4_25_21_1000_
yes,"The U.S. alone spends $800 billion in commissions to salespeople annually and, for many teams, the process around figuring out who earned what in a given period remains highly manual and error-prone.",label_sentences__4_25_21_1000_
yes,Every culture has their own checklist for attributes of a great addition and red flags that signal who may not be a great match.,label_sentences__4_25_21_1000_
no,"A partner, on the other hand, is constantly looking for opportunities to go the extra mile.",label_sentences__4_25_21_1000_
yes,"The strategy here is quite simple: you need to have people visit your profile, and hopefully, some of them will end up following you and start engaging with what you do.",label_sentences__4_25_21_1000_
yes,How did you deal with that?'I certainly have been in many places where people don't understand me - and not just places that are non-English speaking.,label_sentences__4_25_21_1000_
no,"To use it, you need to type one broad keyword, and the tool will give you suggestions based on it.",label_sentences__4_25_21_1000_
yes,"this very day, Rex was happy with me on arrival: he shook his tail and jumped on me like he used to, ran to the gate and back and barked with vigour to announce my presence.",label_sentences__4_25_21_1000_
yes,"From Black Lives Matter to the MeToo Movement, there's been a long overdue discourse shift on social justice issues that has brought awareness and action to some of our deepest and most painful conflicts we face as Americans.",label_sentences__4_25_21_1000_
yes,GPT-3 is great at combining text that it has found somewhere else on the web making it a sort of huge varied scrapbook made from a vast number of bits of text that it points together in unusual and impressive manners on request.,label_sentences__4_25_21_1000_
no,"So why is it that when white parents support reopening it's racist and we don't care about Black and Brown kids (which, PS, my own kid isn't white!), but when mostly white teachers unions advocate for their interests, they're representing what Black and brown families want?",label_sentences__4_25_21_1000_
yes,"As reported by Nikkei Asia, Yoshiro Mori said that board meetings with women 'take so much time' and 'Women have a strong sense of competition.",label_sentences__4_25_21_1000_
yes,She stopped leaving me breakfast before she left.,label_sentences__4_25_21_1000_
no,"Was it magic, wrote the reporter, or merely a skilful conjuring trick?Neither.",label_sentences__4_25_21_1000_
no,"this, the story definitely came after the general mechanics and idea for the game.",label_sentences__4_25_21_1000_
yes,"Today, we generally need a physical sample of a suspected cancer, with the tissue removed by a biopsy or surgically.",label_sentences__4_25_21_1000_
no,or when you take money out in retirement (ROTH accounts).,label_sentences__4_25_21_1000_
yes,"They were there during the Red Summer of 1919, stringing up people of color.",label_sentences__4_25_21_1000_
no,Don't know what deep learning is?,label_sentences__4_25_21_1000_
yes,He is passionate about design and sharing his experience with others in the field.,label_sentences__4_25_21_1000_
no,How I Quit My Job to Travel the World for 1-Year,label_sentences__4_25_21_1000_
yes,Teaching is taking a step back in time.,label_sentences__4_25_21_1000_
yes,"Second, there is the classification report that provides at a glance the classification results per class value.",label_sentences__4_25_21_1000_
no,"Tell me here!This article first appeared on the UserLeap blog, where we post regularly about using customer insights to build better product experiences.",label_sentences__4_25_21_1000_
yes,"Isabella asked, noting the cupid's bow of Toni's lips.",label_sentences__4_25_21_1000_
no,Economists call them 'low-income service jobs.',label_sentences__4_25_21_1000_
no,and I still feel like I've barely scratched the surface of the timeless art which is housed here.,label_sentences__4_25_21_1000_
yes,It is dissonant and in conflict with living a peaceful life.,label_sentences__4_25_21_1000_
yes,The FAA is Challenging Kids to Build Airports on Minecraft,label_sentences__4_25_21_1000_
no,It's a way to rewire how your brain works in general.,label_sentences__4_25_21_1000_
yes,"The months before my dismissal, every time I asked for feedback, I would be given some general direction and a smile.",label_sentences__4_25_21_1000_
yes,Maren said their findings suggest that procedures currently used by clinicians to indirectly reactivate traumatic memories create an opportunity to change or eliminate them.,label_sentences__4_25_21_1000_
no,"The 4 Black History Month Projects We Most Dreaded as Kids, Ranked",label_sentences__4_25_21_1000_
yes,I also attached the RGB diffuser pieces to the plate before mounting it onto the PCB.,label_sentences__4_25_21_1000_
no,"doesn't it?Some may argue that this is just a result of globalization, a trait of a growing international economy.",label_sentences__4_25_21_1000_
yes,Tom Monaghan started Dominos with one location in 1960.,label_sentences__4_25_21_1000_
yes,"Once a year, I visited classes and gave a little speech to drum up interest among college seniors and graduate students.",label_sentences__4_25_21_1000_
yes,"We cleaned out our pantries, finally.",label_sentences__4_25_21_1000_
yes,"On the surface level, most participants answer your question directly because our level of information recall during nervous situations are poor.",label_sentences__4_25_21_1000_
no,"They wouldn't dare miss a day when they feel so liberated, whole, and as Dr. Joe Dispenza often says, unlimited.",label_sentences__4_25_21_1000_
yes,One must remember that the sample preparation method has significant bearing on the overall RIN/sequence data quality relationship.,label_sentences__4_25_21_1000_
no,There are certain UX and visualization guiding principles that you can follow that were shared by Gary Stewart:,label_sentences__4_25_21_1000_
yes,"Help isn't coming, you need to be the big damn hero in your own life.",label_sentences__4_25_21_1000_
yes,"My eyes went wide, and I ran out of the front door.",label_sentences__4_25_21_1000_
yes,There's no need to fill the silence with conversation - the chirping of the cicadas does that for us.,label_sentences__4_25_21_1000_
yes,"Regardless of the event and the fight where you want to see and cheer your favorite star, both the platforms are indeed useful as they are a source of livelihood for their creators depending on the choice of the subject they want to pursue.",label_sentences__4_25_21_1000_
yes,"I had four drinks, all mixed, none especially strong.",label_sentences__4_25_21_1000_
no,That is a great way of putting customers and their needs first.,label_sentences__4_25_21_1000_
no,This has also been a time when we are all permitted to be a bit more raw and a lot more human.,label_sentences__4_25_21_1000_
no,This is why running a pilot testing is so important.,label_sentences__4_25_21_1000_
no,(but those depend heavily on the in-class time with the teacher to complement the lecture vods).Educators have been thrust into uncharted territory.,label_sentences__4_25_21_1000_
no,"When I argue, I want to be teachable and, on occasion, say, 'Good point.",label_sentences__4_25_21_1000_
no,"Or a bad one, depending on how you feel about dim sum shaped contusions on your shinbone.",label_sentences__4_25_21_1000_
yes,I'm hoping Harry's doctor reads this.,label_sentences__4_25_21_1000_
no,"But to be honest, Microcopy has a significant influence on the quality of user experienceFirst, you need to define your brand.",label_sentences__4_25_21_1000_
yes,"With the outspread on social media, we often get lost in our loopholes in a sea of false information.",label_sentences__4_25_21_1000_
yes,They are more inclined to use social media to get information.,label_sentences__4_25_21_1000_
no,https://stats.stackexchange.com/questions/166812/why-add-one-in-inverse-document-frequency):Notice that there are several terms in this equation,label_sentences__4_25_21_1000_
yes,"At the beginning of the second wave, the vital question in Italy then was: is this system as effective as a harsh lockdown?",label_sentences__4_25_21_1000_
yes,You can always pause your videos during the recording process and switch from one camera to the other.,label_sentences__4_25_21_1000_
yes,"For example, if a store manager is convinced his store cannot handle a price increase and your model says it is prime for one, I wouldn't go as big as I would if the store manager was indifferent or advocating strongly for a price increase.",label_sentences__4_25_21_1000_
yes,"Bowser's thundering attacks on the cat islands can be utilized to unlock new areas and, in turn, new Cat Shines, but there's another massive feature that Nintendo introduced to make this game like no other: a catastrophic duel between Cat Mario and Corrupted Bowser.",label_sentences__4_25_21_1000_
yes,There's no pressure to do something if you're doing it for yourself.,label_sentences__4_25_21_1000_
yes,"Nevertheless today, in a world of monolithic, fragile black crystals and rogue copies, Hakkens' Phonebloks concept is still a beacon for a deeper and truly-radical design, capable of dealing with how things work, instead of being superficially satisfied with how things look like.",label_sentences__4_25_21_1000_
yes,These sectors required an ad hoc mix of low-interest loans and grants to make it through the pandemic.,label_sentences__4_25_21_1000_
yes,"In the distance, he saw a bus roaring down the bus lane closest to the curb of the sidewalk.",label_sentences__4_25_21_1000_
no,"Landry, however, says that a 'people versus the market' narrative is false. '",label_sentences__4_25_21_1000_
yes,"Intuition is more right than wrong, it's a gift and is our desire to protect the possibilities instead of accepting the probabilities.",label_sentences__4_25_21_1000_
no,"At first, it seems like a harmless TikTok video - a bit funny but mostly cringe.",label_sentences__4_25_21_1000_
yes,"I became the Chief Diversity Officer reporting to the President after serving on the faculty and in other administrative roles, and then about a year into that role at Tufts, we won a few DEI national awards.",label_sentences__4_25_21_1000_
no,"I had to, of course, return that copy of the book, but one part always stuck out to me",label_sentences__4_25_21_1000_
yes,I was in sweatpants and barefoot.,label_sentences__4_25_21_1000_
yes,"Understandably, the exchange is a hypothetical 'happy path' in negotiation.",label_sentences__4_25_21_1000_
yes,"That is, after all, something actual politicians do a lot of - even more, in fact, than they do debates or mudslinging.",label_sentences__4_25_21_1000_
yes,"Because, joy is what all of our children need.",label_sentences__4_25_21_1000_
no,(B) Examples of the trait-evaluation task completed while participants underwent functional magnetic resonance imaging.,label_sentences__4_25_21_1000_
no,There are also lots of tools to stop you faffing on your computer too - here's a useful list.,label_sentences__4_25_21_1000_
no,(you are probably already imagining horrible math calculations).It,label_sentences__4_25_21_1000_
no,"Most of the time it works, but not everyone adheres to the FTC rules and we are left wondering how to get rid of that annoyance.",label_sentences__4_25_21_1000_
yes,"However, the game changer was the introduction of spell-check in the mid 1980s.",label_sentences__4_25_21_1000_
no,Here are the three most important takeaways I took away from her memoir,label_sentences__4_25_21_1000_
no,The kind of alone he couldn't seem to escape.,label_sentences__4_25_21_1000_
yes,"If you're trying to pivot your team to a more product-led way of working, ditch the Gantt chart, and use a now-next-future format for your roadmap.",label_sentences__4_25_21_1000_
no,"The hours passed, to Marcel they ground with the insistent sound of 70s",label_sentences__4_25_21_1000_
yes,"It is in this context that I came across a recent report opening the door to earlier detection of cancer, through finding microbial DNA in the bloodstream.",label_sentences__4_25_21_1000_
no,"It was already going downhill for TikTok, but it was YouTube who gave an extra shove to speed things up.",label_sentences__4_25_21_1000_
no,"following the steps above, my friend can start earning money from her writing.",label_sentences__4_25_21_1000_
yes,"But that all changed in 1954, when Congress passed legislation that enabled developers to deduct capital depreciation at an expedited rate.",label_sentences__4_25_21_1000_
no,"That's a bit more difficult to grasp if you only speak one language or if you're never exposed to that,' Iara claims.",label_sentences__4_25_21_1000_
yes,The international life I lead right now is totally unrecognizable compared to anything I was daring to dream just a decade ago.,label_sentences__4_25_21_1000_
yes,Scientific progress was an escalating game of cat and mouse.,label_sentences__4_25_21_1000_
no,"If you love writing, you can work on it until you get to the level of these people.",label_sentences__4_25_21_1000_
no,Money Revolution Is Knocking at Your Door:,label_sentences__4_25_21_1000_
no,"It's a special occasion and so rare, especially today with our i-umbilical cords of information always at the ready.",label_sentences__4_25_21_1000_
yes,So I set a more specific goal: I want 5000 followers.,label_sentences__4_25_21_1000_
no,It's stubbly and soft and amazing.,label_sentences__4_25_21_1000_
no,"'Yes, in fact,' she said, 'in the first year of the pandemic, the 500 richest people in the world increased their wealth by $ 1.8 trillion, while 150 million more people ended up in extreme poverty.",label_sentences__4_25_21_1000_
yes,"Rather, focus on generating the most revenue you can as cash efficiently as possible.",label_sentences__4_25_21_1000_
no,"suppose that's factually true since the company had, indeed, only recently decided to take on investors.",label_sentences__4_25_21_1000_
no,"I should also note, though, that change goes beyond 'mechanisms'.",label_sentences__4_25_21_1000_
yes,we will take a look into the top 5 functionalities in the app that are facilitated by the advancements in AI and also have a look at the underlying AI research papers which we saw last year.,label_sentences__4_25_21_1000_
no,"Organoids have been reported for an assortment of organs, including the liver, kidney and, most controversially, the brain, along with others.",label_sentences__4_25_21_1000_
yes,Don't exchange your sanity and happiness for being able to pay your bills.,label_sentences__4_25_21_1000_
yes,"We are going to have research, surveys, learn from data, learn what works.",label_sentences__4_25_21_1000_
no,"I multiplied that daily budget by the number of days I planned to be there, which gave me a rough estimate for how much I needed.",label_sentences__4_25_21_1000_
