Tag,Text,Markers
yes,"This is certainly difficult to measure, but what is clear is that in such a situation, if a millionaire had to choose between eating or buying a Ferrari, I am sure he would choose eating.",label_sentences__4_25_21_1000_
yes,"I don't know how many of our society's problems are caused by or exacerbated by a lack of basic income, but let's find out.",label_sentences__4_25_21_1000_
yes,Got any other good books that you think that game designers could benefit from reading?,label_sentences__4_25_21_1000_
yes,Intuition is an innovator's biggest resource to fill the information gaps and make quick progress on ideas top down.,label_sentences__4_25_21_1000_
no,Both types of Scrum Masters are servant leaders and coaches for their team.,label_sentences__4_25_21_1000_
yes,A prepared culture builds confidence and calm in a chaotic world.,label_sentences__4_25_21_1000_
yes,Use index cards or sticky notes to break out of linear organization and think in a more three-dimensional way.,label_sentences__4_25_21_1000_
no,"As we sat in the car, I noticed my surroundings which were now clear as opposed to the blur of the car's speed.",label_sentences__4_25_21_1000_
no,"as we enter the holiday season, we get ever closer to entering a perfect storm of emotionally driven binge eating and mindless numbing.",label_sentences__4_25_21_1000_
no,"In the mentoring calls I conduct with students and those looking for a career transition, the two most frequently brought up questions",label_sentences__4_25_21_1000_
no,I felt totally at home in the crowds.,label_sentences__4_25_21_1000_
no,We can still work this out!',label_sentences__4_25_21_1000_
no,What it tells us:That leads us to...,label_sentences__4_25_21_1000_
yes,I spent days trawling through every harmless interaction on my nearly fifteen year old Facebook account.,label_sentences__4_25_21_1000_
yes,"Eventually, a collection of your thoughts and feelings can serve as a journal of reflection when thinking back on different stages of your life.",label_sentences__4_25_21_1000_
no,But there is nothing inherently liberatory about it.,label_sentences__4_25_21_1000_
no,And How They Can Improve Yours,label_sentences__4_25_21_1000_
no,And I think there's going to be more of that to come.,label_sentences__4_25_21_1000_
no,Everything else is just a prompt to get you to the starting line.,label_sentences__4_25_21_1000_
no,"In the United States, the 2018 the Survey of Household Economics and Decision making found that 40% of people could not afford an unexpected $400 expense (see link here).",label_sentences__4_25_21_1000_
no,"This is just, frankly, a strange argument.",label_sentences__4_25_21_1000_
yes,It's a problem in which we use a set of different areas to predict the median housing price within certain areas of Boston.,label_sentences__4_25_21_1000_
no,"More importantly, it makes for great whisky.",label_sentences__4_25_21_1000_
no,"To a far greater extent than the President, who's publicly now having reservations with providing more direct relief, preferring instead 'trickle down' stuff like payroll and capital gains tax cuts.",label_sentences__4_25_21_1000_
no,"This is the classic 'if it's not in the system, it doesn't exist' strategy.",label_sentences__4_25_21_1000_
no,"In Iran, unmarried women are not allowed to touch or talk to men in public, but they looked on with curiosity at our exchange.",label_sentences__4_25_21_1000_
yes,"As math teachers have always known, there is math everywhere and connected to everything, so there is no shortage of appropriate mathematical content to teach.",label_sentences__4_25_21_1000_
no,"In these cases, where the buildings are often tall, the vertical circulation is often designed as a core at the centre of the building, with stairs and lifts packed tightly together, and short corridors on each level leading away from this core to the individual apartments or offices.",label_sentences__4_25_21_1000_
yes,"While it does not cost much to make a YouTube video, reaching a stage with millions of subscribers requires having technical equipment and software that many people would not be able to afford.",label_sentences__4_25_21_1000_
no,"but I believe that if you use every tip that I have given you here, you can find all the time that you need and get your business up and running in no time!",label_sentences__4_25_21_1000_
no,"In his words, it's 'what you do when you don't know what to do.'",label_sentences__4_25_21_1000_
no,"(myself and the students seemed to melt into the floor more and more each day).Since September 2018, I've been working at a private language school in Ealing teaching English to adults from across the world as well as maintaining Private Tutoring on a part-time basis around London (currently all online because of the you-know-what situation).I'm not going to lie, I find teaching difficult.",label_sentences__4_25_21_1000_
yes,You need to understand how the world works.,label_sentences__4_25_21_1000_
yes,"We can split different years, to see if the model is overall stable through time.",label_sentences__4_25_21_1000_
no,"-notably before the advent of genetics, general relativity, quantum mechanics, cosmology, and neuroscience -and concluded that:Free energy, if you will, with one primary cause -the need to create, the need to express novelty in nature.",label_sentences__4_25_21_1000_
no,I love that you are not just a number to them.,label_sentences__4_25_21_1000_
no,"With the knowledge that Proud Boys were centrally involved in the January 6, 2021 attack on the U.S. Capitol, the group administrators could have decided to delete the group's message history in the lead-up to the felonious events that transpired in order to protect contributors from possible legal repercussions.",label_sentences__4_25_21_1000_
yes,"But eventually the depression returned, and Marie tried to keep it at bay with different drugs, this time legal ones - including Seroquel, Zoloft, and Lamictal.",label_sentences__4_25_21_1000_
yes,"Letting the relationship go stale can undo all the progress you made to establish a bond in step one, and they'll be less likely to reach out when they need help.",label_sentences__4_25_21_1000_
no,"but he said he was too busy, just get it done.",label_sentences__4_25_21_1000_
yes,"In my opinion, economic recovery will come when the millions who have lost their jobs find new ones at thousands of new companies that will be hiring.",label_sentences__4_25_21_1000_
no,Will you go foreign or domestic?,label_sentences__4_25_21_1000_
no,"I remember exactly what I thought at the time, before hiding behind my mom's car so he wouldn't see me: Mr. B has kids?",label_sentences__4_25_21_1000_
no,They're a native English speaker after all.,label_sentences__4_25_21_1000_
yes,A couple of decades ago we got a possible evidence of bacteria in a nearby solar system.,label_sentences__4_25_21_1000_
no,"He sensed that we were fascinated by what we saw and him being educated in Oxford, he knew very well",label_sentences__4_25_21_1000_
no,but it faded as he recalled a thought. ',label_sentences__4_25_21_1000_
yes,Building trust and belief in your teams can make a big difference in how you as a leader make as well as inspire ethical decisions and choices.,label_sentences__4_25_21_1000_
no,"So, I knew I was in a dream.'",label_sentences__4_25_21_1000_
no,"guess you could say that,' I replied.",label_sentences__4_25_21_1000_
yes,We also need to realize that making mistakes and getting things wrong is an essential step to eventually getting them right.,label_sentences__4_25_21_1000_
yes,"Now they flood our social media feeds with them and while you can ignore, unfollow, and block the fact remains, your kids' digital replicas are online and accessible to people without our same moral code.",label_sentences__4_25_21_1000_
yes,Try to stay focused on the scope of the project and don't get caught up in insights that are not really relevant to the project.,label_sentences__4_25_21_1000_
yes,"This forces students to see failure as a bad thing, rather than an opportunity for growth.",label_sentences__4_25_21_1000_
yes,I care about this so much that I wrote about it!,label_sentences__4_25_21_1000_
no,"All investors are always interested in the questions:This is the first and most important thing they report at their VC partnership meetings as this is the critical decision for them - should they bet more on you, and defines their ability to make other decisions - can they use the money still in the fund to invest in others or reserve for you.",label_sentences__4_25_21_1000_
yes,We can also use 3-D plot packages in R and Python to visualize the data.,label_sentences__4_25_21_1000_
no,"But no, this look - this look was the opposite of that.",label_sentences__4_25_21_1000_
yes,"It is obviously making it harder for people, even technical as I am, to really understand the data and really see the whole picture.",label_sentences__4_25_21_1000_
no,"With schools closed and many parents responsible for 'home schooling' and keeping their kids entertained around the clock, Tackett and Hess received lots of interest in the Challenge.",label_sentences__4_25_21_1000_
yes,It is no secret that the relationship I have with my mother is tumultuous at best.,label_sentences__4_25_21_1000_
yes,It's no secret that rockets are incredibly complicated machines.,label_sentences__4_25_21_1000_
yes,"After spending two-and-a-half years in the RV, the couple decided they wanted to travel more.",label_sentences__4_25_21_1000_
yes,"He stared at the hand-woven fruit basket, one of their wedding gifts.",label_sentences__4_25_21_1000_
yes,"While the incident seemingly blew over in the minds of the housemates, the internet refused to let it rest.",label_sentences__4_25_21_1000_
no,"But to write this article, I talked to all of them to make sure I wasn't the only one getting asked these questions.",label_sentences__4_25_21_1000_
yes,"There are two kinds of listings on this UX job board, Full-time projects, and Freelance projects.",label_sentences__4_25_21_1000_
no,"When I say, 'travel to South Africa,' I mean an all-expenses-paid trip to her private home nestled into the middle of a South African national park, with a chef and masseuse and daily game drives and lots and lots of Veuve Cliquot.",label_sentences__4_25_21_1000_
no,"How?If the root of much of the mental illness that's emerged during the pandemic is unrelenting chronic stress, the opposite is also true: Resilience to trauma lies in the ability to adapt positively to stress.",label_sentences__4_25_21_1000_
yes,A training set is used in learning (fitting the model) and test set for testing how the model generalizes on unseen data.,label_sentences__4_25_21_1000_
no,the globe has resulted in mind-blowing power surges among women everywhere.,label_sentences__4_25_21_1000_
no,"Supporting the appWe don't stop at building the app, we are not a standard implementation partner.",label_sentences__4_25_21_1000_
yes,"Even at the inception of the streaming service, with only a few million users, it was clear that Netflix's old system couldn't deliver the service level agreement that it wanted to uphold.",label_sentences__4_25_21_1000_
yes,"It's nice to see everyone's faces, share organization updates, and open up the floor to employees to share what's on their mind whether it be about business, current events or a new favorite recipe.",label_sentences__4_25_21_1000_
yes,"Risk management looks straightforward, but in reality, it's hard to stay disciplined.",label_sentences__4_25_21_1000_
yes,Short feedback loops are critical in enabling teams to integrate research into their workflow smoothly.,label_sentences__4_25_21_1000_
no,"There is no one union, as far as I can find, that represents every worker in a business sector throughout the country today, let alone all private sector AND government employees in one state, or many..",label_sentences__4_25_21_1000_
yes,Your ability to avoid people and walk courteously around others is seriously diminished to the point where you bump into people and force them to make large movements to avoid you.,label_sentences__4_25_21_1000_
no,"It maybe excellent writers, directors or actors.",label_sentences__4_25_21_1000_
yes,"Our anger serves a purpose, but it should not rule our home.",label_sentences__4_25_21_1000_
yes,"When I got to high school, the 'stocking up' turned into full-blown binging, and the skipping one meal turned into skipping multiple meals in a row.",label_sentences__4_25_21_1000_
yes,Almost everyone can learn to fall asleep easily.,label_sentences__4_25_21_1000_
no,In either case you will be resetting your pace each time you pause so that you don't get carried away and rush through what you're saying.,label_sentences__4_25_21_1000_
no,it takes less than a minute for your brain to re-adjust to typing a bit further apart.,label_sentences__4_25_21_1000_
no,"It is a technology that, according to Corp, is going to change how people live.",label_sentences__4_25_21_1000_
yes,Assigning ownership (to teams or individuals) means there is a steward of knowledge for all aspects of the product.,label_sentences__4_25_21_1000_
no,which syncs quite nicely with Spaces.,label_sentences__4_25_21_1000_
no,By Keyaira KellyMy father is a 6-4 Black man with a slight Southern twang.,label_sentences__4_25_21_1000_
yes,"You can, of course, install additional packages and use your own modules as well.",label_sentences__4_25_21_1000_
no,"but if you don't know how best to work with them, you'll miss out on massive value.",label_sentences__4_25_21_1000_
yes,"The game uses its physics to its advantage by making Spidey attach his webs to buildings, allowing players to have full control of direction and momentum.",label_sentences__4_25_21_1000_
no,"But even so, we're doing what humans do",label_sentences__4_25_21_1000_
no,"How do you view the relationship between design and business?Krystal: I tend to view the relationship between the design and business teams as a reciprocal partnership, which can flex based on the interests, needs, and skillset of each team.",label_sentences__4_25_21_1000_
yes,Some of us may have paid a visit to our doctor with a lingering question - 'do I have cancer?',label_sentences__4_25_21_1000_
yes,"Mariam had gone to the farm to harvest some cassavas while Jaduong Oringo had taken his cattle to the grazing fields nearby, Vivian reported.",label_sentences__4_25_21_1000_
yes,"As a quick exercise, I put together a diagram of what the experience looks like as a reference to help form some design decisions.",label_sentences__4_25_21_1000_
yes,"Still, by using this type of tool, educators falsely convince themselves that such devices are reliable, accurate, and useful.",label_sentences__4_25_21_1000_
no,Remember: is by doing how you accomplish goals in life.,label_sentences__4_25_21_1000_
no,"Here are just a few ways to measure the 'success' of a startup:I won't bore you, but I assure you the list goes on and on.",label_sentences__4_25_21_1000_
no,"The first-a blue jay, he speculates-has been reduced to a scattering of feathers and possibly carried off by a scavenger.",label_sentences__4_25_21_1000_
no,"Therefore, it's not just a business pursuit, it's a personal pursuit.",label_sentences__4_25_21_1000_
no,", the more I want to retrace those threads, trying to recapture some essence of thought, feeling, or experience.",label_sentences__4_25_21_1000_
no,"Leo, do you have a date for Prom?Leo: Not yet.",label_sentences__4_25_21_1000_
no,The beauty of 43 Folders once you get into the groove is that your brain trusts that things are covered; it's an excellent system for living with the ease that you won't forget things.,label_sentences__4_25_21_1000_
no,is something I learned only a couple of years ago.,label_sentences__4_25_21_1000_
no,He's a bonafide leader and he's the archetype of a person that we need more of.,label_sentences__4_25_21_1000_
no,"This week of resources reflects Mar 31st - Apr 7th, 2021.Claudia Hauff went through over 300 papers in conversational search to generate an impressive mindmap of research themes.",label_sentences__4_25_21_1000_
yes,"Today, she just turned 14, and she is still ignoring her Chinese origin.",label_sentences__4_25_21_1000_
yes,"When people think of this shop, they know they'll get hot tasty food easily and safely.",label_sentences__4_25_21_1000_
yes,"Just getting by in a relationship that didn't feed my soul, ignite personal transformation or expand the breadth of my love.",label_sentences__4_25_21_1000_
yes,"I win the school spelling bee in the fourth grade, out-spelling even the fifth graders.",label_sentences__4_25_21_1000_
yes,"She was just a 22-year-old woman, still trying to find her bearing in the world.",label_sentences__4_25_21_1000_
yes,You can find the files on my Github.,label_sentences__4_25_21_1000_
no,You struggle a lot and fall.,label_sentences__4_25_21_1000_
yes,"In the lead up to the lockdown announcement of the United Kingdom due to COVID-19, the UK was almost in a state of anxiety.",label_sentences__4_25_21_1000_
yes,You'll learn more by doing it than you ever would by trying to find the perfect job.,label_sentences__4_25_21_1000_
yes,"Having given up so much, if you're finding that your sense of time perception is shifting, as the expectations placed upon you change, give yourself a pat on the back and consider that such a shift is the goal of mindfulness practice.",label_sentences__4_25_21_1000_
yes,"I probably won't message her first again because she didn't keep up with the conversation, which is okay.",label_sentences__4_25_21_1000_
yes,I was one of the last in my primary school year,label_sentences__4_25_21_1000_
no,"It looks like this:Once you have this object you can easily plot a world map, in the same way you would use the plot function in pandas:Since our focus is on Australia, we can slice the 'countries' object so it shows us Australia only:We'll now use matplotlib to create a figure, and plot the map and the data together at the same time:The grid lines correspond to the ticks on both axes.",label_sentences__4_25_21_1000_
no,At the top of any family's list should be whale watching.,label_sentences__4_25_21_1000_
yes,Other people are not you and they will always have their own interpretation of what is presented.,label_sentences__4_25_21_1000_
yes,This includes really looking at who should benefit from the immunities granted by Section 230 and who we are considering neutral intermediaries.,label_sentences__4_25_21_1000_
no,"don't consistently post about it, because I feel like I'm being too repetitive, and I don't want to be annoying.",label_sentences__4_25_21_1000_
no,"Thom Fladung of Hennes Communications, which has handled corporate communications crises for Fortune 500 companies, says that in rebranding efforts, companies like Blackwater often try to evolve the way their organization does business and the kinds of contracts they take on.",label_sentences__4_25_21_1000_
no,Dismantling your life and admitting you're a scourge on the earth sounds about as fun as mediating a debate between Sen. Bernie Sanders and Pres.,label_sentences__4_25_21_1000_
yes,"By scraping the web, we can ensure that the tags and meta descriptions that we are using merge with our goals.",label_sentences__4_25_21_1000_
yes,It's important to find high-traffic directories with authority links in order for this strategy to be successful.,label_sentences__4_25_21_1000_
no,"whatever hobbies they got, they study English diligently, and they take a warm bath before hitting the sack.",label_sentences__4_25_21_1000_
no,That's just how we humans are,label_sentences__4_25_21_1000_
no,"calculations?It's far too early to say, but until we have a resolution to this important theoretical issue, we won't know what it is that's broken: the Standard Model, or the way we're presently calculating the same quantities we're measuring to unparalleled precisions.",label_sentences__4_25_21_1000_
no,It sounds like something on the side - you got your main thing going on -,label_sentences__4_25_21_1000_
yes,Those people are acting with an extraordinary amount of grace and goodwill.,label_sentences__4_25_21_1000_
yes,"When celebrities give into their fandom's pull, the aftermath can be devastating for their mental health because their public and private lives become blurred and they can lose their sense of self, according to Sat Nam.",label_sentences__4_25_21_1000_
yes,"I have concluded that while I will absolutely utilise help in the form of medicinal and talking therapy avenues, a fair portion of the work is mine to do, and I must remain willing to do it.",label_sentences__4_25_21_1000_
no,"the B Hive?'The communications platform proved valuable in the last year as businesses navigated new challenges, Laserna says.",label_sentences__4_25_21_1000_
yes,I'm not sure that's reasonable in the modern world in which the average human now lives to be 79 years old.,label_sentences__4_25_21_1000_
no,"and it's made clear from the first combat situations (in Panama, Italy, and Scotland) that they'll shoot without mercy.",label_sentences__4_25_21_1000_
no,"you!For example, after the success of Fifty Shades of Grey, the previously unknown author was touted as a less-than-average writer who found fame and fortune by relentlessly pursuing her passion.",label_sentences__4_25_21_1000_
yes,People like you and I are taking action after watching - arguably the most difficult part of any marketing effort.,label_sentences__4_25_21_1000_
no,"Think of Anthropologie - they don't just carry clothes, they also carry items for the home, stationery, and bath products, among other things.",label_sentences__4_25_21_1000_
no,", just look at how it allowed us to see the activity of the brain in a Zebra Fish:",label_sentences__4_25_21_1000_
no,"As of right now, there are too many for me to list, so if you would like to see exactly what those items are, I will refer you to either the League Play section of Black Ops Cold War or on the Call of Duty website to answer any of those questions.",label_sentences__4_25_21_1000_
no,You need all this to even have a chance of making money - let alone generating alpha.,label_sentences__4_25_21_1000_
yes,"In nature, certain chemical reactions benefit from special catalysts which orient molecules in such a way that they're more likely to quantum tunnel.",label_sentences__4_25_21_1000_
no,Critics found it a bit outdated in its mechanics and too childish.,label_sentences__4_25_21_1000_
no,"And when that mental turmoil has settled to the bottom, like silt in a muddy pond, clarity happens.",label_sentences__4_25_21_1000_
no,"Yes, Mr. Porter ended up raising $600 for the Los Angeles Food Bank, but at what cost?Ellen is a human being just like you and me.",label_sentences__4_25_21_1000_
no,"but Tucker remained silent, grim faced.",label_sentences__4_25_21_1000_
no,"I've tried to breakdown my days and measure them in countless different ways, including:Then there's the question of how exactly you set yourself up to work:Or do you do what I usually end up doing and winging it each week based on what work lands on your lap?No matter",label_sentences__4_25_21_1000_
no,"- the Purchasing Managers' Index, how much businesses are ordering to meet demand, fell through the floor, and never recovered.",label_sentences__4_25_21_1000_
yes,Full employment just means we're keeping everyone busy.,label_sentences__4_25_21_1000_
yes,"Although I went to school and grew up in Germany, I speak Chinese like a native without any accents.",label_sentences__4_25_21_1000_
yes,There will be police on Mars.,label_sentences__4_25_21_1000_
yes,"When companies reach the point of maturity when at last they can pause and reflect, it is often to realize that they've built a culture and team that does not represent their user base.",label_sentences__4_25_21_1000_
yes:no,On Tuesday night I spent the hours between 11 p.m. and 3 a.m. in the area around Charminar.,label_sentences__4_25_21_1000_
no,"It's not because we're always choosing the wrong friends, but because it takes away the natural mystery of life.",label_sentences__4_25_21_1000_
yes,One of the most popular resolutions is to start keeping a record of your life.,label_sentences__4_25_21_1000_
yes,"If the outlier is caused by a measurement error, it's important to remove them from the dataset.",label_sentences__4_25_21_1000_
yes,"Let's do that, using Python Code (something I'll use throughout the article):Our vocab object now contains the distinct words of the corpus:If we order our vocab:We get as a result",label_sentences__4_25_21_1000_
no,"Game Freak left the basic, monotonous Pokmon gameplay systems as is.",label_sentences__4_25_21_1000_
yes,"Back in January, which seems like ages ago, I gave a talk at Ghent Inclusive Design Meetup about creating inclusive digital products.",label_sentences__4_25_21_1000_
no,Your Office Might Be More Political Than You Think,label_sentences__4_25_21_1000_
no,"Sure, I might earn less if I don't take it.",label_sentences__4_25_21_1000_
no,"Saturday, there was banging on the gate.",label_sentences__4_25_21_1000_
yes,"It is our superpower, and what defines us.",label_sentences__4_25_21_1000_
yes,Our 'UX&D Getaway Get Together' event was a success.,label_sentences__4_25_21_1000_
yes,"The GI Bill, which became law on June 22, 1944, had three core provisions for World War II veterans: support for college education or training; loans to buy homes or businesses; and unemployment compensation for a period of up to 52 weeks.",label_sentences__4_25_21_1000_
no,Rosalind Franklin's story is more than the 1953 controversy and tension that surrounded her time in King's College.,label_sentences__4_25_21_1000_
yes,"TikTok's growth seemed unstoppable, but weak points have been exposed.",label_sentences__4_25_21_1000_
