sent,type
"His eyes snapped back to his phone as it started to ring, showing the one caller he was desperately hoping to see - Didi'.","['a1_possessive_pronouns', 'a1_past_simple_reg', 'a1_countable_nouns', 'a1_singular_nouns', 'a2_article_the', 'a2_past_continuous', 'a2_to_non_finite_forms']"
It's that every country expresses a great deal about itself through its food.,"['a1_personal_pronouns', 'a1_to_be_present_is_am_are', 'a1_present_simple_3d_pers', 'a2_article_a_an', 'a1_uncountable_nouns', 'a1_countable_nouns', 'a1_singular_nouns']"
This is a woman who doesn't need a microphone to get her words across.,"['a1_to_be_present_is_am_are', 'a1_present_simple_3d_pers', 'a2_article_a_an', 'a1_possessive_pronouns', 'a1_plural_forms', 'a1_singular_nouns']"
"He wasn't particularly optimistic, but he sure as hell was going to be resilient.","['a2_was_were_going_to', 'a2_to_non_finite_forms', 'a1_personal_pronouns']"
"Sam embodies all those synonyms for tired attributed to single working mothers: fraught, frazzled, overworked.","['a1_present_simple_3d_pers', 'a2_to_non_finite_forms', 'a1_plural_forms', 'a1_past_simple_reg']"
I was actually asked to be a committee chair on an AIA committee to rebuild.,"['a2_passive_past_simple', 'a2_to_non_finite_forms', 'a1_singular_nouns', 'a2_article_a_an', 'a1_countable_nouns']"
"Her elder daughter, Malia, wore a purple coat with black scarf and gloves her younger daughter, Sasha, a pink coat with orange scarf and gloves.","['a1_past_simple_irreg', 'a1_singular_nouns', 'a1_plural_forms', 'a1_possessive_pronouns', 'a2_article_a_an', 'a1_comparative_short']"
"So when I was contacted by the Parks Department about a $10,000 seed-grant initiative to help develop waterfront projects, I thought they were really well-meaning, but a bit naive.","['a2_passive_past_simple', 'a2_article_a_an', 'a2_to_non_finite_forms', 'a1_past_simple_irreg', 'a2_article_the', 'a1_plural_forms', 'a1_personal_pronouns']"
"But now Dunedin is a stopping point for international cruise ships, the street has become the top tourist destination in New Zealand's oldest city.","['a1_to_be_present_is_am_are', 'a1_plural_forms', 'a2_present_perfect', 'a2_article_the', 'a2_zero_article', 'a1_superlative_short', 'a1_possesive_s_sing']"
"Anyone is allowed to mix them in different types of ways, draw connections between musical ideas, and people can burn them or create final products and continue the circle.","['a2_passive_present_simple', 'a2_to_non_finite_forms', 'a1_plural_forms', 'a1_countable_nouns', 'a1_can', 'a2_article_the']"
"It seems to bring out the worst in many people, including those denouncing the president's modest proposal.","['a1_present_simple_3d_pers', 'a2_to_non_finite_forms', 'a1_superlative_exept', 'a1_plural_forms', 'a1_possesive_s_sing']"
"They turned a chair from something the purchasing department bought, to something that was a status symbol about where you sat at work.","['a1_past_simple_reg', 'a2_article_a_an', 'a2_article_the', 'a1_past_simple_irreg', 'a1_there_was_were']"
I have an Indian friend and he knows all the other Indians in town.,"['a1_present_simple_reg_act', 'a1_singular_nouns', 'a1_present_simple_3d_pers', 'a1_plural_forms', 'a1_countable_nouns']"
He had to remove the toilet from the main waste to get to the blockage.,"['a2_had_to', 'a2_article_the', 'a1_uncountable_nouns', 'a2_to_non_finite_forms', 'a1_personal_pronouns']"
"So for a millisecond, my initial thought is, fuck, this toilet paper is possessed.","['a1_possessive_pronouns', 'a1_there_is_am_are', 'a2_passive_present_simple']"
I thought it would be pretty funny if I just set up a bbq in the middle of the tracks,"['a1_past_simple_irreg', 'a2_second_conditional_m_if', 'a2_article_the', 'a2_article_a_an', 'a1_plural_forms']"
They were at a time share seminar when there house was randomly broken into.,"['a1_personal_pronouns', 'a2_article_a_an', 'a1_countable_nouns', 'a2_passive_past_simple']"
"This looks pretty similar to rendering a string template, but Vue has done a lot of work under the hood.","['a1_present_simple_3d_pers', 'a2_article_a_an', 'a1_countable_nouns', 'a2_present_perfect', 'a2_much_many_a_lot', 'a2_article_the', 'a1_possesive_s_sing']"
One important thing to note is that separation of concerns is not equal to separation of file types.,"['a1_to_be_present_is_am_are', 'a1_possesive_s_sing']"
"A project contains all the options, configurations, and rules used to build your apps.","['a2_article_a_an', 'a1_present_simple_3d_pers', 'a1_plural_forms', 'a2_zero_article', 'a1_possessive_pronouns']"
"The cl.exe compiler generates an .obj file that contains the compiled code, and then runs the linker to create an executable program named hello.exe.","['a1_present_simple_3d_pers', 'a2_relative_clause_who_which_that', 'a2_article_the', 'a1_singular_nouns', 'a1_countable_nouns', 'a2_to_non_finite_forms', 'a2_article_a_an']"
"For more information about installing and troubleshooting Visual C++, see Install Visual Studio.",['a2_imperatives']
"Easily the most boring class was History of Magic, which was the only one taught by a ghost.","['a1_superlative_long', 'a1_to_be_past_was_were', 'a2_relative_clause_who_which_that', 'a2_article_the']"
"On the other hand, Malfoy's sneering face kept looming up out of the darkness - this was his big chance to beat Malfoy face-to-face.","['a1_past_simple_irreg', 'a1_to_be_past_was_were', 'a2_to_non_finite_forms', 'a1_possesive_s_sing', 'a1_singular_nouns', 'a1_countable_nouns']"
"Well, if either of you do see anythin', let me know, won't yeh?","['a2_first_conditional_if_m', 'a2_imperatives', 'a1_present_simple_reg_act']"
"Harry and Ron barely had time to exchange mystified looks before she was dashing back, an enormous old book in her arms.","['a1_be_have_do_in_the_past', 'a2_to_non_finite_forms', 'a2_past_continuous', 'a1_possessive_pronouns', 'a1_plural_forms', 'a1_countable_nouns', 'a1_uncountable_nouns']"
Harry was wondering what a wizard did once he'd finished school.,"['a1_to_be_past_was_were', 'a2_narrative_tenses', 'a2_past_perfect_basic', 'a2_past_continuous', 'a1_be_have_do_in_the_past', 'a2_article_a_an', 'a1_singular_nouns']"
"That's why she gave me the hourglass, so we can hopscotch together.","['a1_past_simple_irreg', 'a2_article_the', 'a1_can', 'a1_possesive_s_sing']"
It is the sheer numbers that are causing the problems and allowing photography would exacerbate the problem.,"['a1_to_be_present_is_am_are', 'a2_present_continuous_cafe', 'a2_article_the', 'a1_plural_forms']"
"They did however ransack his bags, as they did with everyone passing through.","['a1_past_simple_irreg', 'a1_possessive_pronouns', 'a1_plural_forms', 'a1_be_have_do_in_the_past', 'a1_personal_pronouns']"
"But the main positive is that they show change, even if you don't reach your ultimate goal .A gas goal starts by defining what success looks like.","['a2_article_the', 'a1_personal_pronouns', 'a1_present_simple_reg_act', 'a1_singular_nouns', 'a1_possessive_pronouns', 'a1_present_simple_3d_pers']"
Andrew Cunanan was the serial killer who murdered Versace on the steps of his Miami Beach house in 1997.,"['a1_to_be_past_was_were', 'a2_relative_clause_who_which_that', 'a1_plural_forms', 'a2_article_the', 'a1_possessive_pronouns']"
"And that's despite the fact that a supernova is so bright, so brilliant an event, that it would kill you stone dead at a range of several light-years.","['a1_to_be_present_is_am_are', 'a2_article_a_an', 'a1_singular_nouns']"
"When I had my first baby, the support I received from my nurse was indispensable in helping me initiate and continue breastfeeding.","['a1_past_simple_irreg', 'a2_article_the', 'a1_past_simple_reg', 'a1_to_be_past_was_were', 'a1_singular_nouns', 'a1_countable_nouns']"
"So we're now making several dozen different constructs, because we can vary the cassettes and the genes that go into this artificial chromosome.","['a1_present_continuous_act_rn', 'a2_article_the', 'a1_singular_nouns', 'a1_countable_nouns', 'a1_can']"
Ryan and head coach Mike Ditka often feuded during that season and Super Bowl run.,"['a1_past_simple_reg', 'a1_singular_nouns']"
"Palm is also, especially in the old days, wonderful about this.","['a1_to_be_present_is_am_are', 'a2_article_the', 'a1_plural_forms']"
"His three James Edward Long, Michael Dewayne Shelton and James Wayne Pitts Jr, were convicted of sexual assault.","['a1_possessive_pronouns', 'a2_passive_past_simple']"
"I like music, and I like banjos, and I think I probably heard Steve Martin playing, and I said, I could do that.","['a1_present_simple_reg_act', 'a1_past_simple_irreg', 'a2_ing_non_finite_forms', 'a2_say_reported_verb', 'a2_could', 'a1_plural_forms']"
The shares peaked above $74 just over a month after its IPO but have been on a steady downward trajectory since.,"['a1_past_simple_reg', 'a2_present_perfect']"
"The unfolding of intelligence and complexity still has immensely far to go, here on Earth and probably far beyond.",['a1_present_simple_3d_pers']
"Between that and everything described above, that's why I dislike Russia.","['a1_present_simple_reg_act', 'a1_personal_pronouns']"
"I saw this picture without any context and figured out for myself that you were memorializing Mulder, not crying out for attention.","['a1_past_simple_irreg', 'a1_past_simple_reg', 'a2_past_continuous', 'a2_narrative_tenses', 'a1_personal_pronouns']"
"When I lit it on fire, it was too damp due to the cum that it simply sizzled and didn't manage to actually lite up.","['a1_past_simple_reg', 'a2_to_non_finite_forms', 'a1_to_be_past_was_were', 'a2_article_the', 'a1_personal_pronouns', 'a1_past_simple_irreg']"
School: Apparently he takes the consequences of his tardiness rather personally.,"['a1_present_simple_3d_pers', 'a2_article_the', 'a1_plural_forms', 'a1_possessive_pronouns']"
A vertical bar (|) is used to separate alternatives; it is the least binding operator in this notation.,"['a2_passive_present_simple', 'a1_to_be_present_is_am_are', 'a1_superlative_exept', 'a2_article_a_an', 'a2_article_the', 'a1_singular_nouns', 'a1_countable_nouns']"
The Bloody Baron's becoming almost unbearable - he's the Slytherin ghost.,"['a1_to_be_present_is_am_are', 'a2_article_the', 'a1_personal_pronouns']"
"They tried retracing Harry's route from the library, wandering around the dark passageways for nearly an hour.","['a1_personal_pronouns', 'a1_past_simple_reg', 'a1_possesive_s_sing', 'a2_article_the', 'a1_plural_forms', 'a2_article_a_an']"
"He waited until Quirrell's footsteps had disappeared, then peered into the classroom.","['a1_personal_pronouns', 'a1_possesive_s_sing', 'a1_plural_forms', 'a2_narrative_tenses', 'a1_past_simple_reg', 'a2_past_perfect_basic', 'a2_article_the', 'a1_countable_nouns', 'a1_singular_nouns']"
"He looked carefully at Harry, his eyes lingering on the scar that stood out, livid, on Harry's forehead.","['a1_personal_pronouns', 'a1_past_simple_reg', 'a1_possessive_pronouns', 'a1_past_simple_irreg', 'a1_countable_nouns', 'a1_singular_nouns', 'a1_possesive_s_sing']"
"Yet the days crept by, and there could be no doubt that Fluffy was still alive and well behind the locked door.","['a1_past_simple_irreg', 'a2_could', 'a1_to_be_past_was_were', 'a2_article_the', 'a1_plural_forms', 'a1_countable_nouns']"
"Kabir always had a story to share, either from his school days, his trips, hikes or even just some of his past experiences.","['a1_be_have_do_in_the_past', 'a1_singular_nouns', 'a2_to_non_finite_forms', 'a1_possessive_pronouns', 'a1_plural_forms', 'a1_countable_nouns']"
"Don't go anywhere, I'll be right back! . .","['a2_imperatives', 'a1_to_be_future_will_be', 'a1_present_simple_reg_act']"
"Some of our favorites were in the night markets of Raohe, Shida, and Shilin.","['a1_possessive_pronouns', 'a1_to_be_past_was_were', 'a2_article_the', 'a1_plural_forms']"
He took down a couple of notes from this run: Time until collapse of human civilization:,"['a1_personal_pronouns', 'a1_past_simple_irreg', 'a1_countable_nouns', 'a1_plural_forms', 'a1_uncountable_nouns', 'a2_article_a_an']"
"The remaining 65 groves of huge sequoia trees in California, among the largest living things on the planet, could be decimated by a warmer, drier climate.","['a2_article_the', 'a1_plural_forms', 'a1_countable_nouns', 'a2_zero_article', 'a1_superlative_short', 'a2_could', 'a2_article_a_an', 'a1_singular_nouns']"
And he hadn't seen a computer before we did this movie.,"['a2_past_perfect_basic', 'a2_narrative_tenses', 'a1_be_have_do_in_the_past', 'a1_past_simple_irreg', 'a2_article_a_an', 'a1_singular_nouns', 'a1_countable_nouns']"
"He was a real game changer, and much of his philosophies and defensive tactics are still utilized effectively by teams today.","['a1_to_be_past_was_were', 'a1_personal_pronouns', 'a1_countable_nouns', 'a1_possessive_pronouns', 'a1_singular_nouns', 'a1_plural_forms', 'a1_to_be_present_is_am_are', 'a2_passive_present_simple']"
"The answer is: The system certainly has software, but no, we're not providing the education content.","['a2_article_the', 'a1_present_simple_reg_act', 'a2_present_continuous_cafe', 'a1_singular_nouns', 'a1_countable_nouns', 'a1_to_be_present_is_am_are']"
"I think a lot of tourists don't know this is a real street, that people actually live here, she laughs.","['a1_present_simple_reg_act', 'a1_present_simple_3d_pers', 'a1_plural_forms', 'a1_to_be_present_is_am_are', 'a1_singular_nouns', 'a2_article_a_an']"
"Knan, 40s, project manager for Liberal Judaism, London, I didn't really know anything about gender identity until quite late, when I was in my .","['a1_singular_nouns', 'a2_zero_article', 'a1_past_simple_irreg', 'a1_to_be_past_was_were', 'a1_countable_nouns']"
Software is subject to another primal force: the mandate to release more and more versions.,"['a1_to_be_present_is_am_are', 'a2_article_the', 'a1_plural_forms']"
"Half a century later, wives of heads of state all over the world are still measured against Kennedy, but the comparison is sharpest in the White House.","['a2_article_a_an', 'a1_plural_forms', 'a2_article_the', 'a2_passive_present_simple', 'a1_countable_nouns']"
"I teach signal processing and my challenge was to show that this math - Wow, about half of you have already fallen asleep just looking at the equation.","['a1_present_simple_reg_act', 'a1_there_was_were', 'a2_present_perfect', 'a1_possessive_pronouns', 'a1_singular_nouns']"
"I was level 70, I quit at level 70, before the expansion pack.","['a1_there_was_were', 'a2_article_the', 'a1_singular_nouns', 'a1_countable_nouns', 'a1_personal_pronouns', 'a1_past_simple_irreg']"
These were the same words that the parrot would say every day when his owner left the lab.,"['a1_there_was_were', 'a1_plural_forms', 'a2_article_the', 'a1_past_simple_irreg', 'a1_singular_nouns', 'a1_countable_nouns']"
"And based on the amount of likes and comments the posting drew, I don't think the image came across to the intended audience as in poor taste.","['a1_past_simple_irreg', 'a1_present_simple_reg_act', 'a2_article_the', 'a1_singular_nouns', 'a1_uncountable_nouns', 'a1_plural_forms']"
I don't know how it got started since we had gotten pretty drunk but the towel ended up coming off and the next thing I know we were having sex.,"['a1_past_simple_reg', 'a2_past_perfect_basic', 'a2_past_continuous', 'a2_article_the', 'a1_personal_pronouns', 'a1_present_simple_reg_act', 'a1_countable_nouns', 'a1_singular_nouns']"
"If you can't find the developer command prompt shortcut, or if you get an error message when you enter cl, then your Visual C++ installation may have a problem.","['a2_first_conditional_if_m', 'a1_can', 'a1_present_simple_reg_act', 'a2_article_a_an', 'a2_article_the', 'a1_possessive_pronouns']"
"Discusses asynchronous JavaScript, why it is important, and how it can be used to effectively handle potential blocking operations such as fetching resources from a server.","['a1_to_be_present_is_am_are', 'a1_personal_pronouns', 'a1_can', 'a2_to_non_finite_forms', 'a1_plural_forms', 'a1_countable_nouns', 'a2_article_a_an']"
"Sir - even if the Stone's gone, Vol-, I mean, You-Know-Who - Call him Voldemort, Harry.","['a2_first_conditional_if_m', 'a2_imperatives', 'a2_passive_present_simple', 'a1_present_simple_reg_act', 'a2_article_the']"
"The room held no sign at all that another boy lived in the house, too.","['a2_article_the', 'a1_past_simple_reg', 'a1_past_simple_irreg', 'a1_countable_nouns', 'a1_singular_nouns']"
Please note that all pupils' clothes should carry name tags COURSE BOOKS,"['a2_imperatives', 'a1_possessive_s_plurar', 'a1_plural_forms', 'a2_should', 'a1_uncountable_nouns', 'a1_countable_nouns']"
The hooded figure raised its head and looked right at Harry - unicorn blood was dribbling down its front.,"['a2_article_the', 'a1_past_simple_reg', 'a2_past_continuous', 'a1_possessive_pronouns', 'a1_countable_nouns', 'a1_singular_nouns']"
What is the line in pulling up a prank before we term it as too much and perceived negatively by the audience you set to entertain?It might be hard to truly answer.,"['a2_article_the', 'a1_present_simple_reg_act', 'a2_much_many_a_lot', 'a1_uncountable_nouns', 'a2_to_non_finite_forms', 'a1_countable_nouns', 'a1_singular_nouns']"
"He scored well on the history itself, but he actually ended up being docked a few points for running the simulations when it was generally discouraged.","['a1_past_simple_reg', 'a1_personal_pronouns', 'a2_ing_non_finite_forms', 'a2_article_a_an', 'a1_plural_forms', 'a2_article_the', 'a1_countable_nouns', 'a2_passive_past_simple']"
"Not only is this a great way to work at home, but your work can actually mean something too.","['a1_can', 'a2_to_non_finite_forms', 'a1_countable_nouns', 'a1_singular_nouns', 'a2_article_a_an']"
Here's the theroy of a gas goal:Let's take the example above:Everything after this is personal.,"['a2_article_the', 'a2_imperatives', 'a1_to_be_present_is_am_are', 'a1_singular_nouns', 'a1_countable_nouns']"
Work gives us purpose and can be very meaningful if we choose the right work.,"['a1_present_simple_3d_pers', 'a1_can', 'a2_zero_conditional_m_if', 'a1_present_simple_reg_act', 'a2_article_a_an', 'a1_singular_nouns', 'a1_countable_nouns']"
We will have the power of mind and matter to be able to create whatever we want and occupy those worlds.,"['a1_future_simple', 'a2_article_the', 'a1_singular_nouns', 'a1_countable_nouns', 'a2_to_non_finite_forms', 'a1_personal_pronouns']"
"I may not live long enough to get you there, but it's going to happen.","['a1_personal_pronouns', 'a2_to_non_finite_forms', 'a2_is_am_are_going_to']"
There is a certain level of animosity towards the politicians that were found out to be involved in the Panama Papers scandal.,"['a1_there_is_am_are', 'a2_article_a_an', 'a1_singular_nouns', 'a1_countable_nouns', 'a1_plural_forms', 'a2_relative_clause_who_which_that', 'a2_passive_past_simple', 'a2_to_non_finite_forms', 'a2_article_the']"
"In any campaign cycle, there are periods when the dynamic turns decisively in one direction.","['a1_there_is_am_are', 'a1_present_simple_3d_pers', 'a1_plural_forms', 'a1_countable_nouns']"
"What she worried about was whether there was a plan for the future, where her children could really have a different life.","['a1_personal_pronouns', 'a1_to_be_past_was_were', 'a1_there_was_were', 'a2_article_a_an', 'a1_singular_nouns', 'a1_countable_nouns', 'a2_article_the', 'a2_relative_clause_others', 'a1_possessive_pronouns', 'a1_plural_forms', 'a2_could']"
"In years where men in question were their family's sole breadwinner, their psychological and health outcomes were at their worst.","['a1_to_be_past_was_were', 'a1_possesive_s_sing', 'a1_singular_nouns', 'a1_countable_nouns', 'a1_possessive_pronouns', 'a1_superlative_exept']"
What's not fine is for us to make that choice on behalf of the future.,"['a1_to_be_present_is_am_are', 'a2_to_non_finite_forms', 'a2_article_a_an', 'a1_possesive_s_sing']"
The justice department confirmed that Martin worked for the same company as Snowden when he exposed details of NSA mass surveillance methods three years ago.,"['a2_article_the', 'a1_past_simple_reg', 'a1_singular_nouns', 'a1_countable_nouns', 'a1_plural_forms']"
"And then, let's make this really big contraption that you have to rig up to it in this daisy chain.","['a2_to_non_finite_forms', 'a2_imperatives', 'a1_personal_pronouns', 'a1_countable_nouns', 'a1_singular_nouns', 'a1_plural_forms']"
I like to see how many times I can fit yummy into a conversation.,"['a1_present_simple_reg_act', 'a2_to_non_finite_forms', 'a2_much_many_a_lot', 'a1_can', 'a2_article_a_an', 'a1_singular_nouns']"
Mold has begun to grow in the box and has taken over a fair amount.,"['a2_present_perfect', 'a2_article_the', 'a1_uncountable_nouns']"
"This source shows(  that a minimum wage worker in Australia would take home $27,760 USD after tax.","['a1_present_simple_3d_pers', 'a1_possessive_pronouns', 'a2_article_a_an', 'a1_singular_nouns']"
I'll change my pace slower and faster as I wish and watch as my boyfriend unknowingly conforms to my speed.,"['a1_future_simple', 'a1_comparative_short', 'a1_present_simple_3d_pers', 'a1_personal_pronouns', 'a1_singular_nouns']"
"In fact, the person who made this fact up did so just to prove that people will believe stupid stuff.","['a2_article_the', 'a2_relative_clause_who_which_that', 'a1_past_simple_irreg', 'a1_be_have_do_in_the_past', 'a2_to_non_finite_forms', 'a1_plural_forms', 'a1_future_simple', 'a1_uncountable_nouns', 'a1_singular_nouns']"
"The official guide assumes intermediate level knowledge of HTML, CSS, and JavaScript.","['a2_article_the', 'a1_singular_nouns', 'a1_countable_nouns', 'a1_present_simple_3d_pers']"
"Ron had fallen asleep in the dark common room, waiting for them to return.","['a2_past_perfect_basic', 'a2_to_non_finite_forms', 'a2_article_the', 'a1_countable_nouns', 'a1_singular_nouns']"
"Blimey, Harry, I keep forgettin' how little yeh know - not knowin' about Quidditch!","['a1_present_simple_reg_act', 'a2_zero_article']"
What Harry feared most was that he might not be able to find the mirror room again.,"['a1_superlative_exept', 'a2_article_the', 'a1_singular_nouns', 'a1_countable_nouns']"
"He put on a high voice, 'Oh Professor Flitwick, I'm so worried,","['a1_past_simple_irreg', 'a2_article_a_an', 'a1_singular_nouns', 'a1_to_be_present_is_am_are']"
"This will allow them to adjust (economically, culturally, socially, and emotionally) to a much greater degree.â€‹ Even doing your best attempts, still there is a chance you will never be like a native","['a1_future_simple', 'a2_to_non_finite_forms', 'a2_much_many_a_lot', 'a1_comparative_short', 'a2_ing_non_finite_forms', 'a1_possessive_pronouns', 'a1_plural_forms', 'a1_countable_nouns', 'a1_there_is_am_are', 'a2_article_a_an', 'a1_to_be_future_will_be']"
When you address the situation at hand instead of putting it off you are living in the present and you will see the nature of karma.,"['a1_present_simple_reg_act', 'a1_present_continuous_act_rn', 'a1_future_simple', 'a2_article_the', 'a2_ing_non_finite_forms', 'a1_singular_nouns']"
"It will also help you create the roadmap for success by taking a 30,000-foot view of what worked for you and basically hand them the blueprint for success.","['a1_future_simple', 'a2_article_the', 'a1_past_simple_reg', 'a1_uncountable_nouns', 'a1_personal_pronouns', 'a1_singular_nouns', 'a2_relative_clause_who_which_that']"
I am so grateful that I can bring my hobby and my work with me wherever and whenever I want.,"['a1_to_be_present_is_am_are', 'a1_can', 'a1_possessive_pronouns', 'a1_present_simple_reg_act', 'a1_singular_nouns', 'a1_countable_nouns']"
"The building that housed his startup and a number of other companies, all 25 stories of it, was wobbling.","['a2_article_the', 'a1_past_simple_reg', 'a2_article_a_an', 'a2_past_continuous', 'a1_possessive_pronouns']"
"At a meeting the night before the Bears beat New England in the 1986 Super Bowl, Dent said a teary Ryan informed his players that he was going to Philadelphia:","['a2_article_a_an', 'a2_article_the', 'a2_past_continuous', 'a2_say_reported_verb', 'a1_past_simple_reg', 'a2_zero_article']"
"Because from a planning perspective, economic degradation begets environmental degradation, which begets social degradation.","['a1_present_simple_reg_act', 'a1_singular_nouns', 'a2_relative_clause_who_which_that', 'a2_article_a_an']"
"At lower levels that's enough to jump at least one, possibly two levels.","['a1_to_be_present_is_am_are', 'a2_to_non_finite_forms', 'a1_plural_forms', 'a1_countable_nouns']"
"There's a whole variety of other reasons why property rights sometimes don't work in these cases, but they do need security of tenure.","['a1_there_is_am_are', 'a2_article_a_an', 'a1_plural_forms', 'a2_relative_clause_others', 'a1_present_simple_reg_act', 'a1_countable_nouns']"
"Cowboys kicker Luis Zendejas claimed Ryan put a $200 bounty on him, something Ryan laughed off as ridiculous.","['a1_plural_forms', 'a1_past_simple_reg', 'a1_past_simple_irreg']"
"And I also think that you gravitate to certain people, actually, with somewhat complementary brain systems.","['a1_present_simple_reg_act', 'a1_plural_forms', 'a1_countable_nouns']"
Linda McMahon has since been announced as Trump's nominee to lead the Small Business Administration.,"['a1_present_simple_reg_act', 'a1_possesive_s_sing', 'a2_to_non_finite_forms', 'a2_article_the']"
And it's obvious from the diagram that every unit of energy you save at the wheels is going to avoid wasting another seven units of energy getting that energy to the wheels.,"['a1_to_be_present_is_am_are', 'a2_article_a_an', 'a1_singular_nouns', 'a1_countable_nouns', 'a1_personal_pronouns', 'a1_present_simple_reg_act', 'a2_article_the', 'a2_is_am_are_going_to', 'a2_ing_non_finite_forms', 'a1_plural_forms']"
