sent,type
I have never once washed an apple from the store before I ate it.,"['a2_present_perfect', 'a1_past_simple_irreg', 'a2_narrative_tenses', 'a2_article_a_an', 'a1_singular_nouns']"
"Under the rules of dueling, Dickinson had to remain still as Jackson took aim and shot and killed him.","['a2_had_to', 'a1_past_simple_irreg', 'a2_narrative_tenses']"
"Usually, when I tell someone, they give me a blank stare, then ask What is Reddit?","['a2_first_conditional_if_m', 'a1_present_simple_reg_act']"
"Unfortunately, the names of the developer command prompt shortcuts and where they're located are different in almost every version of Visual C++ and on different versions of Windows.","['a2_article_the', 'a1_to_be_present_is_am_are', 'a1_present_simple_reg_act', 'a1_plural_nouns']"
We recommend you use a developer command prompt shortcut instead of building your own.,['a1_possessive_pronouns']
"Note: We do not recommend that beginners start with vue-cli, especially if you are not yet familiar with Node.js-based build tools.","['a1_present_simple_reg_act', 'a2_zero_conditional_m_if', 'a1_plural_forms', 'a1_to_be_present_is_am_are']"
Each rule begins with a name (which is the name defined by the rule) and ::=.,"['a1_present_simple_reg_act', 'a2_article_a_an', 'a2_relative_clause_who_which_that']"
"This example demonstrates that we can bind data to not only text and attributes, but also the structure of the DOM.","['a1_present_simple_reg_act', 'a1_can', 'a2_to_non_finite_forms', 'a1_plural_forms']"
"I'm not saying his heart isn't in the right place, said Professor McGonagall grudgingly, but you can't pretend he's not careless.","['a1_present_continuous_act_rn', 'a1_to_be_present_is_am_are', 'a2_say_reported_verb', 'a1_can', 'a2_article_the', 'a1_possessive_pronouns']"
Hundreds of seats were raised in stands around the field so that the spectators were high enough to see what was going on.,"['a1_plural_forms', 'a2_passive_present_simple', 'a2_to_non_finite_forms', 'a2_article_the', 'a1_to_be_past_was_were', 'a2_narrative_tenses']"
"Cheered by a rowdy Korean contingent in the terraces, the trio threw down the gauntlet in the opening set, hitting the innermost gold circle six times in succession to score the maximum 60 points.","['a1_past_simple_irreg', 'a2_adjectives_ed', 'a2_article_the', 'a2_to_non_finite_forms']"
"And a lot of talks here have espoused the benefits of having lots of people look at problems, share the information and work on those things together.","['a2_much_many_a_lot', 'a2_present_perfect', 'a2_ing_non_finite_forms', 'a1_plural_forms', 'a2_article_the']"
"At its peak, he was one of two dozen independistas in federal prisons now he is the last one.","['a1_personal_pronouns', 'a1_possessive_pronouns', 'a1_to_be_past_was_were', 'a1_to_be_present_is_am_are', 'a1_plural_forms', 'a2_article_the']"
"And George Homsey, a great guy, said, Oh, the future is amazing.","['a2_article_a_an', 'a2_article_the', 'a1_there_is_am_are', 'a2_adjectives_ing']"
We have three new parties that could grab as much as 40% of the vote.,"['a2_could', 'a2_article_the', 'a1_plural_forms', 'a1_present_simple_reg_act', 'a2_much_many_a_lot']"
"Books that might sell 100 copies a year, 1,000 copies a year.",['a1_plural_forms']
There is also a big difference between the voting demographics in the countryside and the cities.,"['a1_there_is_am_are', 'a2_article_a_an', 'a2_article_the', 'a1_plural_forms']"
"He set off, drawing the Invisibility Cloak tight around him as he walked.","['a1_past_simple_irreg', 'a1_past_simple_reg', 'a1_personal_pronouns']"
"You hang around with riffraff like the Weasleys and that Hagrid, and it'll rub off on you.","['a1_personal_pronouns', 'a2_future_simple_pred_bas_on_own_exp', 'a1_present_simple_reg_act']"
"Uncle Vernon made another funny noise, like a mouse being trodden on.","['a1_past_simple_irreg', 'a2_article_a_an', 'a1_countable_nouns']"
We spend 10-12 hours/day at work for the better part of our lives.,"['a1_present_simple_reg_act', 'a2_article_the', 'a1_possessive_pronouns', 'a1_plural_forms']"
"There I stayed for a good 48-hours, clinging to the 24-hour news, drinking wine from a bottle.","['a1_past_simple_reg', 'a2_article_a_an', 'a1_countable_nouns', 'a1_uncountable_nouns']"
They barely checked his passport and did not ask where he was headed.,"['a1_past_simple_reg', 'a2_relative_clause_others', 'a2_passive_past_simple', 'a1_possessive_pronouns']"
I started working on the application by contacting one of my professors and the employer from my last internship to help me with the recommendation letters.,"['a1_past_simple_reg', 'a1_personal_pronouns', 'a2_to_non_finite_forms', 'a1_plural_forms', 'a1_possessive_pronouns', 'a2_article_the', 'a2_ing_non_finite_forms']"
One variable that did however behave as expected was the restlessness of my sleep.,"['a1_to_be_past_was_were', 'a1_past_simple_reg']"
And she tried to fix his ailing health with a vegan sandwich?,"['a1_personal_pronouns', 'a1_past_simple_reg', 'a2_to_non_finite_forms']"
"And Atlantic-Heydt, who's the largest scaffolding contractor in the country, volunteered to do it at cost.","['a2_relative_clause_who_which_that', 'a1_superlative_short', 'a2_article_the', 'a1_past_simple_reg', 'a2_to_non_finite_forms', 'a1_countable_nouns']"
You can't put your awkwardness with women all on your parents.,"['a1_can', 'a1_possessive_pronouns', 'a1_personal_pronouns']"
That's why I've watched every episode of survivorman 40 times.,"['a2_present_perfect', 'a1_personal_pronouns']"
She'd wear fucking robes to school and eat dried leaves for lunch,"['a1_plural_forms', 'a1_personal_pronouns']"
"Open your browser's JavaScript console (right now, on this page) and set app.message to a different value.","['a2_imperatives', 'a2_article_a_an', 'a1_possesive_s_sing', 'a1_possessive_pronouns', 'a1_countable_nouns']"
"There's also a toolbar button for Save All, an icon of two floppy disks, found beside the Save button.","['a1_there_is_am_are', 'a1_countable_nouns', 'a2_article_a_an', 'a1_plural_forms', 'a2_article_the']"
"Try reinstalling the Visual C++ component in Visual Studio, or reinstall the Microsoft Visual C++ Build Tools.","['a2_imperatives', 'a2_article_the', 'a1_countable_nouns', 'a1_plural_forms', 'a2_ing_non_finite_forms']"
"To complete this walkthrough, you must have installed either Visual Studio and the optional Desktop development with C++ workload, or the command-line Build Tools for Visual Studio.","['a2_must', 'a1_plural_forms', 'a2_article_the', 'a2_to_non_finite_forms', 'a1_countable_nouns']"
"The HTML is our entry point, but everything else happens within the newly created Vue instance.","['a1_to_be_present_is_am_are', 'a1_present_simple_reg_act', 'a2_article_the', 'a1_possessive_pronouns']"
The most you and Malfoy'll be able to do is send sparks at each other.,"['a2_article_the', 'a1_personal_pronouns', 'a2_will_be_able_to', 'a2_to_non_finite_forms', 'a1_plural_forms', 'a1_countable_nouns']"
"Of course not, said Harry, eager to see more magic.","['a1_uncountable_nouns', 'a2_to_non_finite_forms']"
"Shut up, Peeves - please - you'll get us thrown out.","['a1_future_simple', 'a2_imperatives', 'a1_personal_pronouns']"
"With one last desperate look back at Ron, Harry and Hermione charged through the door and up the next passageway.","['a1_past_simple_reg', 'a1_countable_nouns']"
Harry stuck his wand up its nose and Ron knocked it out with its own club.,"['a1_past_simple_reg', 'a1_possessive_pronouns', 'a1_countable_nouns']"
I was there early along with a lone fisherman trying his luck.,"['a1_to_be_past_was_were', 'a2_article_a_an', 'a1_possessive_pronouns', 'a1_countable_nouns']"
"His steady voice grates heavy on my ear, an ax that hurts so much that finally I ask him what's the point.","['a1_possessive_pronouns', 'a1_countable_nouns', 'a1_present_simple_reg_act', 'a1_to_be_present_is_am_are', 'a2_article_the', 'a2_article_a_an', 'a2_much_many_a_lot']"
These fire roads were merely remnants of trails created to mend the fences that kept in cattle of generations past.,"['a1_plural_forms', 'a1_to_be_past_was_were', 'a1_past_simple_reg', 'a2_to_non_finite_forms', 'a1_past_simple_irreg', 'a1_countable_nouns']"
"I've decided that I'm wearing red exclusively now, I poked back matter-of-factly.","['a2_present_perfect', 'a2_present_continuous_cafe', 'a1_past_simple_reg']"
And I ate them up as fast as I could devour my sacks of Halloween loot every year.,"['a1_past_simple_irreg', 'a2_could', 'a1_possessive_pronouns', 'a1_personal_pronouns']"
"You could aimlessly wander the streets or rely on word of mouth, but if you're less keen on clocking up the kilometres, there's a better way.","['a2_could', 'a2_zero_conditional_if_m', 'a1_there_is_am_are', 'a1_plural_forms', 'a1_to_be_present_is_am_are', 'a2_article_a_an', 'a2_article_the', 'a1_personal_pronouns']"
"But my friend, Simon Singh, the particle physicist now turned science educator, who wrote the book The Big Bang, and so on, uses every chance he gets to promote good science.","['a1_possessive_pronouns', 'a2_article_the', 'a1_past_simple_irreg', 'a1_present_simple_reg_act', 'a2_to_non_finite_forms', 'a1_countable_nouns']"
"The tau protein deposits found in Mirra's brain were indistinguishable from the kind that have been found in the brains of former football and hockey players with CTE, Dr Hazrati, the Toronto neuropathologist, told ESPN","['a1_past_simple_irreg', 'a1_possesive_s_sing', 'a2_passive_present_perf', 'a1_plural_forms', 'a1_countable_nouns', 'a2_article_the']"
"Because in that highest age category of 76 to 85, as much as 40 percent of people have nothing really wrong with them.","['a1_present_simple_reg_act', 'a2_much_many_a_lot', 'a1_plural_forms']"
I arrived thinking we were bringing freedom to Vietnamese people but as soon as I hit the ground I realised that wasn't happening.,"['a1_past_simple_reg', 'a2_past_continuous', 'a1_plural_forms', 'a1_past_simple_irreg']"
"And the cancer, the body is saying the lung tissue is damaged, we need to repair the lung.","['a2_article_the', 'a1_present_continuous_act_rn', 'a2_passive_present_simple', 'a2_to_non_finite_forms', 'a1_countable_nouns', 'a1_present_simple_reg_act']"
Each round of dispute with the Khan family only served to reinforce the criticism that he had sacrificed nothing.,"['a1_past_simple_reg', 'a2_to_non_finite_forms', 'a2_past_perfect_basic', 'a1_personal_pronouns', 'a2_narrative_tenses', 'a1_countable_nouns']"
And what I've spent 15 years doing in this business - and it's taken me almost 14 to figure it out - is I think about the future of wars in the context of everything else.,"['a2_present_perfect', 'a2_to_non_finite_forms', 'a1_present_simple_reg_act', 'a2_article_the']"
"There is also plenty of speculation about the future of Durant, who will soon be a free agent.","['a1_there_is_am_are', 'a1_to_be_future_will_be', 'a2_article_a_an', 'a1_countable_nouns', 'a2_article_the', 'a2_relative_clause_who_which_that']"
"If you really look at the power of exponential growth, you'll see that these things are pretty soon at hand.","['a2_first_conditional_if_m', 'a1_future_simple', 'a1_present_simple_reg_act', 'a2_article_the', 'a1_personal_pronouns', 'a1_to_be_present_is_am_are']"
But I'll also have to pay rent and my light bill is due.,"['a1_to_be_present_is_am_are', 'a2_will_have_to', 'a1_possessive_pronouns', 'a1_personal_pronouns']"
"For what seemed like 15 minutes, we were in a maelstrom, no visibility, but then it passed.","['a1_past_simple_reg', 'a1_to_be_past_was_were', 'a2_article_a_an', 'a1_personal_pronouns']"
"The policy is perfectly clear about this, and I was already pushing it by calling in nine consecutive days.","['a2_article_the', 'a1_to_be_present_is_am_are', 'a2_past_continuous', 'a1_plural_forms']"
"If we are going to elect a woman, and I'm all for it, by the way, it needs to be because of her political track record.","['a2_zero_conditional_if_m', 'a2_is_am_are_going_to', 'a2_to_non_finite_forms', 'a1_to_be_present_is_am_are', 'a1_present_simple_3d_pers', 'a1_countable_nouns', 'a1_personal_pronouns']"
"If you prefer something more interactive, you can also check out this tutorial series on Scrimba, which gives you a mix of screencast and code playground that you can pause and play around with anytime.","['a2_first_conditional_if_m', 'a1_can', 'a1_comparative_long', 'a2_relative_clause_who_which_that', 'a1_present_simple_3d_pers', 'a1_personal_pronouns', 'a1_plural_forms', 'a2_article_a_an', 'a1_countable_nouns']"
"Moreover, Vue also provides a powerful transition effect system that can automatically apply transition effects when elements are inserted/updated/removed by Vue.","['a1_present_simple_3d_pers', 'a1_can', 'a2_passive_present_simple', 'a2_article_a_an', 'a1_plural_forms']"
A model can utilize a fork TorchScript primitive to launch an asynchronous task.,"['a2_article_a_an', 'a1_can', 'a2_to_non_finite_forms', 'a1_countable_nouns']"
All uses of BNF in the next chapter ( Lexical Analysis ) are lexical definitions; uses in subsequent chapters are syntactic definitions.,"['a1_to_be_present_is_am_are', 'a1_plural_forms', 'a1_countable_nouns']"
But how can I look without Quirrell realizing what I'm up to?,"['a1_special_questions', 'a1_to_be_present_is_am_are', 'a1_can', 'a1_personal_pronouns']"
"Once term had started, they were back to skimming through books for ten minutes during their breaks.","['a2_past_perfect_basic', 'a1_to_be_past_was_were', 'a1_plural_forms', 'a1_personal_pronouns', 'a1_countable_nouns']"
"I'd like to see your mom and dad, Ron said eagerly.","['a1_want_would_like_to', 'a1_possessive_pronouns', 'a2_say_reported_verb']"
"He couldn't know that at this very moment, people meeting in secret all over the country were holding up their glasses and saying in hushed voices:","['a2_could', 'a2_past_continuous', 'a1_plural_forms', 'a1_possessive_pronouns', 'a1_uncountable_nouns', 'a2_article_the']"
Harry didn't think there was anything wrong with not being able to afford an owl.,"['a1_past_simple_reg', 'a1_there_was_were', 'a2_to_non_finite_forms', 'a2_article_a_an', 'a1_countable_nouns']"
"She hacked a long, serious cough and spat into the leaves.","['a1_past_simple_reg', 'a1_plural_forms', 'a1_personal_pronouns', 'a2_article_the', 'a1_past_simple_irreg']"
"Thus, we proceeded to take the heavily locked gate off its hinges, drive the car through, and put the gate back together.","['a1_past_simple_reg', 'a2_to_non_finite_forms', 'a2_article_the', 'a1_possessive_pronouns', 'a1_plural_forms', 'a1_past_simple_irreg', 'a1_personal_pronouns']"
"We are all just normal people, no matter what it says in our CV's.","['a1_to_be_present_is_am_are', 'a1_present_simple_3d_pers', 'a1_possessive_pronouns']"
Everything other than the words eggs or bacon that come out of his mouth are complete bullshit.,"['a1_countable_nouns', 'a1_plural_forms', 'a1_singular_nouns', 'a1_to_be_present_is_am_are', 'a2_article_the', 'a1_present_simple_reg_act']"
"If a customer has a poor first impression of you, it could take a while to earn their trust.","['a2_first_conditional_if_m', 'a2_could', 'a1_present_simple_3d_pers', 'a2_article_a_an', 'a1_singular_nouns', 'a2_to_non_finite_forms', 'a1_possessive_pronouns']"
"In 2014, the government of Ghana began developing a plan to reduce congestion and overhaul the urban transportation system in the Greater Accra Metropolitan Area (Gama) which includes Accra and its outskirts.","['a1_past_simple_irreg', 'a2_ing_non_finite_forms', 'a2_to_non_finite_forms', 'a2_relative_clause_who_which_that', 'a1_present_simple_3d_pers', 'a1_possessive_pronouns', 'a1_plural_forms', 'a1_singular_nouns', 'a2_article_a_an', 'a2_article_the']"
"And just like my new dog, it was an idea that got bigger than I'd imagined.","['a1_possessive_pronouns', 'a1_comparative_short', 'a2_narrative_tenses', 'a2_past_perfect_basic', 'a1_to_be_past_was_were', 'a2_article_a_an', 'a1_singular_nouns']"
"The book, published in 1623, contains 36 plays, 18 of which had not appeared in print before.","['a1_singular_nouns', 'a1_past_simple_reg', 'a1_present_simple_3d_pers', 'a2_relative_clause_who_which_that', 'a1_plural_forms', 'a2_narrative_tenses', 'a2_past_perfect_basic']"
"They did have electricity, but it was illegal service tapped from someone else's wires, and could only power one feeble bulb.","['a1_past_simple_reg', 'a1_there_was_were', 'a1_possesive_s_sing', 'a1_plural_forms', 'a1_singular_nouns', 'a2_could', 'a2_zero_article']"
"And so you see these things, it's not just always smiling.","['a1_present_simple_reg_act', 'a1_plural_forms', 'a1_present_continuous_act_rn', 'a1_personal_pronouns']"
Years ago when I came out I went to the wall Western Wall in Jerusalem.,"['a1_past_simple_irreg', 'a2_narrative_tenses', 'a1_personal_pronouns', 'a2_article_the', 'a2_zero_article']"
These communities in these cities are actually more vital than the illegal communities.,"['a1_to_be_present_is_am_are', 'a1_comparative_long', 'a1_plural_forms', 'a2_article_the']"
We tried not to act on the feelings for a long time but we couldn't help it.,"['a1_past_simple_reg', 'a2_could', 'a1_personal_pronouns', 'a2_to_non_finite_forms', 'a1_uncountable_nouns', 'a1_plural_forms']"
"We can make it complicated, but what's the world fighting over right now?","['a1_can', 'a1_personal_pronouns', 'a1_special_questions', 'a1_present_continuous_act_rn', 'a2_article_the']"
"For demagogues, it's the delusion that compromise with a different belief system corrupts your principles and weakens your argument.","['a1_to_be_present_is_am_are', 'a2_article_the', 'a2_article_a_an', 'a1_present_simple_3d_pers', 'a1_possessive_pronouns']"
Maybe she showers three times a day to make sure she has a clean butthole to greet him with.,"['a1_present_simple_3d_pers', 'a2_to_non_finite_forms', 'a2_article_a_an', 'a1_personal_pronouns', 'a1_singular_nouns', 'a1_plural_forms']"
One day my mom gets home and tells us that he tried to throw a cat in front of the car as she drove past.,"['a1_present_simple_reg_act', 'a1_past_simple_reg', 'a2_to_non_finite_forms', 'a1_singular_nouns', 'a2_article_a_an', 'a1_past_simple_irreg', 'a1_countable_nouns']"
All of this will give the illusion of a thinner lens and give you less of that coke-bottle look.,"['a1_future_simple', 'a1_singular_nouns', 'a2_article_a_an']"
"The data and the DOM are now linked, and everything is now reactive.","['a2_article_the', 'a2_passive_present_simple', 'a1_to_be_present_is_am_are', 'a1_uncountable_nouns']"
"Each inference thread invokes a JIT interpreter that executes the ops of a model inline, one by one.","['a1_present_simple_3d_pers', 'a2_article_a_an', 'a1_singular_nouns', 'a2_relative_clause_who_which_that']"
"Harry, Ron and Hermione shivered slightly - the towering white chessmen had no faces.","['a1_past_simple_reg', 'a1_be_have_do_in_the_past', 'a1_plural_forms', 'a2_article_the']"
"I've been out here for hours, I couldn't remember the new password to get in to bed.","['a2_present_perfect', 'a2_could', 'a2_to_non_finite_forms', 'a2_article_the', 'a2_zero_article', 'a1_countable_nouns', 'a1_plural_forms']"
He had seen his parents and would be seeing them again tonight.,"['a2_past_perfect_basic', 'a1_plural_forms', 'a1_countable_nouns', 'a1_personal_pronouns']"
"A little way into it they reached a fork in the earth path, and Harry, Hermione, and Hagrid took the left path while Malfoy, Neville, and Fang took the right.","['a1_past_simple_reg', 'a1_past_simple_irreg', 'a1_countable_nouns', 'a2_article_a_an', 'a2_article_the', 'a2_narrative_tenses']"
"Dragon breeding was outlawed by the Warlocks' Convention of 1709, everyone knows that.","['a1_to_be_past_was_were', 'a1_possessive_s_plurar', 'a2_passive_past_simple', 'a1_present_simple_3d_pers']"
"For the first time, I didn't follow the safe way.","['a1_past_simple_reg', 'a2_article_the', 'a1_uncountable_nouns']"
"I suppose it's for the taking, just sittin' there like that.","['a1_to_be_present_is_am_are', 'a1_present_simple_reg_act']"
"If you're overwhelmed and 'go dark,' that's not good.","['a2_zero_conditional_if_m', 'a1_to_be_present_is_am_are', 'a1_personal_pronouns']"
You've got countries that have become well-known because of a certain dish.,"['a1_personal_pronouns', 'a1_have_has_got', 'a2_present_perfect', 'a1_countable_nouns', 'a2_article_a_an', 'a1_plural_forms']"
"By following the method of SMART goals, one can define the relevant actions within a defined period of time to achieve one's goals.","['a2_article_the', 'a1_can', 'a1_plural_forms', 'a2_article_a_an', 'a1_countable_nouns', 'a1_possesive_s_sing']"
"In a statement, the UN refugee agency said it was working to resettle LGBTI refugees currently living in Turkey, and expressed sadness about Sankari's death.","['a2_say_reported_verb', 'a2_past_continuous', 'a2_to_non_finite_forms', 'a1_past_simple_reg', 'a1_past_simple_irreg', 'a1_possesive_s_sing', 'a2_article_a_an', 'a2_article_the']"
I'm an identical twin; I am interested in why we're all alike.,"['a1_to_be_present_is_am_are', 'a2_article_a_an', 'a1_singular_nouns', 'a1_countable_nouns']"
We would sit together on the sofa and watch her favorite television show - Jeopardy! - even if she wasn't exactly sure who I was.,"['a1_countable_nouns', 'a1_possessive_pronouns', 'a1_personal_pronouns', 'a1_to_be_past_was_were']"
"But if you're only 50, then there's a chance that you might be able to pull out of the dive","['a2_zero_conditional_if_m', 'a1_there_is_am_are', 'a2_to_non_finite_forms', 'a1_personal_pronouns', 'a2_article_a_an']"
"In a preview, the Times said the Republican candidate discloses nothing concrete about himself or his plans while promising the moon and offering the stars on layaway .","['a2_say_reported_verb', 'a1_possessive_pronouns', 'a1_present_simple_3d_pers', 'a2_article_the', 'a2_article_a_an']"
And so we thought perhaps there might be a better way to come up with an alternative cooking fuel.,"['a1_past_simple_irreg', 'a2_to_non_finite_forms', 'a2_article_a_an']"
"We're working as animals, said one of Sankari's friends, a literature graduate who was a teacher in Syria but now works as a waiter in Turkey.","['a2_present_continuous_cafe', 'a2_relative_clause_who_which_that', 'a1_to_be_past_was_were', 'a2_article_a_an', 'a1_present_simple_reg_act', 'a2_zero_article', 'a2_say_reported_verb', 'a1_possesive_s_sing', 'a1_plural_forms', 'a1_countable_nouns', 'a1_singular_nouns']"
"I think this one here, there's a pop song that really describes Philippe Starck for me, you know,","['a1_present_simple_reg_act', 'a1_there_is_am_are', 'a2_article_a_an', 'a1_singular_nouns', 'a1_countable_nouns', 'a2_relative_clause_who_which_that', 'a1_present_simple_3d_pers', 'a2_zero_article', 'a1_personal_pronouns']"
Mom: Shouldn't we buy a fish that's at least the same color?,"['a2_should', 'a2_article_a_an', 'a1_countable_nouns', 'a1_to_be_present_is_am_are', 'a2_article_the']"
"Nobody can get laid in a PT Cruiser, much less a yellow one.","['a1_can', 'a2_much_many_a_lot', 'a2_article_a_an']"
"I was not stung once, and I became an adept wasp killer.","['a1_to_be_past_was_were', 'a1_past_simple_irreg', 'a1_countable_nouns', 'a1_singular_nouns', 'a2_article_a_an']"
My dad once told me that snapping turtles will bite you and won't let go until the sun goes down.,"['a1_possessive_pronouns', 'a2_tell_reported_verb', 'a1_plural_forms', 'a1_countable_nouns', 'a1_future_simple', 'a2_article_the', 'a1_present_simple_3d_pers']"
"If you are totally new to frontend development, it might not be the best idea to jump right into a framework as your first step - grasp","['a2_first_conditional_if_m', 'a1_to_be_present_is_am_are', 'a1_superlative_exept', 'a1_countable_nouns', 'a1_singular_nouns', 'a2_to_non_finite_forms', 'a2_article_a_an', 'a2_article_the', 'a1_possessive_pronouns']"
That's because Vue's component syntax is loosely modeled after the spec.,"['a1_to_be_present_is_am_are', 'a1_possesive_s_sing', 'a1_singular_nouns', 'a2_passive_present_simple', 'a2_article_the']"
"Fortunately, Visual C++ installs shortcuts for you to launch a developer command prompt that has the environment set up for command line builds.","['a1_present_simple_3d_pers', 'a2_to_non_finite_forms', 'a1_plural_forms', 'a2_article_the']"
"They stopped and so did he, just near enough to hear what they were saying.","['a1_past_simple_reg', 'a2_to_non_finite_forms', 'a2_past_continuous', 'a1_personal_pronouns']"
"The traffic moved on and a few minutes later, Mr. Dursley arrived in the Grunnings parking lot, his mind back on drills.","['a1_past_simple_reg', 'a2_article_the', 'a1_possessive_pronouns', 'a2_article_a_an']"
"Ducking down, they joined the Hufflepuffs going the other way, slipped down a deserted side corridor, and hurried off toward the girls' bathroom.","['a1_personal_pronouns', 'a1_past_simple_reg', 'a2_article_the', 'a2_article_a_an', 'a1_possessive_s_plurar', 'a1_countable_nouns']"
"Piers, Dennis, Malcolm, and Gordon were all big and stupid, but as Dudley was the biggest and stupidest of the lot, he was the leader.","['a1_to_be_past_was_were', 'a1_superlative_short', 'a2_article_the', 'a1_personal_pronouns', 'a1_countable_nouns']"
"Then she met that Potter at school and they left and got married and had you, and of course I knew you'd be just the same, just as strange,","['a1_personal_pronouns', 'a1_past_simple_irreg', 'a1_be_have_do_in_the_past', 'a2_article_the']"
"Then, on your way out, don't forget to visit the souvenir shop.","['a2_imperatives', 'a2_to_non_finite_forms', 'a2_article_the', 'a1_countable_nouns', 'a1_possessive_pronouns']"
I realized the world was moving online and figured it was now or never to bet on myself.,"['a1_past_simple_reg', 'a1_personal_pronouns', 'a2_article_the', 'a2_past_continuous', 'a1_to_be_past_was_were', 'a2_to_non_finite_forms']"
