sent,type
"Dudley squeaked and ran to hide behind his mother, who was crouching, terrified, behind Uncle Vernon.","['1_past_simple_irreg', 'a1_past_simple_reg', 'a2_to_non_finite_forms', 'a2_relative_clause_who_which_that', 'a1_present_continuous_act_rn']"
"If you tell a story and fudge some facts because it will distract from the positive points, that's spin.","['a2_first_conditional_if_m', 'a1_present_simple_reg_act', 'a1_future_simple', 'a1_to_be_present_is_am_are']"
"Instead of being intimidated by the effort, they get inspired by a clear and compelling 'why'.","['a2_ing_non_finite_forms', 'a2_adjectives_ed', 'a2_adjectives_ing', 'a1_present_simple_reg_act']"
"So, I'm going to show you an example of a company that does not have a tap counter.","['a2_is_am_are_going_to', 'a1_present_simple_3d_pers']"
And people in the fashion business know what it's like to be in the fashion business - they're used to it.,"['a1_present_simple_reg_act', 'a1_to_be_present_is_am_are', 'a2_to_non_finite_forms']"
"A Jewish online magazine reported on that and it sparked off online, I got really abusive messages.","['1_past_simple_irreg', 'a1_past_simple_reg']"
"People are not happy to be in financial quarantine themselves, while at the same time observing politicians stashing money offshore.","['a1_to_be_present_is_am_are', 'a2_to_non_finite_forms', 'a2_adjectives_ing']"
McD's invested in the company in the early days and helped them grow but sold out when Chipotle shares went public.,"['a1_past_simple_reg', 'a2_zero_non_finite_forms', '1_past_simple_irreg']"
"He clapped his hands once, and the ropes binding Harry fell off.","['a1_past_simple_reg', '1_past_simple_irreg']"
"At last, only the Weasley twins were left singing along to a very slow funeral march.",['a1_to_be_past_was_were']
We can all vouch from personal experience that changing existing habits or building new ones is not an easy process.,"['a1_can', 'a2_ing_non_finite_forms', 'a1_to_be_present_is_am_are']"
He was arrested and handed a ten-year sentence in Evin for defaming the Islamic Republic.,"['a2_passive_past_simple', 'a2_ing_non_finite_forms']"
The planet became an intense emitter of radio waves - the total output from all TV and cell phones and radar transmissions.,['1_past_simple_irreg']
And your assignment is to spend your life discovering what your assignment is.,"['a1_to_be_present_is_am_are', 'a2_to_non_finite_forms']"
He drove a wedge between himself and the few Republican leaders who publicly tolerated his nomination.,"['1_past_simple_irreg', 'a2_relative_clause_who_which_that', 'a1_past_simple_reg']"
"Those Jets led the AFL in defense in his first season on staff, then shocked the Colts in the Super Bowl, .","['1_past_simple_irreg', 'a1_past_simple_reg']"
"Holy shit, fucking people man, killing someone because he didn't have enough money to rob.","['1_past_simple_irreg', 'a1_be_have_do_in_the_past', 'a2_ing_non_finite_forms']"
"Seems a shame ter row, though, said Hagrid, giving Harry another of his sideways looks.","['a2_say_reported_verb', 'a1_present_simple_3d_pers']"
"Dumbledore, however, was choosing another lemon drop and did not answer.","['a2_past_continuous', 'a2_narrative_tenses', 'a1_past_simple_reg']"
"Arjun and Sai settled into a corner and sat on the floor, not saying anything.","['a1_past_simple_reg', '1_past_simple_irreg']"
"I am a blogger - that is an amazing thing for me, because it captures a moment in time every day.","['a1_present_simple_3d_pers', 'a1_to_be_present_is_am_are']"
"I don't think - now, this is a worldview, and I will tell you, everybody's got a worldview.","['a1_present_simple_reg_act', 'a1_to_be_present_is_am_are', 'a1_future_simple', 'a1_have_has_got']"
Trump could yet turn around his national polling deficit of up to 14 points.,['a2_could']
"Yet, contrary to what many expected, Obama herself has played the role in a notably traditional key.","['a1_past_simple_reg', 'a2_present_perfect']"
I once had a guy at a party try to lecture me about a particular topic.,"['a1_be_have_do_in_the_past', '1_past_simple_irreg', 'a2_zero_article', 'a2_to_non_finite_forms']"
There's more attention given to animal shelter conditions than prisons because the idea that the prisoners deserve this treatment is so common.,"['a1_to_be_present_is_am_are', 'a1_there_is_am_are', 'a1_present_simple_reg_act']"
"They walked straight past, and Harry leaned against the wall, breathing deeply, listening to their footsteps dying away.",['a1_past_simple_reg']
"He glanced at Harry and then looked quickly out of the window, pretending he hadn't looked.","['a1_past_simple_reg', 'a2_narrative_tenses', 'a2_past_perfect_basic']"
You say that as though all this just fell into my lap.,"['a1_present_simple_reg_act', '1_past_simple_irreg', 'a2_say_reported_verb']"
"If a problem arises he deals with it then, not later, and eats.","['a2_zero_conditional_if_m', 'a1_present_simple_3d_pers']"
There's only been two concepts tried - two by the U.S. and one by the Russians.,['a2_present_perfect']
And this is Donna teaching my aunt how to do a Filipino dance.,"['a1_to_be_present_is_am_are', 'a2_to_non_finite_forms']"
"And the vagaries of mean it will be impossible to predict with accuracy, even in its final moments.","['a1_to_be_future_will_be', 'a2_to_non_finite_forms']"
We had to fight hard for Homer falling down the canyon in Bart the Daredevil and it worked well.,"['a2_had_to', 'a2_ing_non_finite_forms', 'a1_past_simple_reg']"
"I have to say, I really enjoy being part of such a good joke.","['a2_have_to', 'a2_ing_non_finite_forms', 'a1_present_simple_reg_act']"
"It was chalk white with glaring red eyes and slits for nostrils, like a snake.",['a1_to_be_past_was_were']
"When Harry pulled back his sheets, he found his Invisibility Cloak folded neatly underneath them.","['a1_past_simple_reg', '1_past_simple_irreg']"
Then you could scoot out for a day or weekend with few being the wiser.,"['a2_could', 'a1_comparative_short', 'a2_ing_non_finite_forms']"
"Once the brain gets used to the new reward, the new routine will become a habit.","['a1_present_simple_3d_pers', 'a1_future_simple']"
And a lot of the replies I got were that muscle is terminally differentiated tissue.,"['a2_much_many_a_lot', '1_past_simple_irreg', 'a1_to_be_present_is_am_are']"
We think about the world in all the ways that we experience it.,"['a1_present_simple_reg_act', 'a2_relative_clause_who_which_that']"
"To apply for resettlement in the west, or to secure even basic support from NGOs, Sankari needed to return to Hatay.","['a2_to_non_finite_forms', 'a1_past_simple_reg']"
They also said their confessions were coerced by a deputy who threatened them with the death penalty.,"['1_past_simple_irreg', 'a2_say_reported_verb', 'a2_past_reported_speech', 'a1_past_simple_reg']"
"Trees, cars and people looked more alive and more vivid than ever.","['a1_past_simple_reg', 'a1_comparative_short']"
A few years back one of my friends started going out with this girl.,"['a1_past_simple_reg', 'a2_ing_non_finite_forms']"
"I'm sorry to say I sold the wand that did it, he said softly.","['a1_to_be_present_is_am_are', 'a2_to_non_finite_forms', 'a1_be_have_do_in_the_past', '1_past_simple_irreg', 'a2_say_reported_verb']"
"Harry had also forgotten that Malfoy had gotten a detention, too.",['a2_past_perfect_basic']
"Despite this, exercise for me seems to have a positive effect not just over the long term, but immediately.",['a1_present_simple_3d_pers']
They were not intended to cause offense; he had hoped to show the human side of this revered figure.,"['a2_passive_past_simple', 'a2_past_perfect_basic', 'a2_to_non_finite_forms']"
"Finally, I did find a bull rider, two years ago.","['a1_be_have_do_in_the_past', '1_past_simple_irreg']"
The simpler explanation is that he is losing because of his own performance and personality.,"['a1_to_be_present_is_am_are', 'a1_present_continuous_act_rn']"
Anderson absolutely didn't murder Assange with a Pret vegan sandwich on Saturday.,['a1_past_simple_reg']
Derpette: I'm not supposed to be alone in the hallway with a guy.,"['a1_to_be_present_is_am_are', 'a2_to_non_finite_forms']"
At the young budding age of around 9 or 10 there was an election to be class representative.,"['a1_there_was_were', 'a2_to_non_finite_forms']"
"Uncle Vernon rapped the glass smartly with his knuckles, but the snake just snoozed on.",['a1_past_simple_reg']
The Weasleys were clearly one of those old wizarding families the pale boy in Diagon Alley had talked about.,"['a2_past_perfect_basic', 'a1_to_be_past_was_were', 'a2_narrative_tenses']"
"Now, it's not about creating more content to prove you're an expert either.","['a1_to_be_present_is_am_are', 'a1_comparative_short', 'a2_to_non_finite_forms', 'a2_ing_non_finite_forms']"
"In fact, I had quite a terrible night of sleep, so I'm pretty low on energy.","['a1_be_have_do_in_the_past', 'a2_had_to', 'a1_to_be_present_is_am_are']"
That's as it was given to us in all of its clarity and glory.,"['a1_to_be_present_is_am_are', 'a2_passive_past_simple']"
"But what's interesting to me is that we haven't looked at this, as much.","['a1_to_be_present_is_am_are', 'a2_present_perfect']"
"But if that is the case, why did Comey not have a confidential word with the relevant congressional oversight committees?","['a1_to_be_present_is_am_are', '1_past_simple_irreg', 'a1_special_questions', 'a1_be_have_do_in_the_past']"
"We were right there every step of the way with them, and this was a team and world champions.",['a1_to_be_past_was_were']
"It stuck up at the back, just as Harry's did.","['1_past_simple_irreg', 'a1_be_have_do_in_the_past']"
"Should tell Filch, I should, said Peeves in a sanity voice, but his eyes glittered wickedly.","['a2_should', 'a1_past_simple_reg']"
The effect becomes clearer when plotting the total amount of REM sleep I've been getting each night by itself.,['a2_ing_non_finite_forms']
It is preferable if your location is permanent and the institution knows the location's latitude and longitude.,"['a1_to_be_present_is_am_are', 'a2_zero_conditional_m_if', 'a1_present_simple_3d_pers', 'a1_possesive_s_sing']"
It's not just simply relegated to a kind of 2D panning and motion.,['a2_passive_present_simple']
"He and fellow Floridian, Republican Marco Rubio, attempted to bring a $1.","['a1_past_simple_reg', 'a2_to_non_finite_forms']"
"Later that year, on a state visit to Britain, she wore an Azzedine AlaÃ¯a cardigan to meet the Queen.","['1_past_simple_irreg', 'a2_to_non_finite_forms']"
"His job where they decide what costs more, lawsuits or recalls?","['a2_relative_clause_others', 'a1_present_simple_reg_act', 'a1_present_simple_3d_pers']"
Is a dog's howl just a long bark or does it sound different?,"['a1_to_be_present_is_am_are', 'a1_possesive_s_sing', 'a1_present_simple_3d_pers']"
My brothers told me about you - you're Nearly Headless Nick!,"['1_past_simple_irreg', 'a2_tell_reported_verb', 'a1_to_be_present_is_am_are']"
"I told her you didn't expect any presents and - oh, no,","['a2_tell_reported_verb', 'a1_past_simple_reg']"
"I don't plan on making a glitter bomb, but I feel like I'm learning something.","['a1_present_simple_reg_act', 'a2_ing_non_finite_forms', 'a1_present_continuous_act_rn']"
"Taking a seat near the back, she turned to get a last glance at the chair.","['a2_ing_non_finite_forms', 'a1_past_simple_reg', 'a2_to_non_finite_forms']"
These are refrigerators that require no electricity; they're pot within a pot design.,"['a1_to_be_present_is_am_are', 'a1_present_simple_reg_act']"
The Mail included a retraction of the story in its Friday UK print edition.,['a1_past_simple_reg']
"I'll think about that stuff, I don't know when.","['a1_future_simple', 'a1_present_simple_reg_act']"
They will also go to Whole Foods to eat the samples as a meal supplement.,"['a1_future_simple', 'a2_to_non_finite_forms']"
He made a new subreddit for every response better than adam savage did at the beginning.,"['1_past_simple_irreg', 'a1_comparative_exept', 'a1_be_have_do_in_the_past']"
"Ministry o' Magic messin' things up as usual, Hagrid muttered, turning the page.",['a1_past_simple_reg']
It towered over them as they sailed nearer and nearer to the cliff on which it stood.,"['a1_past_simple_reg', 'a1_comparative_short', '1_past_simple_irreg']"
"About a minute later, it cleared enough for him to open his eyes again.","['a1_past_simple_reg', 'a2_to_non_finite_forms']"
"They want to, as Jimmy said, they want to have a dialogue, a conversation.","['a1_present_simple_reg_act', 'a2_say_reported_verb', '1_past_simple_irreg']"
"Thus 900,000 people either have died or have significant damage to their heart muscle.","['a2_present_perfect', 'a1_present_simple_reg_act']"
You can get in touch with any questions you'd like to see answered in this series by emailing mona.,"['a1_can', 'a1_want_would_like_to', 'a2_to_non_finite_forms']"
They said the charges against Martin were mere allegations and they had not yet seen prosecutors' evidence.,"['1_past_simple_irreg', 'a1_to_be_past_was_were', 'a2_past_perfect_basic']"
The spider circled around to the other side and crept up behind waspinator and bit him right near the head.,"['a1_past_simple_reg', '1_past_simple_irreg']"
"I was jokingly challenging my philosophy teacher with a 1 m ruler, sort of like a sword.",['a2_past_continuous']
Harry jumped; he had almost forgotten that the Dursleys were there.,"['a2_past_perfect_basic', 'a1_past_simple_reg', 'a2_narrative_tenses', 'a1_to_be_past_was_were']"
"Sitting next to her on the stoop, he noticed the new addition to her porch.",['a1_past_simple_reg']
This little thing says here: five times what NASA's doing by 2020.,"['a1_present_simple_3d_pers', 'a1_present_continuous_act_rn']"
"And then they flew a few cargo flights, and took it out of service.",['1_past_simple_irreg']
"That's not my practice, I couldn't do it, he says.","['a2_could', 'a2_say_reported_verb', 'a1_present_simple_3d_pers', 'a1_to_be_present_is_am_are']"
"It is known, though, that Trump owes $364m to Deutsche Bank.","['a2_passive_present_simple', 'a1_present_simple_3d_pers']"
"Maybe, but I agree with this doctor and it doesn't seem to violate the AMA code of ethics.","['a1_present_simple_reg_act', 'a1_present_simple_3d_pers', 'a2_to_non_finite_forms']"
I was somehow relieved of this thing I didn't know existed.,"['a2_past_reported_speech', '1_past_simple_irreg']"
"Anyway, we've never had any proof Snape found out how to get past Fluffy.","['a2_present_perfect', 'a2_to_non_finite_forms']"
"If you like the launch vehicle, keep doing it over and over again.","['a2_zero_conditional_if_m', 'a1_present_simple_reg_act', 'a2_imperatives']"
Buying a new house or apartment felt so wrong because it felt so permanent.,"['a2_ing_non_finite_forms', '1_past_simple_irreg']"
"And, you know, we don't hear those stories enough.",['a1_present_simple_reg_act']
"Not the bank's computer or Lockheed's computer, but the home computer was for games.","['a1_possesive_s_sing', 'a1_to_be_past_was_were']"
But what you might not know is that two PokÃ©mon of the same type and level are also not equal.,['a1_to_be_present_is_am_are']
The university wants to come to terms with its past and take the abstract concepts of reconciliation and redemption and make them tangible.,"['a1_present_simple_3d_pers', 'a2_to_non_finite_forms']"
"I realized I was no longer depressed, and I had a desire to change.","['a1_past_simple_reg', '1_past_simple_irreg', 'a1_be_have_do_in_the_past', 'a2_adjectives_ed']"
"About once a week, Uncle Vernon looked over the top of his newspaper and shouted that Harry needed a haircut.",['a1_past_simple_reg']
"Well, Nicolas and I have had a little chat, and agreed it's all for the best.","['a2_present_perfect', 'a1_past_simple_reg', 'a1_to_be_present_is_am_are']"
"Sitting on the opposite corner of her apartment building, seemed to beckon her attention.","['a2_ing_non_finite_forms', 'a1_past_simple_reg', 'a2_to_non_finite_forms']"
"OK, at first women were a little shy, a little reluctant to talk.","['a1_to_be_past_was_were', 'a2_to_non_finite_forms']"
It forces air through a Venturi force if there's no wind.,"['a1_present_simple_reg_act', 'a2_zero_conditional_m_if', 'a1_to_be_present_is_am_are']"
You can't turn on the radio or TV without being bombarded by election news.,"['a1_can', 'a2_ing_non_finite_forms']"
For what presidential candidate in recent memory could that be further from the truth?,"['a2_could', 'a1_comparative_exept']"
"Teddy is no longer with us, so a moment of silence for #26.",['a1_to_be_present_is_am_are']
"They don't look very vicious, but I suppose if they all swooped down at once . . .","['a1_present_simple_reg_act', 'a1_past_simple_reg']"
Flitwick told me in secret that I got a hundred and twelve percent on his exam.,"['a2_tell_reported_verb', '1_past_simple_irreg']"
She definitely had a dog who couldn't wait to mangle him.,"['1_past_simple_irreg', 'a1_be_have_do_in_the_past', 'a2_could', 'a2_zero_non_finite_forms']"
He waited for a minute and glanced at his watch - 5.56 pm.,['a1_past_simple_reg']
"I've had this image of a water droplet for 20 years, sitting on a hot bed.",['a2_present_perfect']
"Now, if I gave you this problem to do, you would all say, it's very simple.","['a2_second_conditional_if_m', '1_past_simple_irreg', 'a1_to_be_present_is_am_are']"
He also spent charitable funds on multiple portraits of himself and on a football helmet autographed by Heisman Trophy winner Tim Tebow.,['1_past_simple_irreg']
The guy is basically saying Tom doesn't know what he's talking about because his business was a big failure.,"['a1_present_continuous_act_rn', 'a1_to_be_past_was_were']"
She is now 4 months along and to compound things more my wife is currently 3 months pregnant.,"['a1_to_be_present_is_am_are', 'a2_to_non_finite_forms', 'a1_comparative_exept']"
"I bet you'll think twice about breaking a school rule again,","['a1_future_simple', 'a1_present_simple_reg_act', 'a2_ing_non_finite_forms']"
He bought Harry a hamburger and they sat down on plastic seats to eat them.,"['1_past_simple_irreg', 'a2_to_non_finite_forms']"
I strive to write at least 1 article per day on Medium and another article each day for my blog.,"['a1_present_simple_reg_act', 'a2_to_non_finite_forms']"
About a year ago I leaped and started my own company working as a self-employed developer.,['a1_past_simple_reg']
"And I used to be bothered by that, and then I got to thinking, well, wait a minute.","['a1_past_simple_reg', '1_past_simple_irreg']"
"Now, why do I say that this is a big problem?","['a1_special_questions', 'a1_to_be_present_is_am_are', 'a1_present_simple_reg_act']"
"That's not really about African American voters, but about white suburban voters.",['a1_to_be_present_is_am_are']
"The console war is now between the Nintendo U, Nintendo 4, and Nintendo One.",['a1_to_be_present_is_am_are']
The problem now is asking other sexual partners to do this without sounding crazy.,"['a1_present_continuous_act_rn', 'a2_to_non_finite_forms']"
"Well, I'll see you at Hogwarts, I suppose, said the drawling boy.","['a1_future_simple', 'a2_say_reported_verb']"
"Harry looked at Ron, who was still standing with his wand in the air.","['a1_past_simple_reg', 'a1_to_be_past_was_were']"
"His voice signposted the class of company he kept, the kind of muted executive swagger one collects when ascending multiple wage brackets.","['a1_past_simple_reg', '1_past_simple_irreg', 'a2_adjectives_ed', 'a1_present_simple_3d_pers']"
"I imagine standing here as dusk settles, the smell of woodsmoke drifting on the wind.",['a1_present_simple_reg_act']
"And where that energy touches water, something new emerges: life.",['a1_present_simple_3d_pers']
What you're seeing here is actually their program on the left.,"['a1_present_continuous_act_rn', 'a1_to_be_present_is_am_are']"
"Back in the early days of that would never happen, they said.",['a2_say_reported_verb']
"In March, he called Trump a phony and dissed Trump's business acumen.","['a1_past_simple_reg', 'a1_possesive_s_sing']"
"After rolling down this cliff, I got up to find the mouth of a cave.","['1_past_simple_irreg', 'a2_to_non_finite_forms']"
So if you were a Puritan man you had to give it to your wife until she was a Quaker?,"['a2_second_conditional_if_m', 'a2_had_to', 'a1_to_be_past_was_were']"
"And the fleet of little boats moved off all at once, gliding across the lake, which was as smooth as glass.","['a1_past_simple_reg', 'a1_to_be_past_was_were']"
"My dear Professor, I've never seen a cat sit so stiffly.",['a2_present_perfect']
This might be explained by the fact that this is also the night I'm most likely to spend with my girlfriend.,"['a1_to_be_present_is_am_are', 'a1_superlative_exept', 'a2_to_non_finite_forms']"
"And, my Western, Eastern, Southern Bantu heritage speaks to an older migration, whose influence lasted thousands of years.","['a1_present_simple_3d_pers', 'a1_comparative_short', 'a2_relative_clause_others', 'a1_past_simple_reg']"
"I hope this is obvious, but I'm not a hippie.","['a1_present_simple_reg_act', 'a1_to_be_present_is_am_are']"
"We didn't have Google, we didn't have web crawlers, we didn't have computers.","['1_past_simple_irreg', 'a1_be_have_do_in_the_past']"
But other companies have chosen more conservative descriptions for their assisted cruise control.,"['a2_present_perfect', 'a1_comparative_exept', 'a2_adjectives_ed']"
It also pointed out that autopilot is still in a public beta phase.,"['a1_to_be_present_is_am_are', 'a1_past_simple_reg']"
"This is the open throat they will sink their teeth into, and never, ever, ever let go.","['a1_to_be_present_is_am_are', 'a1_future_simple']"
If there is someone sitting on ~2 meters long bench on bus stop nobody else goes sit there.,"['a2_zero_conditional_if_m', 'a1_there_is_am_are']"
Uncle Vernon entered the kitchen as Harry was turning over the bacon.,"['a1_past_simple_reg', 'a2_past_continuous']"
I don't think it was an accident he let me find out how the mirror worked.,"['a1_present_simple_reg_act', 'a1_to_be_past_was_were', 'a2_zero_non_finite_forms', '1_past_simple_irreg', 'a1_past_simple_reg']"
The next person who borrowed a book would have to continue it from where it was left off on the laptop.,"['a1_past_simple_reg', 'a2_to_non_finite_forms', 'a1_to_be_past_was_were', 'a2_relative_clause_who_which_that']"
"After a few hours, they decided that they needed to get some sleep and went back to their rooms.","['a1_past_simple_reg', 'a2_to_non_finite_forms', '1_past_simple_irreg']"
You've got - the hydrogen atoms are in the wrong place.,"['a1_have_has_got', 'a1_to_be_present_is_am_are']"
And we're finding more and more gender differences in the brain.,"['a1_present_continuous_act_rn', 'a1_comparative_exept']"
"I use it to my own advantage, for my own goals.",['a1_present_simple_reg_act']
"If you, too, are feeling down about the fight ahead, don't be afraid to ask your elders for guidance.","['a1_present_continuous_act_rn', 'a2_imperatives', 'a2_to_non_finite_forms', 'a2_zero_conditional_if_m']"
I think I would probably just accept my fate and inhale as much water as humanly possible.,['a1_present_simple_reg_act']
"Now, why don't you put that admirable cloak back on and get off to bed?","['a1_special_questions', 'a1_present_simple_reg_act']"
"When used out of context, the term spin only serves to reinforce the belief that public relations practitioners are untrustworthy.","['a1_present_simple_3d_pers', 'a1_to_be_present_is_am_are']"
The problem with schedules arises when you write down way too many things you need to get done.,"['a1_present_simple_3d_pers', 'a1_present_simple_reg_act']"
"A couple of weeks ago, a French company asked us to design five billboards for them.","['a1_past_simple_reg', 'a2_to_non_finite_forms']"
"The big idea here is, I think, a new piece of a solution to a fairly big problem in transportation.","['a1_to_be_present_is_am_are', 'a1_present_simple_reg_act']"
"The Czech side believes that at least part of the debt should be dealt in cash, it said.","['a1_present_simple_3d_pers', 'a2_should', 'a2_passive_modal_verbs', 'a2_say_reported_verb']"
Temperature increases vary slightly according to park (the Grand Canyon has warmed on average by 2.,['a1_present_simple_reg_act']
"Because of the health care bill, you can stay on your parent's plan until you're twenty six.","['a1_can', 'a1_possesive_s_sing', 'a1_to_be_present_is_am_are']"
"She is dropping him off at school and will answer my questions about the bedsheets, etc.","['a1_present_continuous_act_rn', 'a1_future_simple']"
"I might be able to hold Snape off for a while, but I'm no match for him, really.","['a2_to_non_finite_forms', 'a1_to_be_present_is_am_are']"
He was about to go back upstairs when Uncle Vernon actually spoke.,"['a1_to_be_past_was_were', '1_past_simple_irreg']"
"When working in sales, you must focus on building a relationship with your customers.","['a2_must', 'a2_ing_non_finite_forms']"
"Then, he cracked it open to find Mariam, his old girlfriend.","['a1_past_simple_reg', 'a2_to_non_finite_forms']"
"In 2001, when the Russian Mir space station had reached the end of its life, Roscosmos the outpost into the Pacific.","['a2_past_perfect_basic', 'a2_narrative_tenses']"
"To be generous, his views on major economic issues are eclectic.",['a1_to_be_present_is_am_are']
Here's how it will look: The first 5-10 minutes will be an exciting teaser.,"['a1_future_simple', 'a1_to_be_present_is_am_are', 'a1_to_be_future_will_be', 'a2_adjectives_ing']"
"So it's fine when Katy Perry follows her around and grabs at her, but I'm somehow different?!","['a1_to_be_present_is_am_are', 'a1_present_simple_3d_pers']"
"Madam Hooch was bending over Neville, her face as white as his.",['a2_past_continuous']
