sent,type
"Donald Trump can give a hot damn about African Americans, but he comes out and says, 'I want to help inner cities,' he said.","['a1_can', 'a2_article_a_an', 'a2_zero_article', 'a1_present_simple_3d_pers', 'a1_present_simple_reg_act', 'a2_say_reported_verb', 'a1_plural_forms', 'a1_countable_nouns']"
You can plug in and experience what it's like to be someone else.,"['a1_can', 'a1_to_be_present_is_am_are', 'a2_to_non_finite_forms', 'a1_personal_pronouns']"
"I mean, put 200k miles on it and drive it until it just doesn't want to go anymore?","['a1_present_simple_reg_act', 'a2_imperatives', 'a1_present_simple_3d_pers', 'a1_personal_pronouns', 'a2_to_non_finite_forms']"
"I have many to add to this but the best was a family that had a Jaguar in the driveway, getting 3 HD DVR boxes, international dish with channels.","['a1_present_simple_reg_act', 'a2_to_non_finite_forms', 'a1_superlative_exept', 'a2_article_a_an', 'a1_be_have_do_in_the_past', 'a1_past_simple_irreg', 'a1_plural_forms', 'a1_countable_nouns']"
"Much better source than most people give it credit for, and great for random learning whenever you need it.","['a1_comparative_short', 'a1_present_simple_reg_act', 'a1_singular_nouns']"
"The edges will be beveled thinner (like in the picture again) and will not have a prescription,","['a2_passive_will', 'a1_future_simple', 'a2_article_a_an', 'a1_possesive_s_sing', 'a1_comparative_short']"
"It is not particularly evil, but it is a misdeed that completely altered that guy's life.","['a1_to_be_present_is_am_are', 'a2_article_a_an', 'a1_singular_nouns', 'a1_past_simple_reg', 'a1_possesive_s_sing', 'a1_countable_nouns']"
The snake jabbed its tail at a little sign next to the glass.,"['a2_article_the', 'a1_singular_nouns', 'a2_article_a_an', 'a1_countable_nouns', 'a1_past_simple_reg']"
"Ah, go boil yer heads, both of yeh, said Hagrid.","['a2_say_reported_verb', 'a2_imperatives']"
"The zoo director himself made Aunt Petunia a cup of strong, sweet tea while he apologized over and over again.","['a1_past_simple_irreg', 'a1_past_simple_reg', 'a2_narrative_tenses']"
He shouted something about Quidditch fouls when Harry roughly shook him awake.,"['a1_past_simple_reg', 'a1_past_simple_irreg', 'a2_narrative_tenses']"
"And all the time there had been a small fortune belonging to him, buried deep under London.",['a2_past_perfect_basic']
"For those that regularly sleep outside in both warm summer temperatures and cold winter temperatures, it's probably best to get two sleeping bags.","['a2_relative_clause_who_which_that', 'a1_present_simple_reg_act', 'a1_to_be_present_is_am_are', 'a2_to_non_finite_forms']"
"Just as I started to lift my laptop to hand to her, she stopped me, Nuh","['a1_past_simple_reg', 'a2_to_non_finite_forms']"
But you'll also communicate a subtle certainty that whatever angst stands in their way now will soon end.,"['a1_future_simple', 'a1_present_simple_3d_pers']"
"For now, all we can advise is that you stay inland, and remain outdoors and avoid large buildings as far as possible.","['a1_can', 'a1_present_simple_reg_act']"
"When I lived in the UK, I overlooked the power of community.","['a1_past_simple_reg', 'a2_narrative_tenses']"
"More than 120 police officers were injured and 86 demonstrators detained during riots in Berlin, which police have described as the most aggressive and violent protests in the last five years .","['a2_passive_past_simple', 'a1_past_simple_reg', 'a2_present_perfect', 'a2_narrative_tenses']"
"The aid system does not have the knowledge, the vision, the ability.",['a1_present_simple_3d_pers']
"Trans people are the same as everyone else, our ideals in life are to be happy, to be respected, to be comfortable.","['a2_to_non_finite_forms', 'a1_to_be_present_is_am_are']"
"See, I think it's not really about impression, making people fall for a really perfect illusion, as much as it is to make - I usually work at the lowest threshold of visual illusion.","['a1_to_be_present_is_am_are', 'a1_present_simple_reg_act', 'a2_ing_non_finite_forms', 'a2_much_many_a_lot', 'a2_to_non_finite_forms', 'a1_superlative_short']"
"Now the real fight begins, and the economy will be a key - if not the key - battleground.","['a1_present_simple_3d_pers', 'a1_to_be_future_will_be']"
"He'll build a model, and then we're going to be scooped.","['a1_future_simple', 'a2_is_am_are_going_to']"
"On the night of her husband's election to office in 2008, she wore a Narciso Rodriguez dress in a fiery speckle pattern.",['a1_past_simple_irreg']
"We had our best Ph.D. students, our most advanced equipment around the world, we got 1/10,000th of the project done, so how're we going to get this done in 15 years?","['a1_be_have_do_in_the_past', 'a1_special_questions', 'a2_is_am_are_going_to', 'a2_to_non_finite_forms']"
Trump's support for Ryan's primary opponent was - like the construction of so many hideous Trump Towers - wholly unnecessary.,"['a1_to_be_past_was_were', 'a2_much_many_a_lot']"
I'll walk this dog right through that six part series on the Balkans.,['a1_future_simple']
How else are you supposed to start your girlfriend in the morning?,"['a1_special_questions', 'a2_to_non_finite_forms', 'a2_passive_present_simple']"
"And I'm glad I did, because I got to read some amazing stories people posted about the lives and deaths of their pets.","['a1_to_be_present_is_am_are', 'a1_be_have_do_in_the_past', 'a1_past_simple_irreg', 'a2_to_non_finite_forms', 'a1_past_simple_reg']"
"While the firefighters are trying to battle the flames, it is discovered that the house closest to the fire is a rather large cook house and cops show up and a huge bust goes down.","['a1_present_continuous_act_rn', 'a2_passive_present_simple', 'a1_superlative_short', 'a1_present_simple_3d_pers', 'a1_present_simple_reg_act']"
"Your friends, loving your glitter party, all put their funds together to buy you a hot tub.","['a1_present_simple_reg_act', 'a2_to_non_finite_forms']"
Edit: I don't think being redneck is sad; I feel bad that the little girl was upset by the jokes.,"['a1_present_simple_reg_act', 'a1_to_be_present_is_am_are', 'a1_to_be_past_was_were']"
"If there's a single input to an operation that requires gradient, its output will also require gradient.","['a2_first_conditional_if_m', 'a1_to_be_present_is_am_are', 'a1_present_simple_3d_pers', 'a1_future_simple']"
"Mainly to avoid all the staring eyes, Harry looked upward and saw a velvety black ceiling dotted with stars.","['a2_to_non_finite_forms', 'a1_past_simple_reg', 'a1_past_simple_irreg']"
"If Hagrid hadn't pointed it out, Harry wouldn't have noticed it was there.","['a2_past_perfect_basic', 'a1_there_was_were']"
"He wasn't the only one, though: the way Seamus Finnigan told it, he'd spent most of his childhood zooming around the countryside on his broomstick.","['a1_to_be_past_was_were', 'a2_past_perfect_basic']"
I think I got question fourteen b wrong. . . . ',"['a1_present_simple_reg_act', 'a1_past_simple_irreg']"
"Thirty-six, he said, looking up at his mother and father.","['a1_past_simple_irreg', 'a2_say_reported_verb']"
Let's just say the gap year he took after completing high school still hasn't ended.,"['a2_present_perfect', 'a2_imperatives', 'a1_past_simple_irreg']"
"Gam, I just need to make one stop on the way to the bus station.","['a1_present_simple_reg_act', 'a2_to_non_finite_forms']"
For starters he didn't go to college like the rest of them.,['a1_past_simple_irreg']
It's a well-known fact that salespeople like to talk.,"['a1_to_be_present_is_am_are', 'a1_present_simple_reg_act', 'a2_to_non_finite_forms']"
He opened the door before the taxi stopped and rushed up the steep slope leading to the park.,"['a1_past_simple_reg', 'a2_narrative_tenses', 'a2_ing_non_finite_forms']"
"In July, Cruz refused to endorse Trump in a speech to the Republican convention, earning boos, then explained his speech by saying he was not a servile puppy .","['a1_past_simple_reg', 'a2_to_non_finite_forms', 'a1_to_be_past_was_were']"
"The idea was to - because everybody overlooks white - like pencil drawings, you know?",['a1_there_was_were']
"Perhaps the most significant Clinton proposals are in the regulation of financial markets, a major source of the economic crisis of 2007 to 2009.","['a1_superlative_long', 'a1_to_be_present_is_am_are']"
"People are always asking, Well, who's in charge of this?","['a1_special_questions', 'a1_to_be_present_is_am_are', 'a1_present_continuous_act_rn']"
I do hope we will change our view on what trans looks like.,"['a1_present_simple_reg_act', 'a1_future_simple', 'a1_present_simple_3d_pers']"
That's not because I'm a tree-hugging green person.,['a1_to_be_present_is_am_are']
"He said that he and his wife have at various points taken on more or less economic burden, including when he was in graduate school, or after the recent birth of their son.","['a1_past_simple_irreg', 'a2_say_reported_verb', 'a1_present_simple_reg_act', 'a1_to_be_past_was_were']"
"It costs 35 percent more than regular paint because Dutch Boy made a can that people talk about, because it's remarkable.","['a1_present_simple_reg_act', 'a1_past_simple_irreg', 'a1_to_be_present_is_am_are', 'a1_present_simple_3d_pers']"
"During execution of the warrants, investigators found documents and digital information stored on various devices and removable digital media.","['a1_past_simple_irreg', 'a1_past_simple_reg']"
If there's a bustle in your hedgerow don't be alarmed now.,"['a2_zero_conditional_if_m', 'a2_imperatives', 'a1_there_is_am_are']"
"I discovered that by laying on top with a pillow underneath and sticking my dick just barely in the hole, the vacuum would both suck and vibrate my dick.","['a1_past_simple_reg', 'a2_ing_non_finite_forms']"
"It just escalated from there, kept using it each time, telling myself I would throw it out soon.","['a1_past_simple_reg', 'a1_past_simple_irreg']"
"Devices that can be made in PolyMUMPs include: Acoustics(microphones), Sensors, Accelerometers, Micro-fluidics, and Display Technologies.","['a1_can', 'a2_passive_modal_verbs']"
He then proceeded to tell me that he decided to send it to my parents (YEP) because he was so angry.,"['a1_past_simple_reg', 'a2_to_non_finite_forms', 'a1_to_be_past_was_were']"
"Visual Studio uses projects to organize the code for an app, and solutions to organize your projects.","['a1_present_simple_3d_pers', 'a2_to_non_finite_forms']"
"A developer command prompt shortcut automatically sets the correct paths for the compiler and tools, and for any required headers and libraries.",['a1_present_simple_3d_pers']
"To create your app, first, you'll create a new project and solution.","['a2_to_non_finite_forms', 'a1_future_simple']"
"But that means he and his wife will die, won't they?","['a1_present_simple_3d_pers', 'a1_future_simple']"
"Cheer up, said Ron, Snape's always taking points off Fred and George.","['a2_say_reported_verb', 'a2_imperatives', 'a1_present_continuous_act_rn']"
He had just thought of something that made him feel as though the happy balloon inside him had got a puncture.,"['a2_past_perfect_basic', 'a2_zero_non_finite_forms', 'a2_narrative_tenses']"
"While I found Weather Channel's Bus Shelter prank amusing, others might be frustrated for getting wet in what they will later regard as a stupid prank.","['a1_past_simple_irreg', 'a2_passive_modal_verbs', 'a2_ing_non_finite_forms', 'a1_future_simple']"
"It was barely noticeable, but he could still feel mild tremors.","['a1_to_be_past_was_were', 'a2_could']"
"But once at a party with university friends, they were sharing what they did for fun.","['a2_past_continuous', 'a1_be_have_do_in_the_past', 'a1_past_simple_irreg']"
"Because the land on either side was privately owned, there was no looking for cave art.","['a2_passive_present_simple', 'a1_there_was_were']"
"In April, he distracted fans and reporters from the news of a recall of 2, 700 Model X SUVs with a joking tweet comparing autopilot to the video game Mario Kart.",['a1_past_simple_reg']
"And actually, we have current data that does show that there is an actual drift towards complexity over time.","['a1_present_simple_reg_act', 'a1_there_is_am_are']"
Without wearing a single outfit that could be considered truly Obama has rewritten the playbook.,"['a2_could', 'a2_present_perfect']"
"It was a very long time ago that we decided that flying would be fun, and it took us until 1903 to actually work out how to do it.","['a1_past_simple_reg', 'a1_past_simple_irreg', 'a2_to_non_finite_forms']"
And I found myself the Friday after September 11th - two days afterwards - literally unable to motivate anyone to do anything.,"['a1_past_simple_irreg', 'a2_to_non_finite_forms']"
Mandela served 27 years in South African prisons for leading an liberation struggle that deployed selective violence as a political tool,"['a1_past_simple_reg', 'a2_ing_non_finite_forms']"
It's also very cold out there - less than three degrees above absolute zero.,['a1_to_be_present_is_am_are']
"Would you believe that just yesterday we had 11 new cases in Florida, said Democratic senator Bill Nelson.","['a2_say_reported_verb', 'a1_past_simple_irreg']"
"This little beast, right now, is producing a few hundred watts of electricity.",['a1_present_continuous_act_rn']
I thanked her for being there and began to talk about how Keith was doing.,"['a1_past_simple_reg', 'a1_present_continuous_act_rn', 'a1_past_simple_irreg', 'a2_to_non_finite_forms', 'a2_past_continuous', 'a2_narrative_tenses', 'a2_past_reported_speech']"
What I do know is that I'm never playing that damned game ever.,"['a1_present_simple_reg_act', 'a1_present_continuous_act_rn']"
"But I guess I can see how someone could just see the picture, read I'd posted it and call it attention-whoring.","['a1_can', 'a1_present_simple_reg_act', 'a2_could', 'a2_past_perfect_basic']"
Could this have exposed the plankton when one of the pieces was being sent up?,['a2_could']
Note that we no longer have to interact with the HTML directly.,"['a2_imperatives', 'a2_have_to']"
"Visual C++ has complex requirements for the command-line environment to find the tools, headers, and libraries it uses.","['a1_present_simple_3d_pers', 'a2_to_non_finite_forms']"
"He's just the build for a Seeker, too, said Wood, now walking around Harry and staring at him.","['a1_to_be_present_is_am_are', 'a2_say_reported_verb']"
When I open my eyes I'll be at home in my cupboard.,"['a1_future_simple', 'a1_present_simple_reg_act']"
"Comets look flashy, but they're not in the same league as the Nimbus.","['a1_present_simple_reg_act', 'a1_to_be_present_is_am_are']"
"A lot of green smoke came billowing out, and as it cleared, Harry gasped.","['a2_much_many_a_lot', 'a1_past_simple_irreg', 'a1_past_simple_reg']"
"People pushed their way toward the door and out on to a tiny, dark platform.",['a1_past_simple_reg']
"He stood up and started walking towards them, but the whole floor seemed to lengthen so that the distance between them stayed the same.","['a1_past_simple_irreg', 'a1_past_simple_reg', 'a2_ing_non_finite_forms', 'a2_narrative_tenses']"
"When my siblings and I were younger, one of our favorite books was Little Pear by Eleanor Frances Lattimore.",['a1_to_be_past_was_were']
"I was a little suckered in by the photos too, so I agreed.","['a1_to_be_past_was_were', 'a1_past_simple_reg']"
I stretch for the second shade in the far corner but can't quite grab the dingy ring.,"['a1_can', 'a1_present_simple_reg_act']"
"Of course, we had to try them and they became an instant favorite","['a2_had_to', 'a1_past_simple_irreg']"
Rove - the man who challenged the Fox News election desk as it called the 2012 election for Obama - was incredulous.,"['a1_past_simple_reg', 'a1_to_be_past_was_were']"
"And the other really interesting thing is that when skeletal muscle - there's been several reports that when skeletal muscle is injured, that's what correlates with metastases going to skeletal muscle.","['a1_to_be_present_is_am_are', 'a1_present_simple_3d_pers', 'a2_is_am_are_going_to', 'a2_passive_present_simple']"
"Survey respondents were asked how much time they spent during the last month being nervous, calm and peaceful, downhearted and blue, happy, and so down in the dumps that nothing can cheer you up .","['a2_passive_past_simple', 'a1_past_simple_irreg', 'a2_ing_non_finite_forms', 'a1_can']"
"And, anyway, despite the fact that they were far superior in adherence, and the quality of their tomato paste, Prego was struggling.",['a1_to_be_past_was_were']
"Binding acquisition offers are due in the next two weeks, and Twitter has already whittled down the field of potential acquirers, the people familiar with the matter said this week.","['a2_present_perfect', 'a1_past_simple_irreg', 'a2_say_reported_verb']"
"We want to have a community where you can upload ideas, and those ideas can be tested in an earthquake, in flood, in all sorts of austere environments.","['a1_present_simple_reg_act', 'a2_to_non_finite_forms', 'a1_can', 'a2_passive_modal_verbs']"
"I know one guy who's spent $4,000 just on Photoshop over the years.","['a1_present_simple_reg_act', 'a2_present_perfect']"
"You don't go to Buckingham Palace in a sweater, sniffed the designer Oscar de la Renta - but he was already out of touch.","['a1_present_simple_reg_act', 'a1_to_be_past_was_were']"
That development should not come at the expense of the majority of the population is still considered a radical idea here in the U.S.,"['a2_should', 'a2_passive_present_simple']"
"The whole class did it at the same time, kick this way, spinning kick that way, punch here, punch there etc etc.","['a1_be_have_do_in_the_past', 'a1_past_simple_irreg']"
"I don't remember what they put in it, but I do know that someone ran to a grocery store for another ingrediemt.","['a1_present_simple_reg_act', 'a1_past_simple_irreg']"
I go to London and on first day I went to big ben.,"['a1_past_simple_irreg', 'a1_present_simple_reg_act']"
"The Karate teacher happened to be standing right in front of me as I prepared for a punch, so I kinda shuffled to the side and punched the air next to him.","['a1_past_simple_reg', 'a2_to_non_finite_forms']"
A long time ago I wanted to do a story that involved some really big magnets that I had gotten hold of and told the producer about it.,"['a1_past_simple_reg', 'a2_to_non_finite_forms', 'a2_narrative_tenses', 'a2_past_perfect_basic', 'a1_past_simple_irreg']"
"For example, Vue components implement the Slot API and the is special attribute.","['a1_present_simple_reg_act', 'a1_to_be_present_is_am_are']"
He couldn't remember being in the car when his parents had died.,"['a2_could', 'a2_ing_non_finite_forms', 'a2_past_perfect_basic', 'a2_narrative_tenses']"
"They were looking straight into the eyes of a monstrous dog, a dog that filled the whole space between ceiling and floor.","['a2_past_continuous', 'a1_past_simple_reg']"
Wood was now looking as though all his dreams had come true at once.,"['a2_past_continuous', 'a2_past_perfect_basic']"
You don't want to go making friends with the wrong sort.,"['a1_present_simple_reg_act', 'a2_ing_non_finite_forms', 'a2_to_non_finite_forms']"
Yet something had been nagging at the back of his mind all day.,['a2_past_perfect_basic']
"Towards the end of 2018, I shared the results of a more detailed experiment, covering around three months of sleep and related data and attempting to find correlations.","['a1_past_simple_reg', 'a2_to_non_finite_forms']"
Tight schedules with no flexibility can be overwhelming and feeling like you didn't accomplish a certain goal can be taxing to your mental health.,"['a1_can', 'a2_passive_modal_verbs', 'a1_past_simple_reg']"
"Because priority and strategy are often unclear, the best path to this necessary relevance is how busy/urgent/in need you are.",['a1_to_be_present_is_am_are']
"The Oura ring provides a lot of additional variables that I didn't look into here, and the analysis itself was also fairly simplistic.","['a1_present_simple_3d_pers', 'a1_past_simple_reg', 'a1_to_be_past_was_were']"
The Guardian asked three economists to weigh in on what we can expect from a Trump or Clinton White House.,"['a1_past_simple_reg', 'a2_to_non_finite_forms', 'a1_can']"
"He lives in this log cabin - no running water, no heat other than - no windows and high-speed Internet connection.",['a1_present_simple_3d_pers']
"So you would have expected Clinton to do better, regardless of how she performed during the debate.","['a2_to_non_finite_forms', 'a1_past_simple_reg']"
And like the playwright said the other day - I could relate to him: you're not sure.,"['a2_say_reported_verb', 'a1_past_simple_irreg', 'a2_could', 'a1_to_be_present_is_am_are']"
The study acknowledges that the anxiety that individuals have in marriages based on their economic dependence or independence might be affected by their prior views about traditional gender roles.,"['a1_present_simple_3d_pers', 'a1_present_simple_reg_act', 'a2_passive_modal_verbs']"
"We are very ignorant about what the time scale for these things are, but they all are consistent with everything we know about physical laws, laws of chemistry, etc.","['a1_to_be_present_is_am_are', 'a1_present_simple_reg_act']"
"To put the assumptions very clearly: capitalism, after 150 years, has become acceptable, and so has democracy.",['a2_present_perfect']
"Double-crossed and scorn, he's going to direct all his attention on bringing the cartel down once and for all.",['a2_is_am_are_going_to']
"I want every Arup engineer in the world to check and make sure that we're doing stuff that's standing, because those guys are the best in the world.","['a1_present_simple_reg_act', 'a2_to_non_finite_forms', 'a1_present_continuous_act_rn', 'a1_to_be_present_is_am_are']"
The front bumper received most of the damage and the hood and headlights had some scratches.,"['a1_past_simple_reg', 'a1_be_have_do_in_the_past']"
"Well they might have gotten caught eventually anyway, but imagine if they ever found out THIS is why they got busted.","['a1_past_simple_irreg', 'a2_present_perfect']"
"For perhaps the first documented time in history, this women went black and went back.",['a1_past_simple_irreg']
"I had been there 4 years, and was 22 at the time.","['a2_past_perfect_basic', 'a1_to_be_past_was_were']"
Rules are normally contained on a single line; rules with many alternatives may be formatted alternatively with each line after the first beginning with a vertical bar.,"['a2_passive_present_simple', 'a2_passive_modal_verbs']"
"At last, Hagrid managed to make himself heard over the babble.","['a1_past_simple_reg', 'a2_to_non_finite_forms']"
"There was a tabby cat standing on the corner of Privet Drive, but there wasn't a map in sight.","['a1_there_was_were', 'a2_ing_non_finite_forms']"
"They say he met vampires in the Black Forest, and there was a nasty bit o' trouble with a hag - never been the same since.","['a1_present_simple_reg_act', 'a1_past_simple_irreg', 'a1_there_was_were', 'a2_present_perfect']"
One book had a dark stain on it that looked horribly like blood.,"['a1_have_has_got', 'a1_past_simple_irreg', 'a1_past_simple_reg']"
That's where he was going when we saw him - he's after whatever it's guarding!,"['a2_past_continuous', 'a1_to_be_present_is_am_are', 'a1_past_simple_irreg', 'a1_present_continuous_act_rn']"
"Part of this is probably due to the fact that going out just wasn't a thing in 2020, and in previous years the occasional night out might have pushed the moving average to later times.","['a1_to_be_present_is_am_are', 'a1_to_be_past_was_were']"
And what you may not know (yet) is that he initially created this method to better structure his learning efforts while he was still in college in the late 1990s.,"['a1_past_simple_reg', 'a1_to_be_past_was_were']"
"After all, a secret to a happy adulthood is in a happy childhood.",['a1_to_be_present_is_am_are']
"When it was time for Boyce to go home, Anh walked him to the door and reached in for a hug.","['a1_to_be_past_was_were', 'a1_past_simple_reg']"
"Considered one of the oldest spoken languages in the world, perhaps even the oldest, the Basque language is gritty and passionate.","['a1_to_be_present_is_am_are', 'a1_superlative_short']"
Eramo and her attorneys suggested that the stress she was under could have contributed to a infection that led to a hospital stay.,"['a1_past_simple_reg', 'a1_to_be_past_was_were', 'a2_could', 'a1_past_simple_irreg']"
"So it puts 200,000 square feet of stuff that make a high school work in the surface of that Earth.","['a1_present_simple_reg_act', 'a2_zero_non_finite_forms']"
"That night I got outed by the police officer, I wouldn't have even dared go into the police station as myself.",['a1_past_simple_irreg']
"Basically, gerontology is a fine approach in the end, but it is not an approach whose time has come when we're talking about intervention.","['a1_to_be_present_is_am_are', 'a2_present_perfect', 'a1_present_continuous_act_rn']"
"Having tested PokÃ©vision, I've found it accurate on over 10 occasions for various PokÃ©mon.",['a2_present_perfect']
"We need to inspire them, because they need to lead us and help us survive in the future.","['a1_present_simple_reg_act', 'a2_to_non_finite_forms', 'a2_zero_non_finite_forms']"
"He could turn Georgia and Utah back into reliably Republican states again, instead of being states.","['a2_could', 'a2_ing_non_finite_forms']"
"We will go into the third dimension and there's been tremendous progress, just in the last few years, of getting three-dimensional, self-organizing molecular circuits to work.","['a1_future_simple', 'a2_present_perfect']"
There's a time for looking at breasts: It's when the shirt's coming off,"['a1_to_be_present_is_am_are', 'a1_present_continuous_act_rn']"
"Until then, I'm glad I could share this story with so many people.","['a1_to_be_present_is_am_are', 'a2_could']"
