source_text,level,link,name,metadata
"Janice is a careful shopper, especially when it comes to grocery shopping. By being careful, she can save money, and then she can find the best value for her dollar. Here are some of the things that she does before and during her shopping trip. First, she always brings a list with her to the grocery store. By sticking to a list, she can avoid buying a lot of things that she doesnt need. Janice also uses coupons and she looks for special deals in the newspaper when she shops. Before she goes shopping, she finds and cuts out coupons in the newspaper for things that are on sale. She also loads up her shopping cart with food items if they are on sale. Janice then stores them in her pantry or in her freezer for future use. She usually goes shopping early in the morning because the stores arent crowded at that time, and the food is usually fresher. Eight or nine oclock in the morning is a great time to go. The worst time to go shopping for food is in the afternoon on the weekend. The lines are longer and its more difficult to get around crowded grocery aisles. Most importantly, Janice makes sure that she doesnt go shopping on an empty stomach. Grocery shopping while hungry leads shoppers to make bad choices. Janice puts the money that she saves into the bank. Over time, shell have enough money to make a large purchase, like for a car or a house. She doesnt make a lot of money at her job, but she always keeps in mind this expression: Its not what you earn but what you save that matters.",B1,https://www.learnamericanenglishonline.com/Reading/Yellow_Level_Reading/10_Janice_is_a_careful_shopper.html,learnamericanenglishonline,"{'audio_link': 'https://w.soundcloud.com/player/?url=https%3A//api.soundcloud.com/tracks/162345940&color=ff5500&auto_play=false&hide_related=false&show_comments=true&show_user=true&show_reposts=false', 'title': '10. Janice is a careful shopper.'}"
"Janice plays the cello. Shes been studying and playing the instrument since she first started taking lessons at the age of eight. Over the years, she has worked hard at becoming a good cellist. She performs regularly in a community orchestra that meets once a week. They do a half dozen concerts every year.  Playing a cello helps Janice take her mind off of her job. She currently works as a customer service specialist for an electronics store. It can be stressful at times, and it doesnt pay very well. Shes hoping to find a job as a music teacher. Janices friend, David, also plays the cello. Sometimes they get together and play duets. Janice likes to play classical music, while David prefers more modern music. Hes interested in all kinds of stringed instruments. In addition to his cello, David owns a standing bass, a violin, a banjo, and a guitar. On the weekends, he plays a guitar in a four-piece rock band. Janice thinks everyone should learn how to play a musical instrument. Its a great way of relaxing, but it also improves a persons ability to concentrate and develop the sort of stamina needed to accomplish difficult tasks that are unrelated to music.",B1,https://www.learnamericanenglishonline.com/Reading/Yellow_Level_Reading/11_Janice_plays_the_cello.html,learnamericanenglishonline,"{'audio_link': 'https://w.soundcloud.com/player/?url=https%3A//api.soundcloud.com/tracks/138886250&color=ff5500&auto_play=false&hide_related=false&show_artwork=true', 'title': '11. Janice plays the cello.'}"
"Laura got a bike for her birthday. She turned six last weekend, so her parents bought her a two-wheeler with training wheels. Laura is very excited about moving on from a tricycle to something thats bigger. Today, Lauras Aunt Christine is babysitting Laura while her parents are at work. Shes been practicing riding her bike, and her aunt has been helping her. Laura needs a little help getting on the seat, but once shes on, shes ready to go. The training wheels keep her from falling over. Laura has learned how to stop the bike. Because it has coaster brakes, she makes the bike stop by reversing the direction of her pedaling. This took a little getting used to. The first time she got on the bike, she crashed because she didnt know how to stop. Now shes very good at stopping. When Laura crashed, she wasnt wearing a helmet. She should have worn a helmet to protect her head, but she didnt want to put one on. Her aunt should have been paying more attention, but she was talking on her cell phone at the time. Its important to keep your eyes on children when they first learn how to ride a bike. Lauras Aunt Christine is going to take Laura to the park today. The two of them will both ride their bikes. Laura is happy about going to the park, and she loves being with her aunt.",B1,https://www.learnamericanenglishonline.com/Reading/Yellow_Level_Reading/12_Laura_got_a_bike.html,learnamericanenglishonline,"{'audio_link': 'https://w.soundcloud.com/player/?url=https%3A//api.soundcloud.com/tracks/140384912&color=ff5500&auto_play=false&hide_related=false&show_artwork=true', 'title': '12. Laura got a bike for her birthday.'}"
"Miguel moved to the United States from Brazil three years ago. He lives with his mother and his sister in a small house that they rent in Minneapolis. His father, Alfredo, stayed behind in Brazil because he owns a small business. Hell rejoin the family sometime next year. Miguels family had to wait almost ten years to immigrate to the United States. They applied for a visa when Miguel was two years old. They didnt realize it would take so long to obtain permission to enter the United States. Theyre happy about their new lives, but they get homesick from time to time, and they miss Alfredo. Miguel is gradually adjusting to his new life in Minneapolis. He still struggles a little with his English, but his new American friends are helping him learn about the language and the culture. Hes in his second year in high school, which means hes a sophomore. He has two more years to go before he graduates. His grades are good and hes very active in sports. He plays American-style football in the fall and soccer in the spring. Miguel is by far the best soccer player on the high school team. The other kids he plays with are impressed by his skill and his energy. He really puts a lot of effort into this sport. Miguels teammates have nicknamed him ""Flash"" because hes so fast and his footwork is dazzling. Kids on other teams refer to him as ""the Brazillian."" It was hard for MIguel to leave Brazil, but Miguels mother and father decided that he and his sister would have greater opportunities for success by moving to the U.S. At first, Miguel was very sad; however, there are many exciting opportunities for him in this country. He hopes to attend the University of Minnesota, but hes not sure what hes going to study yet. Miguel feels good about his future here. He feels as though he can do anything he wants to do and be successful.",B1,https://www.learnamericanenglishonline.com/Reading/Yellow_Level_Reading/13_Miguel_moved_to_the_United_States.html,learnamericanenglishonline,"{'audio_link': 'https://w.soundcloud.com/player/?url=https%3A//api.soundcloud.com/tracks/155658858&color=ff5500&auto_play=false&hide_related=false&show_artwork=true&show_comments=true&show_user=true&show_reposts=false', 'title': '13. Miguel moved to the United States from Brazil.'}"
"""Lets order a pizza,"" said Alice. Theres nothing to eat in the refrigerator, so … ""Thats a great idea,"" said Tom. Tom called the local pizzeria. Its his favorite place for ordering pizza. ""Luigis Pizza,"" said the woman who answered the phone. ""Hi,"" said Tom. ""Id like to order a large pizza with pepperoni and mushrooms. ""Okay,"" said the woman. ""Is this for pickup or delivery?"" ""Im going to pick it up,"" said Tom. The woman put Tom on hold. When she returned she told him the cost of the pizza and the time it would be ready. ""Thatll be sixteen dollars and 45 cents. Itll be ready in about 20 minutes. Whats the name for the order?"" ""My name is Tom."" ""Okay, Tom. Thanks for calling."" ""Okay, thanks.""",B1,https://www.learnamericanenglishonline.com/Reading/Yellow_Level_Reading/14_Lets_order_a_pizza.html,learnamericanenglishonline,"{'audio_link': 'https://w.soundcloud.com/player/?url=https%3A//api.soundcloud.com/tracks/186082843&color=ff5500&auto_play=false&hide_related=false&show_comments=true&show_user=true&show_reposts=false', 'title': '14. Let’s order a pizza.'}"
"George is taking his employees out for lunch today. Hes the owner of a small technology company that makes accounting software. This has been a very good quarter, so hes taking everyone out for lunch to celebrate their recent success. His employees had many different suggestions for places to eat. Someone suggested Thai food. Another person said he wanted Indian food. Others thought a Chinese buffet would be a good idea. In the end, they all agreed that Italian food would satisfy the greatest number of people, so George reserved a table for six at a nice Italian bistro downtown. The people who work for George like him because hes a good boss. He listens to their ideas. Hes considerate of their personal needs. He even asks them where they want to go for lunch! Perhaps best of all, he pays his employees well and he gives them good benefits. George knows that its important to treat employeees well because it increases their loyalty to the company. Its also the right thing to do when youre the boss.",B1,https://www.learnamericanenglishonline.com/Reading/Yellow_Level_Reading/15_George_is_the_boss.html,learnamericanenglishonline,"{'audio_link': 'https://w.soundcloud.com/player/?url=https%3A//api.soundcloud.com/tracks/178010333&color=ff5500&auto_play=false&hide_related=false&show_comments=true&show_user=true&show_reposts=false', 'title': '15. George is taking his employees out for lunch.'}"
"Katie gets a two-week school vacation. Every year, her school lets out for two weeks at the end of December and into early January. Some schools call this a Christmas vacation; others call it a winter break. The timing for her break was good because it snowed last week. Katie and her sister, Cynthia, have been able to go outside every day to play in the snow. They go sledding and make snowmen. In addition to going outside, Katie likes to stay inside and play games with her friends. They play board games and video games. She also likes to read books. This weekend Katie is going to go to a slumber party at a friends house and remain there overnight with eight other girls. Slumber parties are common at this time of the year because kids dont have to wake up the next morning for school. They can stay up late, watch TV, and wake up late the next morning.",B1,https://www.learnamericanenglishonline.com/Reading/Yellow_Level_Reading/16_School_vacation.html,learnamericanenglishonline,"{'audio_link': 'https://w.soundcloud.com/player/?url=https%3A//api.soundcloud.com/tracks/184170209&color=ff5500&auto_play=false&hide_related=false&show_comments=true&show_user=true&show_reposts=false', 'title': '16. Katie gets a tw0-week school vacation.'}"
"Kevin wants to become a basketball player. Ever since he was a little boy, he has wanted to play basketball for a professional basketball team. He thinks he has the right stuff to go pro. Kevin practices every day. After school is over for the day, he goes to the gym for basketball practice. Hes regarded as the best player on his high school basketball team, the Cyclones. Everyone thinks hes a great player.  Kevins parents are very proud of him; however, they would like him to become something other than a basketball player. He gets good grades in school, so his mother and father would prefer that he become a doctor or a lawyer–not a basketball player. Next year Kevin will apply to college. Several colleges have contacted him to indicate that they are interested in having him play on their college teams. Kevin has some big decisions to make in the upcoming year.",B1,https://www.learnamericanenglishonline.com/Reading/Yellow_Level_Reading/17_Kevin_wants_to_become_a_basketball_player.html,learnamericanenglishonline,"{'audio_link': 'https://w.soundcloud.com/player/?url=https%3A//api.soundcloud.com/tracks/194008815&color=ff5500&auto_play=false&hide_related=false&show_comments=true&show_user=true&show_reposts=false', 'title': '17. Kevin wants to become a basketball player.'}"
"Miss Beano is a substitute teacher. Mr. Larson was out yesterday, so the American history class was taught by Miss Beano. Miss Beano has been working as a substitute for about a year. Shes eager to have her own classroom, but until there is an opening for a new teacher, she fills in for teachers who miss work due to illness or personal matters. The students she taught were not very cooperative. Immediately, when they found out that Miss Beano was their sub, students started to repeat, ""Miss Beano is a mean-o."" She could hear what the students were saying, but she chose to ignore them. Several students gave false names or exchanged names when Miss Beano took attendance. Steven became Patrick, and Patrick became Steven. Amy became Chris, and Chris became Amy. Oscar became Jose. All of the students thought the use of fake names was hilarious, but Miss Beano didnt know why everyone was laughing. When a paper airplane sailed across the room and hit Miss Beano in the back of the head, her face became flushed, first from embarrassment, but then quickly her embarrassment turned to anger. ""Who threw that paper airplane?"" she demanded. Of course, no one raised a hand. The students sat silently and looked away from Miss Beanos determined stare. ""I want the name of the student who threw that at me,"" she demanded loudly, again, but no one said anything. Some students began to hum. Because no one came forward to admit responsibility, Miss Beano told all of the students to close their books and sit in silence until the bell rang for them to leave for their next class. She told the students how unhappy she was with their behavior. She also said that she would write a detailed report so that the regular classroom teacher, Mr. Larson, would know what happened. This suddenly concerned the students. Most of them were scared of Mr. Larson. He is very experienced and effective when it comes to disciplining students. Being a substitute teacher is difficult. Many students have very little respect for a sub. They take advantage of the subs lack of personal knowledge about students. Some of the kids speak in a disrespectful manner. They would never behave that way with their regular classroom teacher, but for some reason, they think they can get away with it when theres a sub. When the day was over and all of the students had left the building, Miss Beano began to cry a little bit. She had never expected such bad treatment from students as she trained to become a teacher. She knew that substitute teachers had it rough, but she never knew to what extent the children would be so disrespectful and mean to an adult.",B1,https://www.learnamericanenglishonline.com/Reading/Yellow_Level_Reading/18_The_students_were_not_cooperative.html,learnamericanenglishonline,"{'audio_link': 'https://w.soundcloud.com/player/?url=https%3A//api.soundcloud.com/tracks/204541078&color=ff5500&auto_play=false&hide_related=false&show_comments=true&show_user=true&show_reposts=false', 'title': '18. The students were not very cooperative.'}"
"Tammy gets along with everyone at the company where she works. Shes been there for almost two years, and shes made quite a few friends among her coworkers. Tammy is a good listener and she supports the ideas of others. Shes a real people person. Shes fun to be around, and she does whatever she can to help the company be successful. What does she do? Natalie works in the area of Information technology. She helps to manage the network servers for the company. Its a very important job. She has to make sure that the servers are operating properly and are well maintained. If the servers go down, no one can access the information that is stored on them. She has to be very patient, and she has to work well with other people. It takes a well-organized team of people to get the job done. Almost all of the employees at this young company are under the age of 30, but theyre well-disciplined workers and they enjoy a challenging environment. It used to be unusual for a woman to work entirely with computers in the area of IT (information technology) at a large corporation, but not now. More women are getting into this field. Tammy isnt sure if shes going to stay in IT her entire career. She would like to start her own business someday, but shes not sure what that might be. The person that Tammy spends most of her time with is Natalie. They work well together, and they enjoy each others company. They often go out for lunch together, and sometimes they do things together on the weekend. Theyre both about the same age, and theyre both unmarried. Tammy feels fortunate to have found a job where she is able to work with people that she likes.",B1,https://www.learnamericanenglishonline.com/Reading/Yellow_Level_Reading/19_Tammy_gets_along_with_everyone.html,learnamericanenglishonline,"{'audio_link': 'https://w.soundcloud.com/player/?url=https%3A//api.soundcloud.com/tracks/212638243&color=ff5500&auto_play=false&hide_related=false&show_comments=true&show_user=true&show_reposts=false', 'title': '19. Tammy gets along with everyone.'}"
"Oscar and Angela are dating. Theyve been seeing each other for about six months, and they say theyre happy when theyre together, but their friends say that the two of them arent really getting along. Heres how their relationship began: Oscar asked Angela if she would have lunch with him. She said that she couldnt because she had something going on at work that needed her attention. So Oscar thought she wasnt interested in him. Then, the next day she texted him and asked if he wanted to go see a movie. That was their first date. They had a great time! On their second date, they went out for dinner at a place that had Thai food. Angela likes spicy food but Oscar doesnt. He likes pizza and sandwiches. But they learned that they had some things in common. They both come from large families, they both enjoy traveling, and they both like to jog for exercise. So at first, everything was going very well., and they started to see each other almost every day. Now, Oscar is hinting that he wants things to get more serious, but Angela isnt sure. She likes him, but sometimes she wonders if hes the right person for her. Occassionally, Oscar says things that Angela doesnt like, and hes a little critical of her friends. He also gets jealous very easily. They had a big fight a few weeks ago. Oscar got mad at Angela because she didnt call him to find out what he was doing on a Saturday night. Instead, she went out with her friends and didnt tell him where she was going. Since then theres been a little tension between them. Well see what happens in the future.",B1,https://www.learnamericanenglishonline.com/Reading/Yellow_Level_Reading/20_Oscar_and_Angela_are_dating.html,learnamericanenglishonline,"{'audio_link': 'https://w.soundcloud.com/player/?url=https%3A//api.soundcloud.com/tracks/214110735&color=ff5500&auto_play=false&hide_related=false&show_comments=true&show_user=true&show_reposts=false', 'title': '20. Oscar and Angela are dating.'}"
"Living in the city in the United States can be interesting and fun. There you will find a diversity of people, culture, and activities. If you are planning to move to the United States, think carefully about which city to live in. There are many great places to choose from. After you have made a choice for a city, youll have to consider which area or neighborhood best suits your needs. Downtown is the center of the city. This is the heart of the business district, and sometimes its the first place immigrants think to visit or live when they arrive. A citys downtown has museums, live theatrical or musical performances, and lively shopping districts. Youll know you are downtown because thats usually where all the skyscrapers are. The downtown area, however, can be very expensive. In order to save money, neighborhoods outside of the downtown are good alternatives. Its also important for you to know that most big cities in the United States have ethnic neighborhoods that identify with a particular nationality or culture. There are Mexican neighborhoods, Indian neighborhoods, Somalian neighborhoods, Russian neighbohoods, and so on. Whatever a persons nationality might be, theres an American city with a neighborhood that matches it. New York City, Chicago, Philadelphia, and Washington D.C. all have large and diverse ethnic neighborhoods. Ethnic diversity is great because it means that there are many different kinds of food available. You can get middle-eastern food, Thai food, Chinese food, German food, or food from just about any country or region around the world. A person from Mexico who moves to a big city wont have any problem finding a Mexican grocery store or a Mexican restaurant. When people immigrate to the U.S., many of them find jobs in food-related business or they start their own business selling the cuisine of their native country. Almost all large cities host both amateur and professional sports teams. Whatever type of sport you like will be available somewhere. Soccer, known as ""football"" in most other countries, is growing in popularity, but the most popular sports to watch are baseball, football, basketball, and hockey. The one downside to living in a city is dealing with traffic congestion. Many cities dont have good public transportation systems, which means that people rely on their personal vehicles for getting around. This causes traffic jams and long waits when traveling to and within the city. The good news is that many cities are starting to deal with traffic problems by encouraging people to walk or ride a bike when traveling around the city. When thinking about a place to live, try to find something thats close to your job. Compared to cities in Europe, the Middle East, or Asia, American cities are not very old. If you want to go to a city rich in history, consider the east coast cities of New York, Boston, Philadelphia, or Washington D.C. If you are interested in more modern cities, travel to the west. Cities like Denver, Los Angeles, and Seatle are relatively new. Wherever you choose to go, it wont be boring. American cities are dynamic and interesting. Theyre places of great economic activity and opportunity. The people you see working and making money come from all over the world, and thats one of the things that makes living in the city a great experience.",B1,https://www.learnamericanenglishonline.com/Reading/Yellow_Level_Reading/21_Living_in_the_city.html,learnamericanenglishonline,"{'audio_link': 'https://w.soundcloud.com/player/?url=https%3A//api.soundcloud.com/tracks/218063533&color=ff5500&auto_play=false&hide_related=false&show_comments=true&show_user=true&show_reposts=false', 'title': '21. Living in the city can be interesting and fun.'}"
