891,"We did sweeping operations lasting 30 days, getting villagers out of their homes, moving them off the rice paddies, them.","['a1_past_simple_irreg', 'a1_be_have_do_in_the_past']",0,0,0,0,0,0,0,0,0,0,0,0,0,0,0,0,0,0,0,1,0,0,0,1,0,0,0,0,0,0,0,0,0,0,0,0,0,0,0,0,0,0,0,0,0,0,0,0,0,0,0,0,0,0,0,0,0,0,0,0,0,0,0,0,0,0,0,0,0,0
892,I knew I was trans from about three or four years old.,"['a1_past_simple_irreg', 'a1_to_be_past_was_were']",0,0,0,0,0,0,0,0,1,0,0,0,0,0,0,0,0,0,0,1,0,0,0,0,0,0,0,0,0,0,0,0,0,0,0,0,0,0,0,0,0,0,0,0,0,0,0,0,0,0,0,0,0,0,0,0,0,0,0,0,0,0,0,0,0,0,0,0,0,0
893,The real surprise of 2016 is how constant this contest has been.,"['a1_to_be_present_is_am_are', 'a2_present_perfect']",0,0,0,0,0,0,0,0,0,1,0,0,0,0,0,0,0,0,0,0,0,0,0,0,0,0,0,0,0,0,0,0,0,0,0,0,0,0,0,0,0,1,0,0,0,0,0,0,0,0,0,0,0,0,0,0,0,0,0,0,0,0,0,0,0,0,0,0,0,0
894,"But, it just kind of happened, bought new shoes and needed someplace to cum, used the box.","['a1_past_simple_irreg', 'a1_past_simple_reg']",0,0,0,0,0,0,0,0,0,0,0,0,0,0,0,0,0,0,1,1,0,0,0,0,0,0,0,0,0,0,0,0,0,0,0,0,0,0,0,0,0,0,0,0,0,0,0,0,0,0,0,0,0,0,0,0,0,0,0,0,0,0,0,0,0,0,0,0,0,0
895,"Nancy, if you were my wife, I'd drink it.","['a2_second_conditional_if_m', 'a1_to_be_past_was_were']",0,0,0,0,0,0,0,0,1,0,0,0,0,0,0,0,0,0,0,0,0,0,0,0,0,0,0,0,0,0,0,0,0,0,0,0,0,0,0,0,0,0,0,0,0,0,0,0,0,0,0,0,0,0,0,0,0,0,0,0,0,0,0,0,0,0,0,0,1,0
896,"Bought all 4 for $70, which reduced my food budget to $16 for the next two weeks.","['a2_relative_clause_who_which_that', 'a1_past_simple_reg']",0,0,0,0,0,0,0,0,0,0,0,0,0,0,0,0,0,0,1,0,0,0,0,0,0,0,0,0,0,0,0,0,0,0,0,0,0,0,0,0,0,0,0,0,0,0,0,0,1,0,0,0,0,0,0,0,0,0,0,0,0,0,0,0,0,0,0,0,0,0
897,"She had short, gray hair, and yellow eyes like a hawk.",['a1_be_have_do_in_the_past'],0,0,0,0,0,0,0,0,0,0,0,0,0,0,0,0,0,0,0,0,0,0,0,1,0,0,0,0,0,0,0,0,0,0,0,0,0,0,0,0,0,0,0,0,0,0,0,0,0,0,0,0,0,0,0,0,0,0,0,0,0,0,0,0,0,0,0,0,0,0
898,"And they've got this son - I saw him kicking his mother all the way up the street, screaming for sweets.","['a1_have_has_got', 'a1_past_simple_irreg']",0,0,0,0,0,0,0,0,0,0,0,0,0,0,0,0,0,0,0,1,0,0,1,0,0,0,0,0,0,0,0,0,0,0,0,0,0,0,0,0,0,0,0,0,0,0,0,0,0,0,0,0,0,0,0,0,0,0,0,0,0,0,0,0,0,0,0,0,0,0
899,"Madam Pomfrey, however, felt it might not be very hygienic, and confiscated it.","['a1_past_simple_irreg', 'a1_past_simple_reg']",0,0,0,0,0,0,0,0,0,0,0,0,0,0,0,0,0,0,1,1,0,0,0,0,0,0,0,0,0,0,0,0,0,0,0,0,0,0,0,0,0,0,0,0,0,0,0,0,0,0,0,0,0,0,0,0,0,0,0,0,0,0,0,0,0,0,0,0,0,0
900,Martha scrunched her nose and waggled a finger from the screen of my tablet - teasing me with feigned snootiness.,['a1_past_simple_reg'],0,0,0,0,0,0,0,0,0,0,0,0,0,0,0,0,0,0,1,0,0,0,0,0,0,0,0,0,0,0,0,0,0,0,0,0,0,0,0,0,0,0,0,0,0,0,0,0,0,0,0,0,0,0,0,0,0,0,0,0,0,0,0,0,0,0,0,0,0,0
901,The idea that a person could see and predict the future was nothing short of amazing to my young mind.,"['a2_could', 'a1_to_be_past_was_were']",0,0,0,0,0,0,0,0,1,0,0,0,0,0,0,0,0,0,0,0,0,0,0,0,0,1,0,0,0,0,0,0,0,0,0,0,0,0,0,0,0,0,0,0,0,0,0,0,0,0,0,0,0,0,0,0,0,0,0,0,0,0,0,0,0,0,0,0,0,0
902,"He grabbed his bag off the kitchen counter, threaded his hands through his jacket.",['a1_past_simple_reg'],0,0,0,0,0,0,0,0,0,0,0,0,0,0,0,0,0,0,1,0,0,0,0,0,0,0,0,0,0,0,0,0,0,0,0,0,0,0,0,0,0,0,0,0,0,0,0,0,0,0,0,0,0,0,0,0,0,0,0,0,0,0,0,0,0,0,0,0,0,0
903,Maybe someone can point out that I just didn't look at the right studies.,"['a1_can', 'a1_past_simple_reg']",0,0,0,0,0,0,0,0,0,0,0,0,0,0,1,0,0,0,1,0,0,0,0,0,0,0,0,0,0,0,0,0,0,0,0,0,0,0,0,0,0,0,0,0,0,0,0,0,0,0,0,0,0,0,0,0,0,0,0,0,0,0,0,0,0,0,0,0,0,0
904,"In fact, some years ago, Bill Joy wrote an article expressing tremendous concern about robots taking us over, etc.",['a1_past_simple_irreg'],0,0,0,0,0,0,0,0,0,0,0,0,0,0,0,0,0,0,0,1,0,0,0,0,0,0,0,0,0,0,0,0,0,0,0,0,0,0,0,0,0,0,0,0,0,0,0,0,0,0,0,0,0,0,0,0,0,0,0,0,0,0,0,0,0,0,0,0,0,0
905,Chris asked me to tell again how we found the structure of DNA.,"['a1_past_simple_reg', 'a1_past_simple_irreg']",0,0,0,0,0,0,0,0,0,0,0,0,0,0,0,0,0,0,1,1,0,0,0,0,0,0,0,0,0,0,0,0,0,0,0,0,0,0,0,0,0,0,0,0,0,0,0,0,0,0,0,0,0,0,0,0,0,0,0,0,0,0,0,0,0,0,0,0,0,0
906,"If I owned the Internet, Napster, Monster and Friendster.com would be one big website.",['a1_past_simple_reg'],0,0,0,0,0,0,0,0,0,0,0,0,0,0,0,0,0,0,1,0,0,0,0,0,0,0,0,0,0,0,0,0,0,0,0,0,0,0,0,0,0,0,0,0,0,0,0,0,0,0,0,0,0,0,0,0,0,0,0,0,0,0,0,0,0,0,0,0,0,0
907,"We leveraged that $10,000 seed grant more than 300 times, into a $3 million park.",['a1_past_simple_reg'],0,0,0,0,0,0,0,0,0,0,0,0,0,0,0,0,0,0,1,0,0,0,0,0,0,0,0,0,0,0,0,0,0,0,0,0,0,0,0,0,0,0,0,0,0,0,0,0,0,0,0,0,0,0,0,0,0,0,0,0,0,0,0,0,0,0,0,0,0,0
908,While saying that it was the worst Olympic conditions I have raced in she felt it was right to race on.,"['a1_to_be_past_was_were', 'a2_present_perfect', 'a1_past_simple_irreg']",0,0,0,0,0,0,0,0,1,0,0,0,0,0,0,0,0,0,0,1,0,0,0,0,0,0,0,0,0,0,0,0,0,0,0,0,0,0,0,0,0,1,0,0,0,0,0,0,0,0,0,0,0,0,0,0,0,0,0,0,0,0,0,0,0,0,0,0,0,0
909,"If the hardcore fans want Southgate to take charge permanently, this was not an occasion when it became evident.","['a1_present_simple_reg_act', 'a2_to_non_finite_forms', 'a1_to_be_past_was_were', 'a1_past_simple_irreg']",0,0,0,0,0,0,0,0,1,0,0,0,0,0,0,1,0,0,0,1,0,0,0,0,0,0,0,0,0,0,0,0,0,0,0,0,0,0,0,0,0,0,0,0,0,0,0,0,0,1,0,0,0,0,0,0,0,0,0,0,0,0,0,0,0,0,0,0,0,0
910,"James Solano, Buddy Ryan's agent, said he died in Kentucky but did not give a cause.","['a2_say_reported_verb', 'a1_past_simple_reg', 'a1_past_simple_irreg']",0,0,0,0,0,0,0,0,0,0,0,0,0,0,0,0,0,0,1,1,0,0,0,0,0,0,0,0,0,0,0,0,0,0,0,0,0,0,0,0,0,0,0,0,0,0,0,0,0,0,0,0,0,0,0,1,0,0,0,0,0,0,0,0,0,0,0,0,0,0
911,"Angsty teenage asshole son meets wonderful girl who turns him into a human being, making us fall in love with her.",['a1_present_simple_3d_pers'],0,0,0,0,0,0,0,0,0,0,0,0,0,0,0,0,1,0,0,0,0,0,0,0,0,0,0,0,0,0,0,0,0,0,0,0,0,0,0,0,0,0,0,0,0,0,0,0,0,0,0,0,0,0,0,0,0,0,0,0,0,0,0,0,0,0,0,0,0,0
912,"Like right there.from her car, it was up and to the left slightly.",['a1_to_be_past_was_were'],0,0,0,0,0,0,0,0,1,0,0,0,0,0,0,0,0,0,0,0,0,0,0,0,0,0,0,0,0,0,0,0,0,0,0,0,0,0,0,0,0,0,0,0,0,0,0,0,0,0,0,0,0,0,0,0,0,0,0,0,0,0,0,0,0,0,0,0,0,0
913,I forget to check this account most of the time and rarely see this stuff until weeks later.,['a1_present_simple_reg_act'],0,0,0,0,0,0,0,0,0,0,0,0,0,0,0,1,0,0,0,0,0,0,0,0,0,0,0,0,0,0,0,0,0,0,0,0,0,0,0,0,0,0,0,0,0,0,0,0,0,0,0,0,0,0,0,0,0,0,0,0,0,0,0,0,0,0,0,0,0,0
914,She's doing her business and starts barking up at someone's house.,"['a1_present_continuous_act_rn', 'a1_present_simple_3d_pers', 'a2_ing_non_finite_forms', 'a1_possesive_s_sing']",1,0,0,0,0,0,0,0,0,0,0,0,0,0,0,0,1,1,0,0,0,0,0,0,0,0,0,0,0,0,0,0,0,0,0,0,0,0,0,0,0,0,0,0,0,0,0,0,0,0,1,0,0,0,0,0,0,0,0,0,0,0,0,0,0,0,0,0,0,0
915,"He sat up and felt around, his eyes not used to the gloom.",['a1_past_simple_irreg'],0,0,0,0,0,0,0,0,0,0,0,0,0,0,0,0,0,0,0,1,0,0,0,0,0,0,0,0,0,0,0,0,0,0,0,0,0,0,0,0,0,0,0,0,0,0,0,0,0,0,0,0,0,0,0,0,0,0,0,0,0,0,0,0,0,0,0,0,0,0
916,"At the foot of the first set of stairs, they spotted Mrs. Norris skulking near the top.",['a1_past_simple_reg'],0,0,0,0,0,0,0,0,0,0,0,0,0,0,0,0,0,0,1,0,0,0,0,0,0,0,0,0,0,0,0,0,0,0,0,0,0,0,0,0,0,0,0,0,0,0,0,0,0,0,0,0,0,0,0,0,0,0,0,0,0,0,0,0,0,0,0,0,0,0
917,"He rolled over and fell asleep again, and when he woke next day, he didn't remember the dream at all.","['a1_past_simple_reg', 'a1_past_simple_irreg']",0,0,0,0,0,0,0,0,0,0,0,0,0,0,0,0,0,0,1,1,0,0,0,0,0,0,0,0,0,0,0,0,0,0,0,0,0,0,0,0,0,0,0,0,0,0,0,0,0,0,0,0,0,0,0,0,0,0,0,0,0,0,0,0,0,0,0,0,0,0
918,"You know, I think its weirdly, in a backwards way, a blessing, I countered.","['a1_past_simple_reg', 'a1_present_simple_reg_act']",0,0,0,0,0,0,0,0,0,0,0,0,0,0,0,1,0,0,1,0,0,0,0,0,0,0,0,0,0,0,0,0,0,0,0,0,0,0,0,0,0,0,0,0,0,0,0,0,0,0,0,0,0,0,0,0,0,0,0,0,0,0,0,0,0,0,0,0,0,0
919,We live with the rest of the world until we can't take it any longer.,"['a1_can', 'a1_present_simple_reg_act', 'a2_zero_non_finite_forms']",0,0,0,0,0,0,0,0,0,0,0,0,0,0,1,1,0,0,0,0,0,0,0,0,0,0,0,0,0,0,0,0,0,0,0,0,0,0,0,0,0,0,0,0,0,0,0,0,0,0,0,1,0,0,0,0,0,0,0,0,0,0,0,0,0,0,0,0,0,0
920,"You can get everyone's ticket, Mr. Moneybags, Buford offers, but Bob politely declines.","['a1_can', 'a1_possesive_s_sing', 'a1_present_simple_3d_pers']",1,0,0,0,0,0,0,0,0,0,0,0,0,0,1,0,1,0,0,0,0,0,0,0,0,0,0,0,0,0,0,0,0,0,0,0,0,0,0,0,0,0,0,0,0,0,0,0,0,0,0,0,0,0,0,0,0,0,0,0,0,0,0,0,0,0,0,0,0,0
921,He had always dreamed that someday somewhere his images might give someone pleasure.,['a2_past_perfect_basic'],0,0,0,0,0,0,0,0,0,0,0,0,0,0,0,0,0,0,0,0,0,0,0,0,0,0,0,0,0,0,0,0,0,0,0,0,0,0,0,0,0,0,1,0,0,0,0,0,0,0,0,0,0,0,0,0,0,0,0,0,0,0,0,0,0,0,0,0,0,0
922,"The point is, of course, if you want to know about malaria, you ask a malaria expert.","['a2_zero_conditional_if_m', 'a2_to_non_finite_forms', 'a1_present_simple_reg_act', 'a1_to_be_present_is_am_are']",0,0,0,0,0,0,0,0,0,1,0,0,0,0,0,1,0,0,0,0,0,0,0,0,0,0,0,0,0,0,0,0,0,0,0,0,0,0,0,0,0,0,0,0,0,0,0,0,0,1,0,0,0,0,0,0,0,0,0,0,0,0,0,0,1,0,0,0,0,0
923,"So that's the first cracking of the genetic code, and it was all over by 1966.","['a1_to_be_present_is_am_are', 'a1_to_be_past_was_were']",0,0,0,0,0,0,0,0,1,1,0,0,0,0,0,0,0,0,0,0,0,0,0,0,0,0,0,0,0,0,0,0,0,0,0,0,0,0,0,0,0,0,0,0,0,0,0,0,0,0,0,0,0,0,0,0,0,0,0,0,0,0,0,0,0,0,0,0,0,0
924,"Then, while jogging with my dog one morning, she pulled me into what I thought was just another illegal dump.","['a2_ing_non_finite_forms', 'a1_past_simple_reg', 'a1_past_simple_irreg']",0,0,0,0,0,0,0,0,0,0,0,0,0,0,0,0,0,0,1,1,0,0,0,0,0,0,0,0,0,0,0,0,0,0,0,0,0,0,0,0,0,0,0,0,0,0,0,0,0,0,1,0,0,0,0,0,0,0,0,0,0,0,0,0,0,0,0,0,0,0
925,"As you can see, I can use the same two-fingered gestures to go down and go in really seamlessly.","['a1_can', 'a2_to_non_finite_forms']",0,0,0,0,0,0,0,0,0,0,0,0,0,0,1,0,0,0,0,0,0,0,0,0,0,0,0,0,0,0,0,0,0,0,0,0,0,0,0,0,0,0,0,0,0,0,0,0,0,1,0,0,0,0,0,0,0,0,0,0,0,0,0,0,0,0,0,0,0,0
926,This article was amended on 19 September 2016 to clarify details relating to public funding of the Garden bridge.,"['a2_passive_past_simple', 'a2_to_non_finite_forms']",0,0,0,0,0,0,0,0,0,0,0,0,0,0,0,0,0,0,0,0,0,0,0,0,0,0,0,0,0,0,0,0,0,0,0,0,0,0,0,0,0,0,0,0,0,0,0,0,0,1,0,0,0,0,0,0,0,0,0,0,0,1,0,0,0,0,0,0,0,0
927,"A Planned Parenthood clinic in Columbia, Missouri, is licensed to offer abortions.","['a2_passive_present_simple', 'a2_to_non_finite_forms']",0,0,0,0,0,0,0,0,0,0,0,0,0,0,0,0,0,0,0,0,0,0,0,0,0,0,0,0,0,0,0,0,0,0,0,0,0,0,0,0,0,0,0,0,0,0,0,0,0,1,0,0,0,0,0,0,0,0,1,0,0,0,0,0,0,0,0,0,0,0
928,"But if you have smart friends, chances are they will send you to smart things.","['a2_first_conditional_if_m', 'a1_future_simple', 'a1_to_be_present_is_am_are', 'a1_present_simple_reg_act']",0,0,0,0,0,0,0,0,0,1,0,0,0,0,0,1,0,0,0,0,1,0,0,0,0,0,0,0,0,0,0,0,0,0,0,0,0,0,0,0,0,0,0,0,0,0,0,0,0,0,0,0,0,0,0,0,0,0,0,0,0,0,0,0,0,0,1,0,0,0
929,Apparently I haven't been at it long enough to stop caring.,"['a2_to_non_finite_forms', 'a2_present_perfect']",0,0,0,0,0,0,0,0,0,0,0,0,0,0,0,0,0,0,0,0,0,0,0,0,0,0,0,0,0,0,0,0,0,0,0,0,0,0,0,0,0,1,0,0,0,0,0,0,0,1,0,0,0,0,0,0,0,0,0,0,0,0,0,0,0,0,0,0,0,0
930,"It does, it happens all the time at empire state building.",['a1_present_simple_3d_pers'],0,0,0,0,0,0,0,0,0,0,0,0,0,0,0,0,1,0,0,0,0,0,0,0,0,0,0,0,0,0,0,0,0,0,0,0,0,0,0,0,0,0,0,0,0,0,0,0,0,0,0,0,0,0,0,0,0,0,0,0,0,0,0,0,0,0,0,0,0,0
931,After what I think were the first 15 days I realized this was not possible.,"['a1_present_simple_reg_act', 'a1_to_be_past_was_were', 'a1_past_simple_reg']",0,0,0,0,0,0,0,0,1,0,0,0,0,0,0,1,0,0,1,0,0,0,0,0,0,0,0,0,0,0,0,0,0,0,0,0,0,0,0,0,0,0,0,0,0,0,0,0,0,0,0,0,0,0,0,0,0,0,0,0,0,0,0,0,0,0,0,0,0,0
932,"They're not twins, but my dad and uncle look similar and have a very similar sounding voice.","['a1_to_be_present_is_am_are', 'a1_present_simple_reg_act']",0,0,0,0,0,0,0,0,0,1,0,0,0,0,0,1,0,0,0,0,0,0,0,0,0,0,0,0,0,0,0,0,0,0,0,0,0,0,0,0,0,0,0,0,0,0,0,0,0,0,0,0,0,0,0,0,0,0,0,0,0,0,0,0,0,0,0,0,0,0
933,"Ron moaned, as they pushed helplessly at the door, We're done for!","['a1_past_simple_reg', 'a2_present_perfect']",0,0,0,0,0,0,0,0,0,0,0,0,0,0,0,0,0,0,1,0,0,0,0,0,0,0,0,0,0,0,0,0,0,0,0,0,0,0,0,0,0,1,0,0,0,0,0,0,0,0,0,0,0,0,0,0,0,0,0,0,0,0,0,0,0,0,0,0,0,0
934,"I've got about five hundred, but I haven't got Agrippa or Ptolemy.",['a1_have_has_got'],0,0,0,0,0,0,0,0,0,0,0,0,0,0,0,0,0,0,0,0,0,0,1,0,0,0,0,0,0,0,0,0,0,0,0,0,0,0,0,0,0,0,0,0,0,0,0,0,0,0,0,0,0,0,0,0,0,0,0,0,0,0,0,0,0,0,0,0,0,0
935,You should see the burns Charlie's got off wild ones in Romania.,"['a2_should', 'a1_have_has_got']",0,0,0,0,0,0,0,0,0,0,0,0,0,0,0,0,0,0,0,0,0,0,1,0,0,0,0,0,0,0,0,0,0,1,0,0,0,0,0,0,0,0,0,0,0,0,0,0,0,0,0,0,0,0,0,0,0,0,0,0,0,0,0,0,0,0,0,0,0,0
936,"The todo-list of maintenance is a never-ending story and can be quite overwhelming, especially in the beginning.","['a1_to_be_present_is_am_are', 'a1_can']",0,0,0,0,0,0,0,0,0,1,0,0,0,0,1,0,0,0,0,0,0,0,0,0,0,0,0,0,0,0,0,0,0,0,0,0,0,0,0,0,0,0,0,0,0,0,0,0,0,0,0,0,0,0,0,0,0,0,0,0,0,0,0,0,0,0,0,0,0,0
937,"Whether it's a quick phone call, family dinner, or some other occasion, make room for those conversations.","['a1_to_be_present_is_am_are', 'a2_imperatives']",0,0,0,0,0,0,0,0,0,1,0,0,0,0,0,0,0,0,0,0,0,0,0,0,0,0,0,0,0,0,0,0,0,0,0,1,0,0,0,0,0,0,0,0,0,0,0,0,0,0,0,0,0,0,0,0,0,0,0,0,0,0,0,0,0,0,0,0,0,0
938,You don't need a fancy suit or an expensive dress to look nice.,"['a1_present_simple_reg_act', 'a2_to_non_finite_forms']",0,0,0,0,0,0,0,0,0,0,0,0,0,0,0,1,0,0,0,0,0,0,0,0,0,0,0,0,0,0,0,0,0,0,0,0,0,0,0,0,0,0,0,0,0,0,0,0,0,1,0,0,0,0,0,0,0,0,0,0,0,0,0,0,0,0,0,0,0,0
939,"Alison asked, leaning down to look through the passenger side window from her seat behind the wheel.",['a1_past_simple_reg'],0,0,0,0,0,0,0,0,0,0,0,0,0,0,0,0,0,0,1,0,0,0,0,0,0,0,0,0,0,0,0,0,0,0,0,0,0,0,0,0,0,0,0,0,0,0,0,0,0,0,0,0,0,0,0,0,0,0,0,0,0,0,0,0,0,0,0,0,0,0
940,"And I say, Great, let's make that language Yoruba.","['a2_say_reported_verb', 'a2_imperatives']",0,0,0,0,0,0,0,0,0,0,0,0,0,0,0,0,0,0,0,0,0,0,0,0,0,0,0,0,0,0,0,0,0,0,0,1,0,0,0,0,0,0,0,0,0,0,0,0,0,0,0,0,0,0,0,1,0,0,0,0,0,0,0,0,0,0,0,0,0,0
941,"So I presented those results at the International Science Fair, which was just one of the most amazing experiences of my life.","['a1_past_simple_reg', 'a1_to_be_past_was_were', 'a2_relative_clause_who_which_that']",0,0,0,0,0,0,0,0,1,0,0,0,0,0,0,0,0,0,1,0,0,0,0,0,0,0,0,0,0,0,0,0,0,0,0,0,0,0,0,0,0,0,0,0,0,0,0,0,1,0,0,0,0,0,0,0,0,0,0,0,0,0,0,0,0,0,0,0,0,0
942,"Four years later, Barack Obama didn't bury John McCain until the financial collapse that followed both conventions.",['a1_past_simple_reg'],0,0,0,0,0,0,0,0,0,0,0,0,0,0,0,0,0,0,1,0,0,0,0,0,0,0,0,0,0,0,0,0,0,0,0,0,0,0,0,0,0,0,0,0,0,0,0,0,0,0,0,0,0,0,0,0,0,0,0,0,0,0,0,0,0,0,0,0,0,0
943,Climate change is set to alter American forests as much as the arrival of white settlers did.,"['a2_passive_present_simple', 'a1_past_simple_irreg', 'a1_be_have_do_in_the_past']",0,0,0,0,0,0,0,0,0,0,0,0,0,0,0,0,0,0,0,1,0,0,0,1,0,0,0,0,0,0,0,0,0,0,0,0,0,0,0,0,0,0,0,0,0,0,0,0,0,0,0,0,0,0,0,0,0,0,1,0,0,0,0,0,0,0,0,0,0,0
944,"Suddenly, Parker's past troubles threaten to tarnish his passion project.","['a1_possesive_s_sing', 'a2_to_non_finite_forms', 'a1_present_simple_reg_act']",1,0,0,0,0,0,0,0,0,0,0,0,0,0,0,1,0,0,0,0,0,0,0,0,0,0,0,0,0,0,0,0,0,0,0,0,0,0,0,0,0,0,0,0,0,0,0,0,0,1,0,0,0,0,0,0,0,0,0,0,0,0,0,0,0,0,0,0,0,0
945,"Do you like the amount of parodies that are being produced, or do you wish people would stop?","['a2_passive_present_cont', 'a1_present_simple_reg_act']",0,0,0,0,0,0,0,0,0,0,0,0,0,0,0,1,0,0,0,0,0,0,0,0,0,0,0,0,0,0,0,0,0,0,0,0,0,0,0,0,0,0,0,0,0,0,0,0,0,0,0,0,0,0,0,0,0,0,0,1,0,0,0,0,0,0,0,0,0,0
946,Do I ruin this girl's marriage because I suddenly have a feeling?,"['a1_possesive_s_sing', 'a1_present_simple_reg_act']",1,0,0,0,0,0,0,0,0,0,0,0,0,0,0,1,0,0,0,0,0,0,0,0,0,0,0,0,0,0,0,0,0,0,0,0,0,0,0,0,0,0,0,0,0,0,0,0,0,0,0,0,0,0,0,0,0,0,0,0,0,0,0,0,0,0,0,0,0,0
947,Not to mention how grotesque it is to apply the word porn to some of these images.,"['a1_to_be_present_is_am_are', 'a2_to_non_finite_forms']",0,0,0,0,0,0,0,0,0,1,0,0,0,0,0,0,0,0,0,0,0,0,0,0,0,0,0,0,0,0,0,0,0,0,0,0,0,0,0,0,0,0,0,0,0,0,0,0,0,1,0,0,0,0,0,0,0,0,0,0,0,0,0,0,0,0,0,0,0,0
948,Our spacesuit design is finally coming together and will also be unveiled later this year.,"['a1_present_continuous_act_rn', 'a2_passive_will']",0,0,0,0,0,0,0,0,0,0,0,0,0,0,0,0,0,1,0,0,0,0,0,0,0,0,0,0,0,0,0,0,0,0,0,0,0,0,0,0,0,0,0,0,0,0,0,0,0,0,0,0,0,0,0,0,0,0,0,0,0,0,1,0,0,0,0,0,0,0
949,"On the other hand, he'd gotten into terrible trouble for being found on the roof of the school kitchens.","['a2_ing_non_finite_forms', 'a2_past_perfect_basic']",0,0,0,0,0,0,0,0,0,0,0,0,0,0,0,0,0,0,0,0,0,0,0,0,0,0,0,0,0,0,0,0,0,0,0,0,0,0,0,0,0,0,1,0,0,0,0,0,0,0,1,0,0,0,0,0,0,0,0,0,0,0,0,0,0,0,0,0,0,0
950,The smallest bottle will get us through the black fire - toward the Stone.,"['a1_future_simple', 'a1_superlative_short']",0,0,0,0,0,1,0,0,0,0,0,0,0,0,0,0,0,0,0,0,1,0,0,0,0,0,0,0,0,0,0,0,0,0,0,0,0,0,0,0,0,0,0,0,0,0,0,0,0,0,0,0,0,0,0,0,0,0,0,0,0,0,0,0,0,0,0,0,0,0
951,"Wheeling around, they sprinted back to the door and turned the key, fumbling in their panic.",['a1_past_simple_reg'],0,0,0,0,0,0,0,0,0,0,0,0,0,0,0,0,0,0,1,0,0,0,0,0,0,0,0,0,0,0,0,0,0,0,0,0,0,0,0,0,0,0,0,0,0,0,0,0,0,0,0,0,0,0,0,0,0,0,0,0,0,0,0,0,0,0,0,0,0,0
952,I suppose you added the porcupine quills before taking the cauldron off the fire?,"['a1_present_simple_reg_act', 'a1_past_simple_reg', 'a2_ing_non_finite_forms']",0,0,0,0,0,0,0,0,0,0,0,0,0,0,0,1,0,0,1,0,0,0,0,0,0,0,0,0,0,0,0,0,0,0,0,0,0,0,0,0,0,0,0,0,0,0,0,0,0,0,1,0,0,0,0,0,0,0,0,0,0,0,0,0,0,0,0,0,0,0
953,Picking up her pace she arrived at the chair with a laugh.,"['a2_ing_non_finite_forms', 'a1_past_simple_reg']",0,0,0,0,0,0,0,0,0,0,0,0,0,0,0,0,0,0,1,0,0,0,0,0,0,0,0,0,0,0,0,0,0,0,0,0,0,0,0,0,0,0,0,0,0,0,0,0,0,0,1,0,0,0,0,0,0,0,0,0,0,0,0,0,0,0,0,0,0,0
954,Time blocking is the practice of scheduling periods throughout your day to finish different tasks.,"['a1_to_be_present_is_am_are', 'a2_ing_non_finite_forms', 'a2_to_non_finite_forms']",0,0,0,0,0,0,0,0,0,1,0,0,0,0,0,0,0,0,0,0,0,0,0,0,0,0,0,0,0,0,0,0,0,0,0,0,0,0,0,0,0,0,0,0,0,0,0,0,0,1,1,0,0,0,0,0,0,0,0,0,0,0,0,0,0,0,0,0,0,0
955,"My grandmother, who would be considered archaic even in the 1800's, nearly had a heart attack seeing him this way.","['a1_be_have_do_in_the_past', 'a2_ing_non_finite_forms']",0,0,0,0,0,0,0,0,0,0,0,0,0,0,0,0,0,0,0,0,0,0,0,1,0,0,0,0,0,0,0,0,0,0,0,0,0,0,0,0,0,0,0,0,0,0,0,0,0,0,1,0,0,0,0,0,0,0,0,0,0,0,0,0,0,0,0,0,0,0
956,"One from Savas Coskun and the other from Sabeena Din, who moved, respectively, from Turkey and Pakistan to Denmark.",['a1_past_simple_reg'],0,0,0,0,0,0,0,0,0,0,0,0,0,0,0,0,0,0,1,0,0,0,0,0,0,0,0,0,0,0,0,0,0,0,0,0,0,0,0,0,0,0,0,0,0,0,0,0,0,0,0,0,0,0,0,0,0,0,0,0,0,0,0,0,0,0,0,0,0,0
957,"But other treatments such as acupuncture and massage, and even just relaxation, clearly have some kind of benefit.",['a1_present_simple_reg_act'],0,0,0,0,0,0,0,0,0,0,0,0,0,0,0,1,0,0,0,0,0,0,0,0,0,0,0,0,0,0,0,0,0,0,0,0,0,0,0,0,0,0,0,0,0,0,0,0,0,0,0,0,0,0,0,0,0,0,0,0,0,0,0,0,0,0,0,0,0,0
958,Von Braun was on there showing how to go to Mars - and this was before Sputnik.,['a1_to_be_past_was_were'],0,0,0,0,0,0,0,0,1,0,0,0,0,0,0,0,0,0,0,0,0,0,0,0,0,0,0,0,0,0,0,0,0,0,0,0,0,0,0,0,0,0,0,0,0,0,0,0,0,0,0,0,0,0,0,0,0,0,0,0,0,0,0,0,0,0,0,0,0,0
959,It's the one that takes me around the world right now interacting with foreign militaries quite a bit.,"['a1_to_be_present_is_am_are', 'a1_present_simple_3d_pers']",0,0,0,0,0,0,0,0,0,1,0,0,0,0,0,0,1,0,0,0,0,0,0,0,0,0,0,0,0,0,0,0,0,0,0,0,0,0,0,0,0,0,0,0,0,0,0,0,0,0,0,0,0,0,0,0,0,0,0,0,0,0,0,0,0,0,0,0,0,0
960,Some abortion restrictions have already been toppled by Monday's ruling - no legislation required.,"['a2_present_perfect', 'a1_possesive_s_sing', 'a2_passive_present_simple']",1,0,0,0,0,0,0,0,0,0,0,0,0,0,0,0,0,0,0,0,0,0,0,0,0,0,0,0,0,0,0,0,0,0,0,0,0,0,0,0,0,1,0,0,0,0,0,0,0,0,0,0,0,0,0,0,0,0,1,0,0,0,0,0,0,0,0,0,0,0
961,"London mayor Sadiq Khan halted some of the existing spending on the project, ahead of a review.",['a1_past_simple_reg'],0,0,0,0,0,0,0,0,0,0,0,0,0,0,0,0,0,0,1,0,0,0,0,0,0,0,0,0,0,0,0,0,0,0,0,0,0,0,0,0,0,0,0,0,0,0,0,0,0,0,0,0,0,0,0,0,0,0,0,0,0,0,0,0,0,0,0,0,0,0
962,She feels people have finally had enough of the current government's lack of transparency.,"['a1_present_simple_reg_act', 'a2_present_perfect']",0,0,0,0,0,0,0,0,0,0,0,0,0,0,0,1,0,0,0,0,0,0,0,0,0,0,0,0,0,0,0,0,0,0,0,0,0,0,0,0,0,1,0,0,0,0,0,0,0,0,0,0,0,0,0,0,0,0,0,0,0,0,0,0,0,0,0,0,0,0
963,"But by the time I came back to get their food orders, one had left and the other was crying.","['a1_past_simple_irreg', 'a2_to_non_finite_forms', 'a1_be_have_do_in_the_past', 'a2_past_continuous', 'a2_past_perfect_basic', 'a2_narrative_tenses']",0,0,0,0,0,0,0,0,0,0,0,0,0,0,0,0,0,0,0,1,0,0,0,1,0,0,0,0,0,0,0,0,0,0,0,0,0,0,0,1,1,0,1,0,0,0,0,0,0,1,0,0,0,0,0,0,0,0,0,0,0,0,0,0,0,0,0,0,0,0
964,"Hair loss, worse health, the shit just started piling up.","['a1_past_simple_reg', 'a2_ing_non_finite_forms']",0,0,0,0,0,0,0,0,0,0,0,0,0,0,0,0,0,0,1,0,0,0,0,0,0,0,0,0,0,0,0,0,0,0,0,0,0,0,0,0,0,0,0,0,0,0,0,0,0,0,1,0,0,0,0,0,0,0,0,0,0,0,0,0,0,0,0,0,0,0
965,"She took a long drink from the round bottle at the end, and shuddered.","['a1_past_simple_irreg', 'a1_past_simple_reg']",0,0,0,0,0,0,0,0,0,0,0,0,0,0,0,0,0,0,1,1,0,0,0,0,0,0,0,0,0,0,0,0,0,0,0,0,0,0,0,0,0,0,0,0,0,0,0,0,0,0,0,0,0,0,0,0,0,0,0,0,0,0,0,0,0,0,0,0,0,0
966,"Now, there's another player on each side who's called the Keeper - I'm Keeper for Gryffindor.","['a1_there_is_am_are', 'a2_passive_present_simple', 'a1_to_be_present_is_am_are']",0,0,0,0,0,0,0,0,0,1,0,0,1,0,0,0,0,0,0,0,0,0,0,0,0,0,0,0,0,0,0,0,0,0,0,0,0,0,0,0,0,0,0,0,0,0,0,0,0,0,0,0,0,0,0,0,0,0,1,0,0,0,0,0,0,0,0,0,0,0
967,"Caput Draconis, said Percy, and the portrait swung forward to reveal a round hole in the wall.","['a2_say_reported_verb', 'a1_past_simple_irreg', 'a2_to_non_finite_forms']",0,0,0,0,0,0,0,0,0,0,0,0,0,0,0,0,0,0,0,1,0,0,0,0,0,0,0,0,0,0,0,0,0,0,0,0,0,0,0,0,0,0,0,0,0,0,0,0,0,1,0,0,0,0,0,1,0,0,0,0,0,0,0,0,0,0,0,0,0,0
968,"As he looked at Dudley in his new knickerbockers, Uncle Vernon said gruffly that it was the proudest moment of his life.","['a1_past_simple_reg', 'a2_say_reported_verb', 'a1_past_simple_irreg', 'a1_to_be_past_was_were']",0,0,0,0,0,0,0,0,1,0,0,0,0,0,0,0,0,0,1,1,0,0,0,0,0,0,0,0,0,0,0,0,0,0,0,0,0,0,0,0,0,0,0,0,0,0,0,0,0,0,0,0,0,0,0,1,0,0,0,0,0,0,0,0,0,0,0,0,0,0
969,"Maybe set Twitter check-ins for the morning, mid-day and evening.",['a2_imperatives'],0,0,0,0,0,0,0,0,0,0,0,0,0,0,0,0,0,0,0,0,0,0,0,0,0,0,0,0,0,0,0,0,0,0,0,1,0,0,0,0,0,0,0,0,0,0,0,0,0,0,0,0,0,0,0,0,0,0,0,0,0,0,0,0,0,0,0,0,0,0
970,Because good adventures are not the only ones that amount to something.,['a1_to_be_present_is_am_are'],0,0,0,0,0,0,0,0,0,1,0,0,0,0,0,0,0,0,0,0,0,0,0,0,0,0,0,0,0,0,0,0,0,0,0,0,0,0,0,0,0,0,0,0,0,0,0,0,0,0,0,0,0,0,0,0,0,0,0,0,0,0,0,0,0,0,0,0,0,0
971,Meditation is a practice at doing this and Buddhism is itself far more of a training regimen than a conventional religion.,"['a1_to_be_present_is_am_are', 'a2_ing_non_finite_forms']",0,0,0,0,0,0,0,0,0,1,0,0,0,0,0,0,0,0,0,0,0,0,0,0,0,0,0,0,0,0,0,0,0,0,0,0,0,0,0,0,0,0,0,0,0,0,0,0,0,0,1,0,0,0,0,0,0,0,0,0,0,0,0,0,0,0,0,0,0,0
972,"So, you know, even sex is on a stopwatch these days.","['a1_present_simple_reg_act', 'a1_to_be_present_is_am_are']",0,0,0,0,0,0,0,0,0,1,0,0,0,0,0,1,0,0,0,0,0,0,0,0,0,0,0,0,0,0,0,0,0,0,0,0,0,0,0,0,0,0,0,0,0,0,0,0,0,0,0,0,0,0,0,0,0,0,0,0,0,0,0,0,0,0,0,0,0,0
973,"And this particular manufacturer said, We're not interested in that.","['a2_say_reported_verb', 'a1_to_be_present_is_am_are', 'a2_adjectives_ed']",0,0,0,0,0,0,0,0,0,1,0,0,0,0,0,0,0,0,0,0,0,0,0,0,0,0,0,0,0,0,0,0,0,0,0,0,0,0,0,0,0,0,0,0,0,0,1,0,0,0,0,0,0,0,0,1,0,0,0,0,0,0,0,0,0,0,0,0,0,0
974,They eat better; they make love better; they exercise better; they work better; they live better.,"['a1_present_simple_reg_act', 'a1_comparative_exept']",0,0,0,0,1,0,0,0,0,0,0,0,0,0,0,1,0,0,0,0,0,0,0,0,0,0,0,0,0,0,0,0,0,0,0,0,0,0,0,0,0,0,0,0,0,0,0,0,0,0,0,0,0,0,0,0,0,0,0,0,0,0,0,0,0,0,0,0,0,0
975,"That's essentially a gender; that's essentially the resource of the planet, which is women.","['a1_to_be_present_is_am_are', 'a2_relative_clause_who_which_that']",0,0,0,0,0,0,0,0,0,1,0,0,0,0,0,0,0,0,0,0,0,0,0,0,0,0,0,0,0,0,0,0,0,0,0,0,0,0,0,0,0,0,0,0,0,0,0,0,1,0,0,0,0,0,0,0,0,0,0,0,0,0,0,0,0,0,0,0,0,0
976,"He has squandered his pick and his convention, and several battleground states along with them.",['a2_present_perfect'],0,0,0,0,0,0,0,0,0,0,0,0,0,0,0,0,0,0,0,0,0,0,0,0,0,0,0,0,0,0,0,0,0,0,0,0,0,0,0,0,0,1,0,0,0,0,0,0,0,0,0,0,0,0,0,0,0,0,0,0,0,0,0,0,0,0,0,0,0,0
977,It's assumed it is related to multiple concussions that happened years before.,"['a2_passive_present_simple', 'a1_past_simple_reg']",0,0,0,0,0,0,0,0,0,0,0,0,0,0,0,0,0,0,1,0,0,0,0,0,0,0,0,0,0,0,0,0,0,0,0,0,0,0,0,0,0,0,0,0,0,0,0,0,0,0,0,0,0,0,0,0,0,0,1,0,0,0,0,0,0,0,0,0,0,0
978,"The Eagles' defense scored three touchdowns in a win and knocked nine Redskins out of the game, including two quarterbacks.","['a1_possessive_s_plurar', 'a1_past_simple_reg']",0,1,0,0,0,0,0,0,0,0,0,0,0,0,0,0,0,0,1,0,0,0,0,0,0,0,0,0,0,0,0,0,0,0,0,0,0,0,0,0,0,0,0,0,0,0,0,0,0,0,0,0,0,0,0,0,0,0,0,0,0,0,0,0,0,0,0,0,0,0
979,You listen as your schoolmates grow ever more frustrated about the other student.,"['a1_present_simple_reg_act', 'a2_zero_non_finite_forms', 'a2_adjectives_ed', 'a1_comparative_long']",0,0,0,1,0,0,0,0,0,0,0,0,0,0,0,1,0,0,0,0,0,0,0,0,0,0,0,0,0,0,0,0,0,0,0,0,0,0,0,0,0,0,0,0,0,0,1,0,0,0,0,1,0,0,0,0,0,0,0,0,0,0,0,0,0,0,0,0,0,0
980,"Context, the guy that got knocked out was drunk as fuck and starting fights with people.","['a1_past_simple_irreg', 'a1_to_be_past_was_were', 'a2_past_continuous']",0,0,0,0,0,0,0,0,1,0,0,0,0,0,0,0,0,0,0,1,0,0,0,0,0,0,0,0,0,0,0,0,0,0,0,0,0,0,0,1,0,0,0,0,0,0,0,0,0,0,0,0,0,0,0,0,0,0,0,0,0,0,0,0,0,0,0,0,0,0
