283,If there's a bustle in your hedgerow don't be alarmed now.,"['a2_zero_conditional_if_m', 'a2_imperatives', 'a1_there_is_am_are']",0,0,0,0,0,0,0,0,0,0,0,0,1,0,0,0,0,0,0,0,0,0,0,0,0,0,0,0,0,0,0,0,0,0,0,1,0,0,0,0,0,0,0,0,0,0,0,0,0,0,0,0,0,0,0,0,0,0,0,0,0,0,0,0,1,0,0,0,0,0
284,"I discovered that by laying on top with a pillow underneath and sticking my dick just barely in the hole, the vacuum would both suck and vibrate my dick.","['a1_past_simple_reg', 'a2_ing_non_finite_forms']",0,0,0,0,0,0,0,0,0,0,0,0,0,0,0,0,0,0,1,0,0,0,0,0,0,0,0,0,0,0,0,0,0,0,0,0,0,0,0,0,0,0,0,0,0,0,0,0,0,0,1,0,0,0,0,0,0,0,0,0,0,0,0,0,0,0,0,0,0,0
285,"It just escalated from there, kept using it each time, telling myself I would throw it out soon.","['a1_past_simple_reg', 'a1_past_simple_irreg']",0,0,0,0,0,0,0,0,0,0,0,0,0,0,0,0,0,0,1,1,0,0,0,0,0,0,0,0,0,0,0,0,0,0,0,0,0,0,0,0,0,0,0,0,0,0,0,0,0,0,0,0,0,0,0,0,0,0,0,0,0,0,0,0,0,0,0,0,0,0
286,"Devices that can be made in PolyMUMPs include: Acoustics(microphones), Sensors, Accelerometers, Micro-fluidics, and Display Technologies.","['a1_can', 'a2_passive_modal_verbs']",0,0,0,0,0,0,0,0,0,0,0,0,0,0,1,0,0,0,0,0,0,0,0,0,0,0,0,0,0,0,0,0,0,0,0,0,0,0,0,0,0,0,0,0,0,0,0,0,0,0,0,0,0,0,0,0,0,0,0,0,0,0,0,1,0,0,0,0,0,0
287,He then proceeded to tell me that he decided to send it to my parents (YEP) because he was so angry.,"['a1_past_simple_reg', 'a2_to_non_finite_forms', 'a1_to_be_past_was_were']",0,0,0,0,0,0,0,0,1,0,0,0,0,0,0,0,0,0,1,0,0,0,0,0,0,0,0,0,0,0,0,0,0,0,0,0,0,0,0,0,0,0,0,0,0,0,0,0,0,1,0,0,0,0,0,0,0,0,0,0,0,0,0,0,0,0,0,0,0,0
288,"Visual Studio uses projects to organize the code for an app, and solutions to organize your projects.","['a1_present_simple_3d_pers', 'a2_to_non_finite_forms']",0,0,0,0,0,0,0,0,0,0,0,0,0,0,0,0,1,0,0,0,0,0,0,0,0,0,0,0,0,0,0,0,0,0,0,0,0,0,0,0,0,0,0,0,0,0,0,0,0,1,0,0,0,0,0,0,0,0,0,0,0,0,0,0,0,0,0,0,0,0
289,"A developer command prompt shortcut automatically sets the correct paths for the compiler and tools, and for any required headers and libraries.",['a1_present_simple_3d_pers'],0,0,0,0,0,0,0,0,0,0,0,0,0,0,0,0,1,0,0,0,0,0,0,0,0,0,0,0,0,0,0,0,0,0,0,0,0,0,0,0,0,0,0,0,0,0,0,0,0,0,0,0,0,0,0,0,0,0,0,0,0,0,0,0,0,0,0,0,0,0
290,"To create your app, first, you'll create a new project and solution.","['a2_to_non_finite_forms', 'a1_future_simple']",0,0,0,0,0,0,0,0,0,0,0,0,0,0,0,0,0,0,0,0,1,0,0,0,0,0,0,0,0,0,0,0,0,0,0,0,0,0,0,0,0,0,0,0,0,0,0,0,0,1,0,0,0,0,0,0,0,0,0,0,0,0,0,0,0,0,0,0,0,0
291,"But that means he and his wife will die, won't they?","['a1_present_simple_3d_pers', 'a1_future_simple']",0,0,0,0,0,0,0,0,0,0,0,0,0,0,0,0,1,0,0,0,1,0,0,0,0,0,0,0,0,0,0,0,0,0,0,0,0,0,0,0,0,0,0,0,0,0,0,0,0,0,0,0,0,0,0,0,0,0,0,0,0,0,0,0,0,0,0,0,0,0
292,"Cheer up, said Ron, Snape's always taking points off Fred and George.","['a2_say_reported_verb', 'a2_imperatives', 'a1_present_continuous_act_rn']",0,0,0,0,0,0,0,0,0,0,0,0,0,0,0,0,0,1,0,0,0,0,0,0,0,0,0,0,0,0,0,0,0,0,0,1,0,0,0,0,0,0,0,0,0,0,0,0,0,0,0,0,0,0,0,1,0,0,0,0,0,0,0,0,0,0,0,0,0,0
293,He had just thought of something that made him feel as though the happy balloon inside him had got a puncture.,"['a2_past_perfect_basic', 'a2_zero_non_finite_forms', 'a2_narrative_tenses']",0,0,0,0,0,0,0,0,0,0,0,0,0,0,0,0,0,0,0,0,0,0,0,0,0,0,0,0,0,0,0,0,0,0,0,0,0,0,0,0,1,0,1,0,0,0,0,0,0,0,0,1,0,0,0,0,0,0,0,0,0,0,0,0,0,0,0,0,0,0
294,"While I found Weather Channel's Bus Shelter prank amusing, others might be frustrated for getting wet in what they will later regard as a stupid prank.","['a1_past_simple_irreg', 'a2_passive_modal_verbs', 'a2_ing_non_finite_forms', 'a1_future_simple']",0,0,0,0,0,0,0,0,0,0,0,0,0,0,0,0,0,0,0,1,1,0,0,0,0,0,0,0,0,0,0,0,0,0,0,0,0,0,0,0,0,0,0,0,0,0,0,0,0,0,1,0,0,0,0,0,0,0,0,0,0,0,0,1,0,0,0,0,0,0
295,"It was barely noticeable, but he could still feel mild tremors.","['a1_to_be_past_was_were', 'a2_could']",0,0,0,0,0,0,0,0,1,0,0,0,0,0,0,0,0,0,0,0,0,0,0,0,0,1,0,0,0,0,0,0,0,0,0,0,0,0,0,0,0,0,0,0,0,0,0,0,0,0,0,0,0,0,0,0,0,0,0,0,0,0,0,0,0,0,0,0,0,0
296,"But once at a party with university friends, they were sharing what they did for fun.","['a2_past_continuous', 'a1_be_have_do_in_the_past', 'a1_past_simple_irreg']",0,0,0,0,0,0,0,0,0,0,0,0,0,0,0,0,0,0,0,1,0,0,0,1,0,0,0,0,0,0,0,0,0,0,0,0,0,0,0,1,0,0,0,0,0,0,0,0,0,0,0,0,0,0,0,0,0,0,0,0,0,0,0,0,0,0,0,0,0,0
297,"Because the land on either side was privately owned, there was no looking for cave art.","['a2_passive_present_simple', 'a1_there_was_were']",0,0,0,0,0,0,0,0,0,0,0,1,0,0,0,0,0,0,0,0,0,0,0,0,0,0,0,0,0,0,0,0,0,0,0,0,0,0,0,0,0,0,0,0,0,0,0,0,0,0,0,0,0,0,0,0,0,0,1,0,0,0,0,0,0,0,0,0,0,0
298,"In April, he distracted fans and reporters from the news of a recall of 2, 700 Model X SUVs with a joking tweet comparing autopilot to the video game Mario Kart.",['a1_past_simple_reg'],0,0,0,0,0,0,0,0,0,0,0,0,0,0,0,0,0,0,1,0,0,0,0,0,0,0,0,0,0,0,0,0,0,0,0,0,0,0,0,0,0,0,0,0,0,0,0,0,0,0,0,0,0,0,0,0,0,0,0,0,0,0,0,0,0,0,0,0,0,0
299,"And actually, we have current data that does show that there is an actual drift towards complexity over time.","['a1_present_simple_reg_act', 'a1_there_is_am_are']",0,0,0,0,0,0,0,0,0,0,0,0,1,0,0,1,0,0,0,0,0,0,0,0,0,0,0,0,0,0,0,0,0,0,0,0,0,0,0,0,0,0,0,0,0,0,0,0,0,0,0,0,0,0,0,0,0,0,0,0,0,0,0,0,0,0,0,0,0,0
300,Without wearing a single outfit that could be considered truly Obama has rewritten the playbook.,"['a2_could', 'a2_present_perfect']",0,0,0,0,0,0,0,0,0,0,0,0,0,0,0,0,0,0,0,0,0,0,0,0,0,1,0,0,0,0,0,0,0,0,0,0,0,0,0,0,0,1,0,0,0,0,0,0,0,0,0,0,0,0,0,0,0,0,0,0,0,0,0,0,0,0,0,0,0,0
301,"It was a very long time ago that we decided that flying would be fun, and it took us until 1903 to actually work out how to do it.","['a1_past_simple_reg', 'a1_past_simple_irreg', 'a2_to_non_finite_forms']",0,0,0,0,0,0,0,0,0,0,0,0,0,0,0,0,0,0,1,1,0,0,0,0,0,0,0,0,0,0,0,0,0,0,0,0,0,0,0,0,0,0,0,0,0,0,0,0,0,1,0,0,0,0,0,0,0,0,0,0,0,0,0,0,0,0,0,0,0,0
302,And I found myself the Friday after September 11th - two days afterwards - literally unable to motivate anyone to do anything.,"['a1_past_simple_irreg', 'a2_to_non_finite_forms']",0,0,0,0,0,0,0,0,0,0,0,0,0,0,0,0,0,0,0,1,0,0,0,0,0,0,0,0,0,0,0,0,0,0,0,0,0,0,0,0,0,0,0,0,0,0,0,0,0,1,0,0,0,0,0,0,0,0,0,0,0,0,0,0,0,0,0,0,0,0
303,Mandela served 27 years in South African prisons for leading an liberation struggle that deployed selective violence as a political tool,"['a1_past_simple_reg', 'a2_ing_non_finite_forms']",0,0,0,0,0,0,0,0,0,0,0,0,0,0,0,0,0,0,1,0,0,0,0,0,0,0,0,0,0,0,0,0,0,0,0,0,0,0,0,0,0,0,0,0,0,0,0,0,0,0,1,0,0,0,0,0,0,0,0,0,0,0,0,0,0,0,0,0,0,0
304,It's also very cold out there - less than three degrees above absolute zero.,['a1_to_be_present_is_am_are'],0,0,0,0,0,0,0,0,0,1,0,0,0,0,0,0,0,0,0,0,0,0,0,0,0,0,0,0,0,0,0,0,0,0,0,0,0,0,0,0,0,0,0,0,0,0,0,0,0,0,0,0,0,0,0,0,0,0,0,0,0,0,0,0,0,0,0,0,0,0
305,"Would you believe that just yesterday we had 11 new cases in Florida, said Democratic senator Bill Nelson.","['a2_say_reported_verb', 'a1_past_simple_irreg']",0,0,0,0,0,0,0,0,0,0,0,0,0,0,0,0,0,0,0,1,0,0,0,0,0,0,0,0,0,0,0,0,0,0,0,0,0,0,0,0,0,0,0,0,0,0,0,0,0,0,0,0,0,0,0,1,0,0,0,0,0,0,0,0,0,0,0,0,0,0
306,"This little beast, right now, is producing a few hundred watts of electricity.",['a1_present_continuous_act_rn'],0,0,0,0,0,0,0,0,0,0,0,0,0,0,0,0,0,1,0,0,0,0,0,0,0,0,0,0,0,0,0,0,0,0,0,0,0,0,0,0,0,0,0,0,0,0,0,0,0,0,0,0,0,0,0,0,0,0,0,0,0,0,0,0,0,0,0,0,0,0
307,I thanked her for being there and began to talk about how Keith was doing.,"['a1_past_simple_reg', 'a1_present_continuous_act_rn', 'a1_past_simple_irreg', 'a2_to_non_finite_forms', 'a2_past_continuous', 'a2_narrative_tenses', 'a2_past_reported_speech']",0,0,0,0,0,0,0,0,0,0,0,0,0,0,0,0,0,1,1,1,0,0,0,0,0,0,0,0,0,0,0,0,0,0,0,0,0,0,0,1,1,0,0,0,0,0,0,0,0,1,0,0,0,1,0,0,0,0,0,0,0,0,0,0,0,0,0,0,0,0
308,What I do know is that I'm never playing that damned game ever.,"['a1_present_simple_reg_act', 'a1_present_continuous_act_rn']",0,0,0,0,0,0,0,0,0,0,0,0,0,0,0,1,0,1,0,0,0,0,0,0,0,0,0,0,0,0,0,0,0,0,0,0,0,0,0,0,0,0,0,0,0,0,0,0,0,0,0,0,0,0,0,0,0,0,0,0,0,0,0,0,0,0,0,0,0,0
309,"But I guess I can see how someone could just see the picture, read I'd posted it and call it attention-whoring.","['a1_can', 'a1_present_simple_reg_act', 'a2_could', 'a2_past_perfect_basic']",0,0,0,0,0,0,0,0,0,0,0,0,0,0,1,1,0,0,0,0,0,0,0,0,0,1,0,0,0,0,0,0,0,0,0,0,0,0,0,0,0,0,1,0,0,0,0,0,0,0,0,0,0,0,0,0,0,0,0,0,0,0,0,0,0,0,0,0,0,0
310,Could this have exposed the plankton when one of the pieces was being sent up?,['a2_could'],0,0,0,0,0,0,0,0,0,0,0,0,0,0,0,0,0,0,0,0,0,0,0,0,0,1,0,0,0,0,0,0,0,0,0,0,0,0,0,0,0,0,0,0,0,0,0,0,0,0,0,0,0,0,0,0,0,0,0,0,0,0,0,0,0,0,0,0,0,0
311,Note that we no longer have to interact with the HTML directly.,"['a2_imperatives', 'a2_have_to']",0,0,0,0,0,0,0,0,0,0,0,0,0,0,0,0,0,0,0,0,0,0,0,0,0,0,0,0,0,0,1,0,0,0,0,1,0,0,0,0,0,0,0,0,0,0,0,0,0,0,0,0,0,0,0,0,0,0,0,0,0,0,0,0,0,0,0,0,0,0
312,"Visual C++ has complex requirements for the command-line environment to find the tools, headers, and libraries it uses.","['a1_present_simple_3d_pers', 'a2_to_non_finite_forms']",0,0,0,0,0,0,0,0,0,0,0,0,0,0,0,0,1,0,0,0,0,0,0,0,0,0,0,0,0,0,0,0,0,0,0,0,0,0,0,0,0,0,0,0,0,0,0,0,0,1,0,0,0,0,0,0,0,0,0,0,0,0,0,0,0,0,0,0,0,0
313,"He's just the build for a Seeker, too, said Wood, now walking around Harry and staring at him.","['a1_to_be_present_is_am_are', 'a2_say_reported_verb']",0,0,0,0,0,0,0,0,0,1,0,0,0,0,0,0,0,0,0,0,0,0,0,0,0,0,0,0,0,0,0,0,0,0,0,0,0,0,0,0,0,0,0,0,0,0,0,0,0,0,0,0,0,0,0,1,0,0,0,0,0,0,0,0,0,0,0,0,0,0
314,When I open my eyes I'll be at home in my cupboard.,"['a1_future_simple', 'a1_present_simple_reg_act']",0,0,0,0,0,0,0,0,0,0,0,0,0,0,0,1,0,0,0,0,1,0,0,0,0,0,0,0,0,0,0,0,0,0,0,0,0,0,0,0,0,0,0,0,0,0,0,0,0,0,0,0,0,0,0,0,0,0,0,0,0,0,0,0,0,0,0,0,0,0
315,"Comets look flashy, but they're not in the same league as the Nimbus.","['a1_present_simple_reg_act', 'a1_to_be_present_is_am_are']",0,0,0,0,0,0,0,0,0,1,0,0,0,0,0,1,0,0,0,0,0,0,0,0,0,0,0,0,0,0,0,0,0,0,0,0,0,0,0,0,0,0,0,0,0,0,0,0,0,0,0,0,0,0,0,0,0,0,0,0,0,0,0,0,0,0,0,0,0,0
316,"A lot of green smoke came billowing out, and as it cleared, Harry gasped.","['a2_much_many_a_lot', 'a1_past_simple_irreg', 'a1_past_simple_reg']",0,0,0,0,0,0,0,0,0,0,0,0,0,0,0,0,0,0,1,1,0,0,0,0,0,0,0,0,0,0,0,0,0,0,0,0,0,0,0,0,0,0,0,1,0,0,0,0,0,0,0,0,0,0,0,0,0,0,0,0,0,0,0,0,0,0,0,0,0,0
317,"People pushed their way toward the door and out on to a tiny, dark platform.",['a1_past_simple_reg'],0,0,0,0,0,0,0,0,0,0,0,0,0,0,0,0,0,0,1,0,0,0,0,0,0,0,0,0,0,0,0,0,0,0,0,0,0,0,0,0,0,0,0,0,0,0,0,0,0,0,0,0,0,0,0,0,0,0,0,0,0,0,0,0,0,0,0,0,0,0
318,"He stood up and started walking towards them, but the whole floor seemed to lengthen so that the distance between them stayed the same.","['a1_past_simple_irreg', 'a1_past_simple_reg', 'a2_ing_non_finite_forms', 'a2_narrative_tenses']",0,0,0,0,0,0,0,0,0,0,0,0,0,0,0,0,0,0,1,1,0,0,0,0,0,0,0,0,0,0,0,0,0,0,0,0,0,0,0,0,1,0,0,0,0,0,0,0,0,0,1,0,0,0,0,0,0,0,0,0,0,0,0,0,0,0,0,0,0,0
319,"When my siblings and I were younger, one of our favorite books was Little Pear by Eleanor Frances Lattimore.",['a1_to_be_past_was_were'],0,0,0,0,0,0,0,0,1,0,0,0,0,0,0,0,0,0,0,0,0,0,0,0,0,0,0,0,0,0,0,0,0,0,0,0,0,0,0,0,0,0,0,0,0,0,0,0,0,0,0,0,0,0,0,0,0,0,0,0,0,0,0,0,0,0,0,0,0,0
320,"I was a little suckered in by the photos too, so I agreed.","['a1_to_be_past_was_were', 'a1_past_simple_reg']",0,0,0,0,0,0,0,0,1,0,0,0,0,0,0,0,0,0,1,0,0,0,0,0,0,0,0,0,0,0,0,0,0,0,0,0,0,0,0,0,0,0,0,0,0,0,0,0,0,0,0,0,0,0,0,0,0,0,0,0,0,0,0,0,0,0,0,0,0,0
321,I stretch for the second shade in the far corner but can't quite grab the dingy ring.,"['a1_can', 'a1_present_simple_reg_act']",0,0,0,0,0,0,0,0,0,0,0,0,0,0,1,1,0,0,0,0,0,0,0,0,0,0,0,0,0,0,0,0,0,0,0,0,0,0,0,0,0,0,0,0,0,0,0,0,0,0,0,0,0,0,0,0,0,0,0,0,0,0,0,0,0,0,0,0,0,0
322,"Of course, we had to try them and they became an instant favorite","['a2_had_to', 'a1_past_simple_irreg']",0,0,0,0,0,0,0,0,0,0,0,0,0,0,0,0,0,0,0,1,0,0,0,0,0,0,0,0,0,0,0,1,0,0,0,0,0,0,0,0,0,0,0,0,0,0,0,0,0,0,0,0,0,0,0,0,0,0,0,0,0,0,0,0,0,0,0,0,0,0
323,Rove - the man who challenged the Fox News election desk as it called the 2012 election for Obama - was incredulous.,"['a1_past_simple_reg', 'a1_to_be_past_was_were']",0,0,0,0,0,0,0,0,1,0,0,0,0,0,0,0,0,0,1,0,0,0,0,0,0,0,0,0,0,0,0,0,0,0,0,0,0,0,0,0,0,0,0,0,0,0,0,0,0,0,0,0,0,0,0,0,0,0,0,0,0,0,0,0,0,0,0,0,0,0
324,"And the other really interesting thing is that when skeletal muscle - there's been several reports that when skeletal muscle is injured, that's what correlates with metastases going to skeletal muscle.","['a1_to_be_present_is_am_are', 'a1_present_simple_3d_pers', 'a2_is_am_are_going_to', 'a2_passive_present_simple']",0,0,0,0,0,0,0,0,0,1,0,0,0,0,0,0,1,0,0,0,0,0,0,0,0,0,0,0,0,0,0,0,0,0,0,0,0,1,0,0,0,0,0,0,0,0,0,0,0,0,0,0,0,0,0,0,0,0,1,0,0,0,0,0,0,0,0,0,0,0
325,"Survey respondents were asked how much time they spent during the last month being nervous, calm and peaceful, downhearted and blue, happy, and so down in the dumps that nothing can cheer you up .","['a2_passive_past_simple', 'a1_past_simple_irreg', 'a2_ing_non_finite_forms', 'a1_can']",0,0,0,0,0,0,0,0,0,0,0,0,0,0,1,0,0,0,0,1,0,0,0,0,0,0,0,0,0,0,0,0,0,0,0,0,0,0,0,0,0,0,0,0,0,0,0,0,0,0,1,0,0,0,0,0,0,0,0,0,0,1,0,0,0,0,0,0,0,0
326,"And, anyway, despite the fact that they were far superior in adherence, and the quality of their tomato paste, Prego was struggling.",['a1_to_be_past_was_were'],0,0,0,0,0,0,0,0,1,0,0,0,0,0,0,0,0,0,0,0,0,0,0,0,0,0,0,0,0,0,0,0,0,0,0,0,0,0,0,0,0,0,0,0,0,0,0,0,0,0,0,0,0,0,0,0,0,0,0,0,0,0,0,0,0,0,0,0,0,0
327,"Binding acquisition offers are due in the next two weeks, and Twitter has already whittled down the field of potential acquirers, the people familiar with the matter said this week.","['a2_present_perfect', 'a1_past_simple_irreg', 'a2_say_reported_verb']",0,0,0,0,0,0,0,0,0,0,0,0,0,0,0,0,0,0,0,1,0,0,0,0,0,0,0,0,0,0,0,0,0,0,0,0,0,0,0,0,0,1,0,0,0,0,0,0,0,0,0,0,0,0,0,1,0,0,0,0,0,0,0,0,0,0,0,0,0,0
328,"We want to have a community where you can upload ideas, and those ideas can be tested in an earthquake, in flood, in all sorts of austere environments.","['a1_present_simple_reg_act', 'a2_to_non_finite_forms', 'a1_can', 'a2_passive_modal_verbs']",0,0,0,0,0,0,0,0,0,0,0,0,0,0,1,1,0,0,0,0,0,0,0,0,0,0,0,0,0,0,0,0,0,0,0,0,0,0,0,0,0,0,0,0,0,0,0,0,0,1,0,0,0,0,0,0,0,0,0,0,0,0,0,1,0,0,0,0,0,0
329,"I know one guy who's spent $4,000 just on Photoshop over the years.","['a1_present_simple_reg_act', 'a2_present_perfect']",0,0,0,0,0,0,0,0,0,0,0,0,0,0,0,1,0,0,0,0,0,0,0,0,0,0,0,0,0,0,0,0,0,0,0,0,0,0,0,0,0,1,0,0,0,0,0,0,0,0,0,0,0,0,0,0,0,0,0,0,0,0,0,0,0,0,0,0,0,0
330,"You don't go to Buckingham Palace in a sweater, sniffed the designer Oscar de la Renta - but he was already out of touch.","['a1_present_simple_reg_act', 'a1_to_be_past_was_were']",0,0,0,0,0,0,0,0,1,0,0,0,0,0,0,1,0,0,0,0,0,0,0,0,0,0,0,0,0,0,0,0,0,0,0,0,0,0,0,0,0,0,0,0,0,0,0,0,0,0,0,0,0,0,0,0,0,0,0,0,0,0,0,0,0,0,0,0,0,0
331,That development should not come at the expense of the majority of the population is still considered a radical idea here in the U.S.,"['a2_should', 'a2_passive_present_simple']",0,0,0,0,0,0,0,0,0,0,0,0,0,0,0,0,0,0,0,0,0,0,0,0,0,0,0,0,0,0,0,0,0,1,0,0,0,0,0,0,0,0,0,0,0,0,0,0,0,0,0,0,0,0,0,0,0,0,1,0,0,0,0,0,0,0,0,0,0,0
332,"The whole class did it at the same time, kick this way, spinning kick that way, punch here, punch there etc etc.","['a1_be_have_do_in_the_past', 'a1_past_simple_irreg']",0,0,0,0,0,0,0,0,0,0,0,0,0,0,0,0,0,0,0,1,0,0,0,1,0,0,0,0,0,0,0,0,0,0,0,0,0,0,0,0,0,0,0,0,0,0,0,0,0,0,0,0,0,0,0,0,0,0,0,0,0,0,0,0,0,0,0,0,0,0
333,"I don't remember what they put in it, but I do know that someone ran to a grocery store for another ingrediemt.","['a1_present_simple_reg_act', 'a1_past_simple_irreg']",0,0,0,0,0,0,0,0,0,0,0,0,0,0,0,1,0,0,0,1,0,0,0,0,0,0,0,0,0,0,0,0,0,0,0,0,0,0,0,0,0,0,0,0,0,0,0,0,0,0,0,0,0,0,0,0,0,0,0,0,0,0,0,0,0,0,0,0,0,0
334,I go to London and on first day I went to big ben.,"['a1_past_simple_irreg', 'a1_present_simple_reg_act']",0,0,0,0,0,0,0,0,0,0,0,0,0,0,0,1,0,0,0,1,0,0,0,0,0,0,0,0,0,0,0,0,0,0,0,0,0,0,0,0,0,0,0,0,0,0,0,0,0,0,0,0,0,0,0,0,0,0,0,0,0,0,0,0,0,0,0,0,0,0
335,"The Karate teacher happened to be standing right in front of me as I prepared for a punch, so I kinda shuffled to the side and punched the air next to him.","['a1_past_simple_reg', 'a2_to_non_finite_forms']",0,0,0,0,0,0,0,0,0,0,0,0,0,0,0,0,0,0,1,0,0,0,0,0,0,0,0,0,0,0,0,0,0,0,0,0,0,0,0,0,0,0,0,0,0,0,0,0,0,1,0,0,0,0,0,0,0,0,0,0,0,0,0,0,0,0,0,0,0,0
336,A long time ago I wanted to do a story that involved some really big magnets that I had gotten hold of and told the producer about it.,"['a1_past_simple_reg', 'a2_to_non_finite_forms', 'a2_narrative_tenses', 'a2_past_perfect_basic', 'a1_past_simple_irreg']",0,0,0,0,0,0,0,0,0,0,0,0,0,0,0,0,0,0,1,1,0,0,0,0,0,0,0,0,0,0,0,0,0,0,0,0,0,0,0,0,1,0,1,0,0,0,0,0,0,1,0,0,0,0,0,0,0,0,0,0,0,0,0,0,0,0,0,0,0,0
337,"For example, Vue components implement the Slot API and the is special attribute.","['a1_present_simple_reg_act', 'a1_to_be_present_is_am_are']",0,0,0,0,0,0,0,0,0,1,0,0,0,0,0,1,0,0,0,0,0,0,0,0,0,0,0,0,0,0,0,0,0,0,0,0,0,0,0,0,0,0,0,0,0,0,0,0,0,0,0,0,0,0,0,0,0,0,0,0,0,0,0,0,0,0,0,0,0,0
338,He couldn't remember being in the car when his parents had died.,"['a2_could', 'a2_ing_non_finite_forms', 'a2_past_perfect_basic', 'a2_narrative_tenses']",0,0,0,0,0,0,0,0,0,0,0,0,0,0,0,0,0,0,0,0,0,0,0,0,0,1,0,0,0,0,0,0,0,0,0,0,0,0,0,0,1,0,1,0,0,0,0,0,0,0,1,0,0,0,0,0,0,0,0,0,0,0,0,0,0,0,0,0,0,0
339,"They were looking straight into the eyes of a monstrous dog, a dog that filled the whole space between ceiling and floor.","['a2_past_continuous', 'a1_past_simple_reg']",0,0,0,0,0,0,0,0,0,0,0,0,0,0,0,0,0,0,1,0,0,0,0,0,0,0,0,0,0,0,0,0,0,0,0,0,0,0,0,1,0,0,0,0,0,0,0,0,0,0,0,0,0,0,0,0,0,0,0,0,0,0,0,0,0,0,0,0,0,0
340,Wood was now looking as though all his dreams had come true at once.,"['a2_past_continuous', 'a2_past_perfect_basic']",0,0,0,0,0,0,0,0,0,0,0,0,0,0,0,0,0,0,0,0,0,0,0,0,0,0,0,0,0,0,0,0,0,0,0,0,0,0,0,1,0,0,1,0,0,0,0,0,0,0,0,0,0,0,0,0,0,0,0,0,0,0,0,0,0,0,0,0,0,0
341,You don't want to go making friends with the wrong sort.,"['a1_present_simple_reg_act', 'a2_ing_non_finite_forms', 'a2_to_non_finite_forms']",0,0,0,0,0,0,0,0,0,0,0,0,0,0,0,1,0,0,0,0,0,0,0,0,0,0,0,0,0,0,0,0,0,0,0,0,0,0,0,0,0,0,0,0,0,0,0,0,0,1,1,0,0,0,0,0,0,0,0,0,0,0,0,0,0,0,0,0,0,0
342,Yet something had been nagging at the back of his mind all day.,['a2_past_perfect_basic'],0,0,0,0,0,0,0,0,0,0,0,0,0,0,0,0,0,0,0,0,0,0,0,0,0,0,0,0,0,0,0,0,0,0,0,0,0,0,0,0,0,0,1,0,0,0,0,0,0,0,0,0,0,0,0,0,0,0,0,0,0,0,0,0,0,0,0,0,0,0
343,"Towards the end of 2018, I shared the results of a more detailed experiment, covering around three months of sleep and related data and attempting to find correlations.","['a1_past_simple_reg', 'a2_to_non_finite_forms']",0,0,0,0,0,0,0,0,0,0,0,0,0,0,0,0,0,0,1,0,0,0,0,0,0,0,0,0,0,0,0,0,0,0,0,0,0,0,0,0,0,0,0,0,0,0,0,0,0,1,0,0,0,0,0,0,0,0,0,0,0,0,0,0,0,0,0,0,0,0
344,Tight schedules with no flexibility can be overwhelming and feeling like you didn't accomplish a certain goal can be taxing to your mental health.,"['a1_can', 'a2_passive_modal_verbs', 'a1_past_simple_reg']",0,0,0,0,0,0,0,0,0,0,0,0,0,0,1,0,0,0,1,0,0,0,0,0,0,0,0,0,0,0,0,0,0,0,0,0,0,0,0,0,0,0,0,0,0,0,0,0,0,0,0,0,0,0,0,0,0,0,0,0,0,0,0,1,0,0,0,0,0,0
345,"Because priority and strategy are often unclear, the best path to this necessary relevance is how busy/urgent/in need you are.",['a1_to_be_present_is_am_are'],0,0,0,0,0,0,0,0,0,1,0,0,0,0,0,0,0,0,0,0,0,0,0,0,0,0,0,0,0,0,0,0,0,0,0,0,0,0,0,0,0,0,0,0,0,0,0,0,0,0,0,0,0,0,0,0,0,0,0,0,0,0,0,0,0,0,0,0,0,0
346,"The Oura ring provides a lot of additional variables that I didn't look into here, and the analysis itself was also fairly simplistic.","['a1_present_simple_3d_pers', 'a1_past_simple_reg', 'a1_to_be_past_was_were']",0,0,0,0,0,0,0,0,1,0,0,0,0,0,0,0,1,0,1,0,0,0,0,0,0,0,0,0,0,0,0,0,0,0,0,0,0,0,0,0,0,0,0,0,0,0,0,0,0,0,0,0,0,0,0,0,0,0,0,0,0,0,0,0,0,0,0,0,0,0
347,The Guardian asked three economists to weigh in on what we can expect from a Trump or Clinton White House.,"['a1_past_simple_reg', 'a2_to_non_finite_forms', 'a1_can']",0,0,0,0,0,0,0,0,0,0,0,0,0,0,1,0,0,0,1,0,0,0,0,0,0,0,0,0,0,0,0,0,0,0,0,0,0,0,0,0,0,0,0,0,0,0,0,0,0,1,0,0,0,0,0,0,0,0,0,0,0,0,0,0,0,0,0,0,0,0
348,"He lives in this log cabin - no running water, no heat other than - no windows and high-speed Internet connection.",['a1_present_simple_3d_pers'],0,0,0,0,0,0,0,0,0,0,0,0,0,0,0,0,1,0,0,0,0,0,0,0,0,0,0,0,0,0,0,0,0,0,0,0,0,0,0,0,0,0,0,0,0,0,0,0,0,0,0,0,0,0,0,0,0,0,0,0,0,0,0,0,0,0,0,0,0,0
349,"So you would have expected Clinton to do better, regardless of how she performed during the debate.","['a2_to_non_finite_forms', 'a1_past_simple_reg']",0,0,0,0,0,0,0,0,0,0,0,0,0,0,0,0,0,0,1,0,0,0,0,0,0,0,0,0,0,0,0,0,0,0,0,0,0,0,0,0,0,0,0,0,0,0,0,0,0,1,0,0,0,0,0,0,0,0,0,0,0,0,0,0,0,0,0,0,0,0
350,And like the playwright said the other day - I could relate to him: you're not sure.,"['a2_say_reported_verb', 'a1_past_simple_irreg', 'a2_could', 'a1_to_be_present_is_am_are']",0,0,0,0,0,0,0,0,0,1,0,0,0,0,0,0,0,0,0,1,0,0,0,0,0,1,0,0,0,0,0,0,0,0,0,0,0,0,0,0,0,0,0,0,0,0,0,0,0,0,0,0,0,0,0,1,0,0,0,0,0,0,0,0,0,0,0,0,0,0
351,The study acknowledges that the anxiety that individuals have in marriages based on their economic dependence or independence might be affected by their prior views about traditional gender roles.,"['a1_present_simple_3d_pers', 'a1_present_simple_reg_act', 'a2_passive_modal_verbs']",0,0,0,0,0,0,0,0,0,0,0,0,0,0,0,1,1,0,0,0,0,0,0,0,0,0,0,0,0,0,0,0,0,0,0,0,0,0,0,0,0,0,0,0,0,0,0,0,0,0,0,0,0,0,0,0,0,0,0,0,0,0,0,1,0,0,0,0,0,0
352,"We are very ignorant about what the time scale for these things are, but they all are consistent with everything we know about physical laws, laws of chemistry, etc.","['a1_to_be_present_is_am_are', 'a1_present_simple_reg_act']",0,0,0,0,0,0,0,0,0,1,0,0,0,0,0,1,0,0,0,0,0,0,0,0,0,0,0,0,0,0,0,0,0,0,0,0,0,0,0,0,0,0,0,0,0,0,0,0,0,0,0,0,0,0,0,0,0,0,0,0,0,0,0,0,0,0,0,0,0,0
353,"To put the assumptions very clearly: capitalism, after 150 years, has become acceptable, and so has democracy.",['a2_present_perfect'],0,0,0,0,0,0,0,0,0,0,0,0,0,0,0,0,0,0,0,0,0,0,0,0,0,0,0,0,0,0,0,0,0,0,0,0,0,0,0,0,0,1,0,0,0,0,0,0,0,0,0,0,0,0,0,0,0,0,0,0,0,0,0,0,0,0,0,0,0,0
354,"Double-crossed and scorn, he's going to direct all his attention on bringing the cartel down once and for all.",['a2_is_am_are_going_to'],0,0,0,0,0,0,0,0,0,0,0,0,0,0,0,0,0,0,0,0,0,0,0,0,0,0,0,0,0,0,0,0,0,0,0,0,0,1,0,0,0,0,0,0,0,0,0,0,0,0,0,0,0,0,0,0,0,0,0,0,0,0,0,0,0,0,0,0,0,0
355,"I want every Arup engineer in the world to check and make sure that we're doing stuff that's standing, because those guys are the best in the world.","['a1_present_simple_reg_act', 'a2_to_non_finite_forms', 'a1_present_continuous_act_rn', 'a1_to_be_present_is_am_are']",0,0,0,0,0,0,0,0,0,1,0,0,0,0,0,1,0,1,0,0,0,0,0,0,0,0,0,0,0,0,0,0,0,0,0,0,0,0,0,0,0,0,0,0,0,0,0,0,0,1,0,0,0,0,0,0,0,0,0,0,0,0,0,0,0,0,0,0,0,0
356,The front bumper received most of the damage and the hood and headlights had some scratches.,"['a1_past_simple_reg', 'a1_be_have_do_in_the_past']",0,0,0,0,0,0,0,0,0,0,0,0,0,0,0,0,0,0,1,0,0,0,0,1,0,0,0,0,0,0,0,0,0,0,0,0,0,0,0,0,0,0,0,0,0,0,0,0,0,0,0,0,0,0,0,0,0,0,0,0,0,0,0,0,0,0,0,0,0,0
357,"Well they might have gotten caught eventually anyway, but imagine if they ever found out THIS is why they got busted.","['a1_past_simple_irreg', 'a2_present_perfect']",0,0,0,0,0,0,0,0,0,0,0,0,0,0,0,0,0,0,0,1,0,0,0,0,0,0,0,0,0,0,0,0,0,0,0,0,0,0,0,0,0,1,0,0,0,0,0,0,0,0,0,0,0,0,0,0,0,0,0,0,0,0,0,0,0,0,0,0,0,0
358,"For perhaps the first documented time in history, this women went black and went back.",['a1_past_simple_irreg'],0,0,0,0,0,0,0,0,0,0,0,0,0,0,0,0,0,0,0,1,0,0,0,0,0,0,0,0,0,0,0,0,0,0,0,0,0,0,0,0,0,0,0,0,0,0,0,0,0,0,0,0,0,0,0,0,0,0,0,0,0,0,0,0,0,0,0,0,0,0
359,"I had been there 4 years, and was 22 at the time.","['a2_past_perfect_basic', 'a1_to_be_past_was_were']",0,0,0,0,0,0,0,0,1,0,0,0,0,0,0,0,0,0,0,0,0,0,0,0,0,0,0,0,0,0,0,0,0,0,0,0,0,0,0,0,0,0,1,0,0,0,0,0,0,0,0,0,0,0,0,0,0,0,0,0,0,0,0,0,0,0,0,0,0,0
360,Rules are normally contained on a single line; rules with many alternatives may be formatted alternatively with each line after the first beginning with a vertical bar.,"['a2_passive_present_simple', 'a2_passive_modal_verbs']",0,0,0,0,0,0,0,0,0,0,0,0,0,0,0,0,0,0,0,0,0,0,0,0,0,0,0,0,0,0,0,0,0,0,0,0,0,0,0,0,0,0,0,0,0,0,0,0,0,0,0,0,0,0,0,0,0,0,1,0,0,0,0,1,0,0,0,0,0,0
361,"At last, Hagrid managed to make himself heard over the babble.","['a1_past_simple_reg', 'a2_to_non_finite_forms']",0,0,0,0,0,0,0,0,0,0,0,0,0,0,0,0,0,0,1,0,0,0,0,0,0,0,0,0,0,0,0,0,0,0,0,0,0,0,0,0,0,0,0,0,0,0,0,0,0,1,0,0,0,0,0,0,0,0,0,0,0,0,0,0,0,0,0,0,0,0
362,"There was a tabby cat standing on the corner of Privet Drive, but there wasn't a map in sight.","['a1_there_was_were', 'a2_ing_non_finite_forms']",0,0,0,0,0,0,0,0,0,0,0,1,0,0,0,0,0,0,0,0,0,0,0,0,0,0,0,0,0,0,0,0,0,0,0,0,0,0,0,0,0,0,0,0,0,0,0,0,0,0,1,0,0,0,0,0,0,0,0,0,0,0,0,0,0,0,0,0,0,0
363,"They say he met vampires in the Black Forest, and there was a nasty bit o' trouble with a hag - never been the same since.","['a1_present_simple_reg_act', 'a1_past_simple_irreg', 'a1_there_was_were', 'a2_present_perfect']",0,0,0,0,0,0,0,0,0,0,0,1,0,0,0,1,0,0,0,1,0,0,0,0,0,0,0,0,0,0,0,0,0,0,0,0,0,0,0,0,0,1,0,0,0,0,0,0,0,0,0,0,0,0,0,0,0,0,0,0,0,0,0,0,0,0,0,0,0,0
364,One book had a dark stain on it that looked horribly like blood.,"['a1_have_has_got', 'a1_past_simple_irreg', 'a1_past_simple_reg']",0,0,0,0,0,0,0,0,0,0,0,0,0,0,0,0,0,0,1,1,0,0,1,0,0,0,0,0,0,0,0,0,0,0,0,0,0,0,0,0,0,0,0,0,0,0,0,0,0,0,0,0,0,0,0,0,0,0,0,0,0,0,0,0,0,0,0,0,0,0
365,That's where he was going when we saw him - he's after whatever it's guarding!,"['a2_past_continuous', 'a1_to_be_present_is_am_are', 'a1_past_simple_irreg', 'a1_present_continuous_act_rn']",0,0,0,0,0,0,0,0,0,1,0,0,0,0,0,0,0,1,0,1,0,0,0,0,0,0,0,0,0,0,0,0,0,0,0,0,0,0,0,1,0,0,0,0,0,0,0,0,0,0,0,0,0,0,0,0,0,0,0,0,0,0,0,0,0,0,0,0,0,0
