,sent,type,a1_be_have_do_in_the_past,a1_can,a1_comparative_exept,a1_comparative_long,a1_comparative_short,a1_future_simple,a1_have_has_got,a1_past_simple_irreg,a1_past_simple_reg,a1_possesive_s_sing,a1_possessive_s_plurar,a1_present_continuous_act_rn,a1_present_simple_3d_pers,a1_present_simple_reg_act,a1_special_questions,a1_superlative_exept,a1_superlative_long,a1_superlative_short,a1_there_is_am_are,a1_there_was_were,a1_there_will_be,a1_to_be_future_will_be,a1_to_be_past_was_were,a1_to_be_present_is_am_are,a1_want_would_like_to,a2_adjectives_ed,a2_adjectives_ing,a2_ask_reported_verb,a2_could,a2_first_conditional_if_m,a2_first_conditional_m_if,a2_had_to,a2_have_to,a2_imp_reported_speech,a2_imperatives,a2_ing_non_finite_forms,a2_is_able_to,a2_is_am_are_going_to,a2_much_many_a_lot,a2_must,a2_narrative_tenses,a2_passive_modal_verbs,a2_passive_past_simple,a2_passive_present_cont,a2_passive_present_perf,a2_passive_present_simple,a2_passive_will,a2_past_continuous,a2_past_perfect_basic,a2_past_reported_speech,a2_pr_reported_speech,a2_prepositions_of_time,a2_present_perfect,a2_relative_clause_others,a2_relative_clause_who_which_that,a2_say_reported_verb,a2_second_conditional_if_m,a2_second_conditional_m_if,a2_should,a2_tell_reported_verb,a2_to_non_finite_forms,a2_was_were_be_able_to,a2_was_were_going_to,a2_will_be_able_to,a2_will_be_going_to,a2_will_have_to,a2_zero_article,a2_zero_conditional_if_m,a2_zero_conditional_m_if,a2_zero_non_finite_forms
0,I have never once washed an apple from the store before I ate it.,"['a2_present_perfect', 'a1_past_simple_irreg', 'a2_narrative_tenses', 'a2_article_a_an', 'a1_singular_nouns']",0,0,0,0,0,0,0,0,0,0,0,0,0,0,0,0,0,0,0,1,0,0,0,0,0,0,0,0,0,0,0,0,0,0,0,0,0,0,0,0,1,1,0,0,0,0,0,0,0,0,0,0,0,0,0,0,0,0,0,0,0,0,0,0,0,0,0,0,0,0
1,"Under the rules of dueling, Dickinson had to remain still as Jackson took aim and shot and killed him.","['a2_had_to', 'a1_past_simple_irreg', 'a2_narrative_tenses']",0,0,0,0,0,0,0,0,0,0,0,0,0,0,0,0,0,0,0,1,0,0,0,0,0,0,0,0,0,0,0,1,0,0,0,0,0,0,0,0,1,0,0,0,0,0,0,0,0,0,0,0,0,0,0,0,0,0,0,0,0,0,0,0,0,0,0,0,0,0
2,"Usually, when I tell someone, they give me a blank stare, then ask What is Reddit?","['a2_first_conditional_if_m', 'a1_present_simple_reg_act']",0,0,0,0,0,0,0,0,0,0,0,0,0,0,0,1,0,0,0,0,0,0,0,0,0,0,0,0,0,0,0,0,0,0,0,0,0,0,0,0,0,0,0,0,0,0,0,0,0,0,0,0,0,0,0,0,0,0,0,0,0,0,0,0,0,0,1,0,0,0
3,"Unfortunately, the names of the developer command prompt shortcuts and where they're located are different in almost every version of Visual C++ and on different versions of Windows.","['a2_article_the', 'a1_to_be_present_is_am_are', 'a1_present_simple_reg_act', 'a1_plural_nouns']",0,0,0,0,0,0,0,0,0,1,0,0,0,0,0,1,0,0,0,0,0,0,0,0,0,0,0,0,0,0,0,0,0,0,0,0,0,0,0,0,0,0,0,0,0,0,0,0,0,0,0,0,0,0,0,0,0,0,0,0,0,0,0,0,0,0,0,0,0,0
4,We recommend you use a developer command prompt shortcut instead of building your own.,['a1_possessive_pronouns'],0,0,0,0,0,0,0,0,0,0,0,0,0,0,0,0,0,0,0,0,0,0,0,0,0,0,0,0,0,0,0,0,0,0,0,0,0,0,0,0,0,0,0,0,0,0,0,0,0,0,0,0,0,0,0,0,0,0,0,0,0,0,0,0,0,0,0,0,0,0
5,"Note: We do not recommend that beginners start with vue-cli, especially if you are not yet familiar with Node.js-based build tools.","['a1_present_simple_reg_act', 'a2_zero_conditional_m_if', 'a1_plural_forms', 'a1_to_be_present_is_am_are']",0,0,0,0,0,0,0,0,0,1,0,0,0,0,0,1,0,0,0,0,0,0,0,0,0,0,0,0,0,0,0,0,0,0,0,0,0,0,0,0,0,0,0,0,0,0,0,0,0,0,0,0,0,0,0,0,0,0,0,0,0,0,0,0,0,1,0,0,0,0
6,Each rule begins with a name (which is the name defined by the rule) and ::=.,"['a1_present_simple_reg_act', 'a2_article_a_an', 'a2_relative_clause_who_which_that']",0,0,0,0,0,0,0,0,0,0,0,0,0,0,0,1,0,0,0,0,0,0,0,0,0,0,0,0,0,0,0,0,0,0,0,0,0,0,0,0,0,0,0,0,0,0,0,0,1,0,0,0,0,0,0,0,0,0,0,0,0,0,0,0,0,0,0,0,0,0
7,"This example demonstrates that we can bind data to not only text and attributes, but also the structure of the DOM.","['a1_present_simple_reg_act', 'a1_can', 'a2_to_non_finite_forms', 'a1_plural_forms']",0,0,0,0,0,0,0,0,0,0,0,0,0,0,1,1,0,0,0,0,0,0,0,0,0,0,0,0,0,0,0,0,0,0,0,0,0,0,0,0,0,0,0,0,0,0,0,0,0,1,0,0,0,0,0,0,0,0,0,0,0,0,0,0,0,0,0,0,0,0
8,"I'm not saying his heart isn't in the right place, said Professor McGonagall grudgingly, but you can't pretend he's not careless.","['a1_present_continuous_act_rn', 'a1_to_be_present_is_am_are', 'a2_say_reported_verb', 'a1_can', 'a2_article_the', 'a1_possessive_pronouns']",0,0,0,0,0,0,0,0,0,1,0,0,0,0,1,0,0,1,0,0,0,0,0,0,0,0,0,0,0,0,0,0,0,0,0,0,0,0,0,0,0,0,0,0,0,0,0,0,0,0,0,0,0,0,0,1,0,0,0,0,0,0,0,0,0,0,0,0,0,0
9,Hundreds of seats were raised in stands around the field so that the spectators were high enough to see what was going on.,"['a1_plural_forms', 'a2_passive_present_simple', 'a2_to_non_finite_forms', 'a2_article_the', 'a1_to_be_past_was_were', 'a2_narrative_tenses']",0,0,0,0,0,0,0,0,1,0,0,0,0,0,0,0,0,0,0,0,0,0,0,0,0,0,0,0,0,0,0,0,0,0,0,0,0,0,0,0,1,0,0,0,0,0,0,0,0,1,0,0,0,0,0,0,0,0,1,0,0,0,0,0,0,0,0,0,0,0
10,"Cheered by a rowdy Korean contingent in the terraces, the trio threw down the gauntlet in the opening set, hitting the innermost gold circle six times in succession to score the maximum 60 points.","['a1_past_simple_irreg', 'a2_adjectives_ed', 'a2_article_the', 'a2_to_non_finite_forms']",0,0,0,0,0,0,0,0,0,0,0,0,0,0,0,0,0,0,0,1,0,0,0,0,0,0,0,0,0,0,0,0,0,0,0,0,0,0,0,0,0,0,0,0,0,0,1,0,0,1,0,0,0,0,0,0,0,0,0,0,0,0,0,0,0,0,0,0,0,0
11,"And a lot of talks here have espoused the benefits of having lots of people look at problems, share the information and work on those things together.","['a2_much_many_a_lot', 'a2_present_perfect', 'a2_ing_non_finite_forms', 'a1_plural_forms', 'a2_article_the']",0,0,0,0,0,0,0,0,0,0,0,0,0,0,0,0,0,0,0,0,0,0,0,0,0,0,0,0,0,0,0,0,0,0,0,0,0,0,0,0,0,1,0,1,0,0,0,0,0,0,1,0,0,0,0,0,0,0,0,0,0,0,0,0,0,0,0,0,0,0
12,"At its peak, he was one of two dozen independistas in federal prisons now he is the last one.","['a1_personal_pronouns', 'a1_possessive_pronouns', 'a1_to_be_past_was_were', 'a1_to_be_present_is_am_are', 'a1_plural_forms', 'a2_article_the']",0,0,0,0,0,0,0,0,1,1,0,0,0,0,0,0,0,0,0,0,0,0,0,0,0,0,0,0,0,0,0,0,0,0,0,0,0,0,0,0,0,0,0,0,0,0,0,0,0,0,0,0,0,0,0,0,0,0,0,0,0,0,0,0,0,0,0,0,0,0
13,"And George Homsey, a great guy, said, Oh, the future is amazing.","['a2_article_a_an', 'a2_article_the', 'a1_there_is_am_are', 'a2_adjectives_ing']",0,0,0,0,0,0,0,0,0,0,0,0,1,0,0,0,0,0,0,0,0,0,0,0,0,0,0,0,0,0,0,0,0,0,0,0,0,0,0,0,0,0,0,0,0,1,0,0,0,0,0,0,0,0,0,0,0,0,0,0,0,0,0,0,0,0,0,0,0,0
14,We have three new parties that could grab as much as 40% of the vote.,"['a2_could', 'a2_article_the', 'a1_plural_forms', 'a1_present_simple_reg_act', 'a2_much_many_a_lot']",0,0,0,0,0,0,0,0,0,0,0,0,0,0,0,1,0,0,0,0,0,0,0,0,0,1,0,0,0,0,0,0,0,0,0,0,0,0,0,0,0,0,0,1,0,0,0,0,0,0,0,0,0,0,0,0,0,0,0,0,0,0,0,0,0,0,0,0,0,0
15,"Books that might sell 100 copies a year, 1,000 copies a year.",['a1_plural_forms'],0,0,0,0,0,0,0,0,0,0,0,0,0,0,0,0,0,0,0,0,0,0,0,0,0,0,0,0,0,0,0,0,0,0,0,0,0,0,0,0,0,0,0,0,0,0,0,0,0,0,0,0,0,0,0,0,0,0,0,0,0,0,0,0,0,0,0,0,0,0
16,There is also a big difference between the voting demographics in the countryside and the cities.,"['a1_there_is_am_are', 'a2_article_a_an', 'a2_article_the', 'a1_plural_forms']",0,0,0,0,0,0,0,0,0,0,0,0,1,0,0,0,0,0,0,0,0,0,0,0,0,0,0,0,0,0,0,0,0,0,0,0,0,0,0,0,0,0,0,0,0,0,0,0,0,0,0,0,0,0,0,0,0,0,0,0,0,0,0,0,0,0,0,0,0,0
17,"He set off, drawing the Invisibility Cloak tight around him as he walked.","['a1_past_simple_irreg', 'a1_past_simple_reg', 'a1_personal_pronouns']",0,0,0,0,0,0,0,0,0,0,0,0,0,0,0,0,0,0,1,1,0,0,0,0,0,0,0,0,0,0,0,0,0,0,0,0,0,0,0,0,0,0,0,0,0,0,0,0,0,0,0,0,0,0,0,0,0,0,0,0,0,0,0,0,0,0,0,0,0,0
18,"You hang around with riffraff like the Weasleys and that Hagrid, and it'll rub off on you.","['a1_personal_pronouns', 'a2_future_simple_pred_bas_on_own_exp', 'a1_present_simple_reg_act']",0,0,0,0,0,0,0,0,0,0,0,0,0,0,0,1,0,0,0,0,0,0,0,0,0,0,0,0,0,0,0,0,0,0,0,0,0,0,0,0,0,0,0,0,0,0,0,0,0,0,0,0,0,0,0,0,0,0,0,0,0,0,0,0,0,0,0,0,0,0
19,"Uncle Vernon made another funny noise, like a mouse being trodden on.","['a1_past_simple_irreg', 'a2_article_a_an', 'a1_countable_nouns']",0,0,0,0,0,0,0,0,0,0,0,0,0,0,0,0,0,0,0,1,0,0,0,0,0,0,0,0,0,0,0,0,0,0,0,0,0,0,0,0,0,0,0,0,0,0,0,0,0,0,0,0,0,0,0,0,0,0,0,0,0,0,0,0,0,0,0,0,0,0
20,We spend 10-12 hours/day at work for the better part of our lives.,"['a1_present_simple_reg_act', 'a2_article_the', 'a1_possessive_pronouns', 'a1_plural_forms']",0,0,0,0,0,0,0,0,0,0,0,0,0,0,0,1,0,0,0,0,0,0,0,0,0,0,0,0,0,0,0,0,0,0,0,0,0,0,0,0,0,0,0,0,0,0,0,0,0,0,0,0,0,0,0,0,0,0,0,0,0,0,0,0,0,0,0,0,0,0
21,"There I stayed for a good 48-hours, clinging to the 24-hour news, drinking wine from a bottle.","['a1_past_simple_reg', 'a2_article_a_an', 'a1_countable_nouns', 'a1_uncountable_nouns']",0,0,0,0,0,0,0,0,0,0,0,0,0,0,0,0,0,0,1,0,0,0,0,0,0,0,0,0,0,0,0,0,0,0,0,0,0,0,0,0,0,0,0,0,0,0,0,0,0,0,0,0,0,0,0,0,0,0,0,0,0,0,0,0,0,0,0,0,0,0
22,They barely checked his passport and did not ask where he was headed.,"['a1_past_simple_reg', 'a2_relative_clause_others', 'a2_passive_past_simple', 'a1_possessive_pronouns']",0,0,0,0,0,0,0,0,0,0,0,0,0,0,0,0,0,0,1,0,0,0,0,0,0,0,0,0,0,0,0,0,0,0,0,0,0,0,0,0,0,0,0,0,0,0,0,1,0,0,0,0,0,0,0,0,0,0,0,0,0,1,0,0,0,0,0,0,0,0
23,I started working on the application by contacting one of my professors and the employer from my last internship to help me with the recommendation letters.,"['a1_past_simple_reg', 'a1_personal_pronouns', 'a2_to_non_finite_forms', 'a1_plural_forms', 'a1_possessive_pronouns', 'a2_article_the', 'a2_ing_non_finite_forms']",0,0,0,0,0,0,0,0,0,0,0,0,0,0,0,0,0,0,1,0,0,0,0,0,0,0,0,0,0,0,0,0,0,0,0,0,0,0,0,0,0,0,0,0,0,0,0,0,0,1,1,0,0,0,0,0,0,0,0,0,0,0,0,0,0,0,0,0,0,0
24,One variable that did however behave as expected was the restlessness of my sleep.,"['a1_to_be_past_was_were', 'a1_past_simple_reg']",0,0,0,0,0,0,0,0,1,0,0,0,0,0,0,0,0,0,1,0,0,0,0,0,0,0,0,0,0,0,0,0,0,0,0,0,0,0,0,0,0,0,0,0,0,0,0,0,0,0,0,0,0,0,0,0,0,0,0,0,0,0,0,0,0,0,0,0,0,0
25,And she tried to fix his ailing health with a vegan sandwich?,"['a1_personal_pronouns', 'a1_past_simple_reg', 'a2_to_non_finite_forms']",0,0,0,0,0,0,0,0,0,0,0,0,0,0,0,0,0,0,1,0,0,0,0,0,0,0,0,0,0,0,0,0,0,0,0,0,0,0,0,0,0,0,0,0,0,0,0,0,0,1,0,0,0,0,0,0,0,0,0,0,0,0,0,0,0,0,0,0,0,0
26,"And Atlantic-Heydt, who's the largest scaffolding contractor in the country, volunteered to do it at cost.","['a2_relative_clause_who_which_that', 'a1_superlative_short', 'a2_article_the', 'a1_past_simple_reg', 'a2_to_non_finite_forms', 'a1_countable_nouns']",0,0,0,0,0,1,0,0,0,0,0,0,0,0,0,0,0,0,1,0,0,0,0,0,0,0,0,0,0,0,0,0,0,0,0,0,0,0,0,0,0,0,0,0,0,0,0,0,1,1,0,0,0,0,0,0,0,0,0,0,0,0,0,0,0,0,0,0,0,0
27,You can't put your awkwardness with women all on your parents.,"['a1_can', 'a1_possessive_pronouns', 'a1_personal_pronouns']",0,0,0,0,0,0,0,0,0,0,0,0,0,0,1,0,0,0,0,0,0,0,0,0,0,0,0,0,0,0,0,0,0,0,0,0,0,0,0,0,0,0,0,0,0,0,0,0,0,0,0,0,0,0,0,0,0,0,0,0,0,0,0,0,0,0,0,0,0,0
28,That's why I've watched every episode of survivorman 40 times.,"['a2_present_perfect', 'a1_personal_pronouns']",0,0,0,0,0,0,0,0,0,0,0,0,0,0,0,0,0,0,0,0,0,0,0,0,0,0,0,0,0,0,0,0,0,0,0,0,0,0,0,0,0,1,0,0,0,0,0,0,0,0,0,0,0,0,0,0,0,0,0,0,0,0,0,0,0,0,0,0,0,0
29,She'd wear fucking robes to school and eat dried leaves for lunch,"['a1_plural_forms', 'a1_personal_pronouns']",0,0,0,0,0,0,0,0,0,0,0,0,0,0,0,0,0,0,0,0,0,0,0,0,0,0,0,0,0,0,0,0,0,0,0,0,0,0,0,0,0,0,0,0,0,0,0,0,0,0,0,0,0,0,0,0,0,0,0,0,0,0,0,0,0,0,0,0,0,0
30,"Open your browser's JavaScript console (right now, on this page) and set app.message to a different value.","['a2_imperatives', 'a2_article_a_an', 'a1_possesive_s_sing', 'a1_possessive_pronouns', 'a1_countable_nouns']",1,0,0,0,0,0,0,0,0,0,0,0,0,0,0,0,0,0,0,0,0,0,0,0,0,0,0,0,0,0,0,0,0,0,0,1,0,0,0,0,0,0,0,0,0,0,0,0,0,0,0,0,0,0,0,0,0,0,0,0,0,0,0,0,0,0,0,0,0,0
31,"There's also a toolbar button for Save All, an icon of two floppy disks, found beside the Save button.","['a1_there_is_am_are', 'a1_countable_nouns', 'a2_article_a_an', 'a1_plural_forms', 'a2_article_the']",0,0,0,0,0,0,0,0,0,0,0,0,1,0,0,0,0,0,0,0,0,0,0,0,0,0,0,0,0,0,0,0,0,0,0,0,0,0,0,0,0,0,0,0,0,0,0,0,0,0,0,0,0,0,0,0,0,0,0,0,0,0,0,0,0,0,0,0,0,0
32,"Try reinstalling the Visual C++ component in Visual Studio, or reinstall the Microsoft Visual C++ Build Tools.","['a2_imperatives', 'a2_article_the', 'a1_countable_nouns', 'a1_plural_forms', 'a2_ing_non_finite_forms']",0,0,0,0,0,0,0,0,0,0,0,0,0,0,0,0,0,0,0,0,0,0,0,0,0,0,0,0,0,0,0,0,0,0,0,1,0,0,0,0,0,0,0,0,0,0,0,0,0,0,1,0,0,0,0,0,0,0,0,0,0,0,0,0,0,0,0,0,0,0
33,"To complete this walkthrough, you must have installed either Visual Studio and the optional Desktop development with C++ workload, or the command-line Build Tools for Visual Studio.","['a2_must', 'a1_plural_forms', 'a2_article_the', 'a2_to_non_finite_forms', 'a1_countable_nouns']",0,0,0,0,0,0,0,0,0,0,0,0,0,0,0,0,0,0,0,0,0,0,0,0,0,0,0,0,0,1,0,0,0,0,0,0,0,0,0,0,0,0,0,0,0,0,0,0,0,1,0,0,0,0,0,0,0,0,0,0,0,0,0,0,0,0,0,0,0,0
34,"The HTML is our entry point, but everything else happens within the newly created Vue instance.","['a1_to_be_present_is_am_are', 'a1_present_simple_reg_act', 'a2_article_the', 'a1_possessive_pronouns']",0,0,0,0,0,0,0,0,0,1,0,0,0,0,0,1,0,0,0,0,0,0,0,0,0,0,0,0,0,0,0,0,0,0,0,0,0,0,0,0,0,0,0,0,0,0,0,0,0,0,0,0,0,0,0,0,0,0,0,0,0,0,0,0,0,0,0,0,0,0
35,The most you and Malfoy'll be able to do is send sparks at each other.,"['a2_article_the', 'a1_personal_pronouns', 'a2_will_be_able_to', 'a2_to_non_finite_forms', 'a1_plural_forms', 'a1_countable_nouns']",0,0,0,0,0,0,0,0,0,0,0,0,0,0,0,0,0,0,0,0,0,0,0,0,0,0,0,0,1,0,0,0,0,0,0,0,0,0,0,0,0,0,0,0,0,0,0,0,0,1,0,0,0,0,0,0,0,0,0,0,0,0,0,0,0,0,0,0,0,0
36,"Of course not, said Harry, eager to see more magic.","['a1_uncountable_nouns', 'a2_to_non_finite_forms']",0,0,0,0,0,0,0,0,0,0,0,0,0,0,0,0,0,0,0,0,0,0,0,0,0,0,0,0,0,0,0,0,0,0,0,0,0,0,0,0,0,0,0,0,0,0,0,0,0,1,0,0,0,0,0,0,0,0,0,0,0,0,0,0,0,0,0,0,0,0
37,"Shut up, Peeves - please - you'll get us thrown out.","['a1_future_simple', 'a2_imperatives', 'a1_personal_pronouns']",0,0,0,0,0,0,0,0,0,0,0,0,0,0,0,0,0,0,0,0,1,0,0,0,0,0,0,0,0,0,0,0,0,0,0,1,0,0,0,0,0,0,0,0,0,0,0,0,0,0,0,0,0,0,0,0,0,0,0,0,0,0,0,0,0,0,0,0,0,0
38,"With one last desperate look back at Ron, Harry and Hermione charged through the door and up the next passageway.","['a1_past_simple_reg', 'a1_countable_nouns']",0,0,0,0,0,0,0,0,0,0,0,0,0,0,0,0,0,0,1,0,0,0,0,0,0,0,0,0,0,0,0,0,0,0,0,0,0,0,0,0,0,0,0,0,0,0,0,0,0,0,0,0,0,0,0,0,0,0,0,0,0,0,0,0,0,0,0,0,0,0
39,Harry stuck his wand up its nose and Ron knocked it out with its own club.,"['a1_past_simple_reg', 'a1_possessive_pronouns', 'a1_countable_nouns']",0,0,0,0,0,0,0,0,0,0,0,0,0,0,0,0,0,0,1,0,0,0,0,0,0,0,0,0,0,0,0,0,0,0,0,0,0,0,0,0,0,0,0,0,0,0,0,0,0,0,0,0,0,0,0,0,0,0,0,0,0,0,0,0,0,0,0,0,0,0
40,I was there early along with a lone fisherman trying his luck.,"['a1_to_be_past_was_were', 'a2_article_a_an', 'a1_possessive_pronouns', 'a1_countable_nouns']",0,0,0,0,0,0,0,0,1,0,0,0,0,0,0,0,0,0,0,0,0,0,0,0,0,0,0,0,0,0,0,0,0,0,0,0,0,0,0,0,0,0,0,0,0,0,0,0,0,0,0,0,0,0,0,0,0,0,0,0,0,0,0,0,0,0,0,0,0,0
41,"His steady voice grates heavy on my ear, an ax that hurts so much that finally I ask him what's the point.","['a1_possessive_pronouns', 'a1_countable_nouns', 'a1_present_simple_reg_act', 'a1_to_be_present_is_am_are', 'a2_article_the', 'a2_article_a_an', 'a2_much_many_a_lot']",0,0,0,0,0,0,0,0,0,1,0,0,0,0,0,1,0,0,0,0,0,0,0,0,0,0,0,0,0,0,0,0,0,0,0,0,0,0,0,0,0,0,0,1,0,0,0,0,0,0,0,0,0,0,0,0,0,0,0,0,0,0,0,0,0,0,0,0,0,0
42,These fire roads were merely remnants of trails created to mend the fences that kept in cattle of generations past.,"['a1_plural_forms', 'a1_to_be_past_was_were', 'a1_past_simple_reg', 'a2_to_non_finite_forms', 'a1_past_simple_irreg', 'a1_countable_nouns']",0,0,0,0,0,0,0,0,1,0,0,0,0,0,0,0,0,0,1,1,0,0,0,0,0,0,0,0,0,0,0,0,0,0,0,0,0,0,0,0,0,0,0,0,0,0,0,0,0,1,0,0,0,0,0,0,0,0,0,0,0,0,0,0,0,0,0,0,0,0
43,"I've decided that I'm wearing red exclusively now, I poked back matter-of-factly.","['a2_present_perfect', 'a2_present_continuous_cafe', 'a1_past_simple_reg']",0,0,0,0,0,0,0,0,0,0,0,0,0,0,0,0,0,0,1,0,0,0,0,0,0,0,0,0,0,0,0,0,0,0,0,0,0,0,0,0,0,1,0,0,0,0,0,0,0,0,0,0,0,0,0,0,0,0,0,0,0,0,0,0,0,0,0,0,0,0
44,And I ate them up as fast as I could devour my sacks of Halloween loot every year.,"['a1_past_simple_irreg', 'a2_could', 'a1_possessive_pronouns', 'a1_personal_pronouns']",0,0,0,0,0,0,0,0,0,0,0,0,0,0,0,0,0,0,0,1,0,0,0,0,0,1,0,0,0,0,0,0,0,0,0,0,0,0,0,0,0,0,0,0,0,0,0,0,0,0,0,0,0,0,0,0,0,0,0,0,0,0,0,0,0,0,0,0,0,0
45,"You could aimlessly wander the streets or rely on word of mouth, but if you're less keen on clocking up the kilometres, there's a better way.","['a2_could', 'a2_zero_conditional_if_m', 'a1_there_is_am_are', 'a1_plural_forms', 'a1_to_be_present_is_am_are', 'a2_article_a_an', 'a2_article_the', 'a1_personal_pronouns']",0,0,0,0,0,0,0,0,0,1,0,0,1,0,0,0,0,0,0,0,0,0,0,0,0,1,0,0,0,0,0,0,0,0,0,0,0,0,0,0,0,0,0,0,0,0,0,0,0,0,0,0,0,0,0,0,0,0,0,0,0,0,0,0,1,0,0,0,0,0
46,"But my friend, Simon Singh, the particle physicist now turned science educator, who wrote the book The Big Bang, and so on, uses every chance he gets to promote good science.","['a1_possessive_pronouns', 'a2_article_the', 'a1_past_simple_irreg', 'a1_present_simple_reg_act', 'a2_to_non_finite_forms', 'a1_countable_nouns']",0,0,0,0,0,0,0,0,0,0,0,0,0,0,0,1,0,0,0,1,0,0,0,0,0,0,0,0,0,0,0,0,0,0,0,0,0,0,0,0,0,0,0,0,0,0,0,0,0,1,0,0,0,0,0,0,0,0,0,0,0,0,0,0,0,0,0,0,0,0
47,"The tau protein deposits found in Mirra's brain were indistinguishable from the kind that have been found in the brains of former football and hockey players with CTE, Dr Hazrati, the Toronto neuropathologist, told ESPN","['a1_past_simple_irreg', 'a1_possesive_s_sing', 'a2_passive_present_perf', 'a1_plural_forms', 'a1_countable_nouns', 'a2_article_the']",1,0,0,0,0,0,0,0,0,0,0,0,0,0,0,0,0,0,0,1,0,0,0,0,0,0,0,0,0,0,0,0,0,0,0,0,0,0,0,0,0,0,0,0,0,0,0,0,0,0,0,0,0,0,0,0,0,0,0,0,1,0,0,0,0,0,0,0,0,0
48,"Because in that highest age category of 76 to 85, as much as 40 percent of people have nothing really wrong with them.","['a1_present_simple_reg_act', 'a2_much_many_a_lot', 'a1_plural_forms']",0,0,0,0,0,0,0,0,0,0,0,0,0,0,0,1,0,0,0,0,0,0,0,0,0,0,0,0,0,0,0,0,0,0,0,0,0,0,0,0,0,0,0,1,0,0,0,0,0,0,0,0,0,0,0,0,0,0,0,0,0,0,0,0,0,0,0,0,0,0
49,I arrived thinking we were bringing freedom to Vietnamese people but as soon as I hit the ground I realised that wasn't happening.,"['a1_past_simple_reg', 'a2_past_continuous', 'a1_plural_forms', 'a1_past_simple_irreg']",0,0,0,0,0,0,0,0,0,0,0,0,0,0,0,0,0,0,1,1,0,0,0,0,0,0,0,0,0,0,0,0,0,0,0,0,0,0,0,1,0,0,0,0,0,0,0,0,0,0,0,0,0,0,0,0,0,0,0,0,0,0,0,0,0,0,0,0,0,0
50,"And the cancer, the body is saying the lung tissue is damaged, we need to repair the lung.","['a2_article_the', 'a1_present_continuous_act_rn', 'a2_passive_present_simple', 'a2_to_non_finite_forms', 'a1_countable_nouns', 'a1_present_simple_reg_act']",0,0,0,0,0,0,0,0,0,0,0,0,0,0,0,1,0,1,0,0,0,0,0,0,0,0,0,0,0,0,0,0,0,0,0,0,0,0,0,0,0,0,0,0,0,0,0,0,0,1,0,0,0,0,0,0,0,0,1,0,0,0,0,0,0,0,0,0,0,0
51,Each round of dispute with the Khan family only served to reinforce the criticism that he had sacrificed nothing.,"['a1_past_simple_reg', 'a2_to_non_finite_forms', 'a2_past_perfect_basic', 'a1_personal_pronouns', 'a2_narrative_tenses', 'a1_countable_nouns']",0,0,0,0,0,0,0,0,0,0,0,0,0,0,0,0,0,0,1,0,0,0,0,0,0,0,0,0,0,0,0,0,0,0,0,0,0,0,0,0,1,0,1,0,0,0,0,0,0,1,0,0,0,0,0,0,0,0,0,0,0,0,0,0,0,0,0,0,0,0
52,And what I've spent 15 years doing in this business - and it's taken me almost 14 to figure it out - is I think about the future of wars in the context of everything else.,"['a2_present_perfect', 'a2_to_non_finite_forms', 'a1_present_simple_reg_act', 'a2_article_the']",0,0,0,0,0,0,0,0,0,0,0,0,0,0,0,1,0,0,0,0,0,0,0,0,0,0,0,0,0,0,0,0,0,0,0,0,0,0,0,0,0,1,0,0,0,0,0,0,0,1,0,0,0,0,0,0,0,0,0,0,0,0,0,0,0,0,0,0,0,0
53,"There is also plenty of speculation about the future of Durant, who will soon be a free agent.","['a1_there_is_am_are', 'a1_to_be_future_will_be', 'a2_article_a_an', 'a1_countable_nouns', 'a2_article_the', 'a2_relative_clause_who_which_that']",0,0,0,0,0,0,0,0,0,0,1,0,1,0,0,0,0,0,0,0,0,0,0,0,0,0,0,0,0,0,0,0,0,0,0,0,0,0,0,0,0,0,0,0,0,0,0,0,1,0,0,0,0,0,0,0,0,0,0,0,0,0,0,0,0,0,0,0,0,0
54,"If you really look at the power of exponential growth, you'll see that these things are pretty soon at hand.","['a2_first_conditional_if_m', 'a1_future_simple', 'a1_present_simple_reg_act', 'a2_article_the', 'a1_personal_pronouns', 'a1_to_be_present_is_am_are']",0,0,0,0,0,0,0,0,0,1,0,0,0,0,0,1,0,0,0,0,1,0,0,0,0,0,0,0,0,0,0,0,0,0,0,0,0,0,0,0,0,0,0,0,0,0,0,0,0,0,0,0,0,0,0,0,0,0,0,0,0,0,0,0,0,0,1,0,0,0
55,But I'll also have to pay rent and my light bill is due.,"['a1_to_be_present_is_am_are', 'a2_will_have_to', 'a1_possessive_pronouns', 'a1_personal_pronouns']",0,0,0,0,0,0,0,0,0,1,0,0,0,0,0,0,0,0,0,0,0,0,0,0,0,0,0,0,0,0,0,0,1,0,0,0,0,0,0,0,0,0,0,0,0,0,0,0,0,0,0,0,0,0,0,0,0,0,0,0,0,0,0,0,0,0,0,0,0,0
56,"For what seemed like 15 minutes, we were in a maelstrom, no visibility, but then it passed.","['a1_past_simple_reg', 'a1_to_be_past_was_were', 'a2_article_a_an', 'a1_personal_pronouns']",0,0,0,0,0,0,0,0,1,0,0,0,0,0,0,0,0,0,1,0,0,0,0,0,0,0,0,0,0,0,0,0,0,0,0,0,0,0,0,0,0,0,0,0,0,0,0,0,0,0,0,0,0,0,0,0,0,0,0,0,0,0,0,0,0,0,0,0,0,0
57,"The policy is perfectly clear about this, and I was already pushing it by calling in nine consecutive days.","['a2_article_the', 'a1_to_be_present_is_am_are', 'a2_past_continuous', 'a1_plural_forms']",0,0,0,0,0,0,0,0,0,1,0,0,0,0,0,0,0,0,0,0,0,0,0,0,0,0,0,0,0,0,0,0,0,0,0,0,0,0,0,1,0,0,0,0,0,0,0,0,0,0,0,0,0,0,0,0,0,0,0,0,0,0,0,0,0,0,0,0,0,0
58,"If we are going to elect a woman, and I'm all for it, by the way, it needs to be because of her political track record.","['a2_zero_conditional_if_m', 'a2_is_am_are_going_to', 'a2_to_non_finite_forms', 'a1_to_be_present_is_am_are', 'a1_present_simple_3d_pers', 'a1_countable_nouns', 'a1_personal_pronouns']",0,0,0,0,0,0,0,0,0,1,0,0,0,0,0,0,1,0,0,0,0,0,0,0,0,0,0,0,0,0,0,0,0,0,0,0,0,1,0,0,0,0,0,0,0,0,0,0,0,1,0,0,0,0,0,0,0,0,0,0,0,0,0,0,1,0,0,0,0,0
59,"If you prefer something more interactive, you can also check out this tutorial series on Scrimba, which gives you a mix of screencast and code playground that you can pause and play around with anytime.","['a2_first_conditional_if_m', 'a1_can', 'a1_comparative_long', 'a2_relative_clause_who_which_that', 'a1_present_simple_3d_pers', 'a1_personal_pronouns', 'a1_plural_forms', 'a2_article_a_an', 'a1_countable_nouns']",0,0,0,1,0,0,0,0,0,0,0,0,0,0,1,0,1,0,0,0,0,0,0,0,0,0,0,0,0,0,0,0,0,0,0,0,0,0,0,0,0,0,0,0,0,0,0,0,1,0,0,0,0,0,0,0,0,0,0,0,0,0,0,0,0,0,1,0,0,0
60,"Moreover, Vue also provides a powerful transition effect system that can automatically apply transition effects when elements are inserted/updated/removed by Vue.","['a1_present_simple_3d_pers', 'a1_can', 'a2_passive_present_simple', 'a2_article_a_an', 'a1_plural_forms']",0,0,0,0,0,0,0,0,0,0,0,0,0,0,1,0,1,0,0,0,0,0,0,0,0,0,0,0,0,0,0,0,0,0,0,0,0,0,0,0,0,0,0,0,0,0,0,0,0,0,0,0,0,0,0,0,0,0,1,0,0,0,0,0,0,0,0,0,0,0
61,A model can utilize a fork TorchScript primitive to launch an asynchronous task.,"['a2_article_a_an', 'a1_can', 'a2_to_non_finite_forms', 'a1_countable_nouns']",0,0,0,0,0,0,0,0,0,0,0,0,0,0,1,0,0,0,0,0,0,0,0,0,0,0,0,0,0,0,0,0,0,0,0,0,0,0,0,0,0,0,0,0,0,0,0,0,0,1,0,0,0,0,0,0,0,0,0,0,0,0,0,0,0,0,0,0,0,0
62,All uses of BNF in the next chapter ( Lexical Analysis ) are lexical definitions; uses in subsequent chapters are syntactic definitions.,"['a1_to_be_present_is_am_are', 'a1_plural_forms', 'a1_countable_nouns']",0,0,0,0,0,0,0,0,0,1,0,0,0,0,0,0,0,0,0,0,0,0,0,0,0,0,0,0,0,0,0,0,0,0,0,0,0,0,0,0,0,0,0,0,0,0,0,0,0,0,0,0,0,0,0,0,0,0,0,0,0,0,0,0,0,0,0,0,0,0
63,But how can I look without Quirrell realizing what I'm up to?,"['a1_special_questions', 'a1_to_be_present_is_am_are', 'a1_can', 'a1_personal_pronouns']",0,0,0,0,0,0,0,0,0,1,0,0,0,0,1,0,0,0,0,0,0,0,0,0,1,0,0,0,0,0,0,0,0,0,0,0,0,0,0,0,0,0,0,0,0,0,0,0,0,0,0,0,0,0,0,0,0,0,0,0,0,0,0,0,0,0,0,0,0,0
64,"Once term had started, they were back to skimming through books for ten minutes during their breaks.","['a2_past_perfect_basic', 'a1_to_be_past_was_were', 'a1_plural_forms', 'a1_personal_pronouns', 'a1_countable_nouns']",0,0,0,0,0,0,0,0,1,0,0,0,0,0,0,0,0,0,0,0,0,0,0,0,0,0,0,0,0,0,0,0,0,0,0,0,0,0,0,0,0,0,1,0,0,0,0,0,0,0,0,0,0,0,0,0,0,0,0,0,0,0,0,0,0,0,0,0,0,0
65,"I'd like to see your mom and dad, Ron said eagerly.","['a1_want_would_like_to', 'a1_possessive_pronouns', 'a2_say_reported_verb']",0,0,0,0,0,0,0,0,0,0,0,0,0,0,0,0,0,0,0,0,0,1,0,0,0,0,0,0,0,0,0,0,0,0,0,0,0,0,0,0,0,0,0,0,0,0,0,0,0,0,0,0,0,0,0,1,0,0,0,0,0,0,0,0,0,0,0,0,0,0
66,"He couldn't know that at this very moment, people meeting in secret all over the country were holding up their glasses and saying in hushed voices:","['a2_could', 'a2_past_continuous', 'a1_plural_forms', 'a1_possessive_pronouns', 'a1_uncountable_nouns', 'a2_article_the']",0,0,0,0,0,0,0,0,0,0,0,0,0,0,0,0,0,0,0,0,0,0,0,0,0,1,0,0,0,0,0,0,0,0,0,0,0,0,0,1,0,0,0,0,0,0,0,0,0,0,0,0,0,0,0,0,0,0,0,0,0,0,0,0,0,0,0,0,0,0
67,Harry didn't think there was anything wrong with not being able to afford an owl.,"['a1_past_simple_reg', 'a1_there_was_were', 'a2_to_non_finite_forms', 'a2_article_a_an', 'a1_countable_nouns']",0,0,0,0,0,0,0,0,0,0,0,1,0,0,0,0,0,0,1,0,0,0,0,0,0,0,0,0,0,0,0,0,0,0,0,0,0,0,0,0,0,0,0,0,0,0,0,0,0,1,0,0,0,0,0,0,0,0,0,0,0,0,0,0,0,0,0,0,0,0
68,"She hacked a long, serious cough and spat into the leaves.","['a1_past_simple_reg', 'a1_plural_forms', 'a1_personal_pronouns', 'a2_article_the', 'a1_past_simple_irreg']",0,0,0,0,0,0,0,0,0,0,0,0,0,0,0,0,0,0,1,1,0,0,0,0,0,0,0,0,0,0,0,0,0,0,0,0,0,0,0,0,0,0,0,0,0,0,0,0,0,0,0,0,0,0,0,0,0,0,0,0,0,0,0,0,0,0,0,0,0,0
