sent,type
"Well, I probably wouldn't like him.",a1_want_would_like_to
He wouldn't like us going to his basement.,a1_want_would_like_to
I wouldn't like to be the woman you cut in half.,a1_want_would_like_to
"I wouldn't like that, and neither would my daughter.",a1_want_would_like_to
I don't want any special treatment.,a1_want_would_like_to
I don't want a producer editing what he says.,a1_want_would_like_to
Plus you don't want me anymore.,a1_want_would_like_to
You don't want me to free vera.,a1_want_would_like_to
And she doesn't want contact with me.,a1_want_would_like_to
He doesn't want to settle.,a1_want_would_like_to
Someone doesn't want you to remember.,a1_want_would_like_to
