source_text,level,link,name,metadata
"The Grand Canyon, one of the Seven Wonders of the Natural World, is located in the state of Arizona. It is also a UNESCO World Heritage Site. Formed by over 70 million years of erosion from the Colorado River, the Grand Canyon offers a spectacular view. The canyon spans 277 miles in length, up to 18 miles in width, and it measures over a mile in depth at its deepest points. Carlos always wanted to visit the Grand Canyon, and recently he received the chance to hike some of the trails and take several panoramic photographs during his visit. When Carlos arrived at the visitor center, he watched a brief movie that taught tourists about the Grand Canyon National Park and the geological history of the canyons formation. Later, Carlos followed a hiking trail to become even further acquainted with the canyon. While walking through the trails, Carlos saw some tourists riding donkeys to traverse the canyons ridges. Throughout his hiking expedition, Carlos used a map to find some of the best hot spots for photographs within the canyon. He revisited some areas at different points in the day because sun angles and lighting can make a big difference in the quality of a photo. Carlos was very pleased that he got to travel to the Grand Canyon. He loves hiking and photography, so this was the perfect outdoor experience for him. He posted all of his best pictures on social media, and his friends were amazed by his breathtaking, panoramic shots.",B1,https://lingua.com/english/reading/grand-canyon/,lingua,{'title': 'The Grand Canyon'}
"Stephanie recently took a weekend trip to Los Angeles, California. Los Angeles is a coastal city situated along the Pacific Ocean. Many celebrities earned their claim to fame here. Although the town offers many attractions centered around Hollywood culture, there is a lot to see and visit in Los Angeles. Of course, all things related to Hollywood are popular tourist attractions. The Hollywood Sign, located the Hollywood Hills of the Santa Monica Mountains, is a famous landmark for this star-studded town. Once in downtown Hollywood, its possible to take a stroll along the Hollywood Walk of Fame. This landmark contains more than 2500 brass stars dedicated to celebrities who have made a significant impact on the entertainment industry. In Hollywood, visitors can even take tours of popular movie studios. Stephanie had a chance to visit Universal Studios, which produces her favorite films. Los Angeles is also a popular beach town, offering plenty of opportunities for sunbathing and surfing. A common beach destination is the Santa Monica Pier, which offers rides and attractions to its visitors. Here, Stephanie rode the iconic Ferris wheel, which offered her a spectacular view of the city and coast. These are just some of the things Stephanie experienced during her visit to Los Angeles. She loved her trip, and she hopes to return someday soon.",B1,https://lingua.com/english/reading/los-angeles/,lingua,{'title': 'Los Angeles'}
"Halloween (also referred to as All Hollows' Eve) is a holiday that's celebrated in America on 31 October of each year, regardless of what day of the week this date falls on. Although it is rooted in religion, Halloween today is enjoyed mainly because of its decorations, costumes, candy, treats, and general excitement, and furthermore, it is enjoyed by most everyone. Before Halloween, many individuals carve a design into an orange-colored pumpkin, or a solid, durable vegetable. Once a personally satisfying design is carved, a lit candle is typically put inside a pumpkin, thereby making it a Jack-O-Lantern. At night, this design lights up against the darkness. Besides carving pumpkins, some celebrate Halloween by putting decorations up. Supernatural (referring in this case to non-natural creatures that're typically based in fiction) figures, including vampires, ghosts, werewolves, zombies, and more, generally account for most of these decorations. Bugs, spiders, cobwebs, gravestones, and anything else that can be considered creepy (or unusual and possibly scary) can also be found on Halloween, in decoration form. Only some adults celebrate Halloween, and they generally do so by attending parties. Inversely, the vast majority of children dress in costume (Halloween costumes can be based upon anything, from the mentioned supernatural creatures to the stars of today's films) and walk from door to door in search of candy—a practice known as trick or treat—on Halloween. After knocking on a door (houses that participate in Halloween usually leave a light on), one says, ""Trick or Treat"" and a piece (or pieces!) of candy is given to him or her.",B1,https://lingua.com/english/reading/halloween/,lingua,{'title': 'Halloween'}
"Last April, John took a trip to Las Vegas, Nevada. Las Vegas is a popular destination in the western portion of the United States. The town is most popular for its casinos, hotels, and exciting nightlife. In downtown Las Vegas, John spent a lot of time on The Strip, which is a 2.5 mile stretch of shopping, entertainment venues, luxury hotels, and fine dining experiences. This is probably the most commonly visited tourist area in the city. The Strip at night looks especially beautiful. All of the buildings light up with bright, neon, eye-catching signs to attract visitor attention. A stay in Las Vegas can feel similar to a visit to many popular cities worldwide. Many of the hotels have miniature versions of important international sites and monuments. These famous landmarks include the Eiffel Tower, Venice, and even ancient Rome. One day, John took a side trip outside of the city to visit the Grand Canyon, one of the Seven Wonders of the Natural World. The canyon offers a breathtaking view of Nevadas ridges and natural landscape. John especially liked the canyon because it was removed from all of the noise and movement in downtown Las Vegas. John had a great time during his trip to Las Vegas. He did not win a lot of money in the casinos. However, he managed to see a lot of amazing sites during his visit to this city that never sleeps.",B2,https://lingua.com/english/reading/las-vegas/,lingua,{'title': 'Las Vegas'}
"It goes without saying that humans (mammals identifiable as those that stand upright and are comparatively advanced and capable of detailed thought) have pretty remarkable bodies, given all that they've accomplished. (Furthermore, an especially intelligent human brain produced this text!) To be sure, humans have overcome predators, disease, and all sorts of other obstacles over thousands of years. To fully understand and appreciate these accomplishments, let's take at some of the most well-known parts of the human body! The head, or the spherical body part that contains the brain and rests at the top of the human body, has quite a few individual organs and body parts on it. (It should quickly be mentioned that hair occupies the space on top of the head, and the ears, the organs responsible for hearing, are located on either side of the head.) From top to bottom, the eyebrows, or horizontal strips of hair that can be found above the eye, are the first components of the head. The eyes are below them, and are round, orb-like organs that allow humans to see. The eyes make way for the nose, or an external (sticking-out) organ that plays an important part in the breathing and bacteria-elimination processes. Below that is the mouth, or a wide, cavernous organ that chews food, removes bacteria, helps with breathing, and more. The mouth contains teeth, or small, white-colored, pointed body parts used to chew food, and the tongue, or a red-colored, boneless organ used to chew food and speak. The neck is the long body part that connects the head to the chest (the muscular body part that protects the heart and lungs), and the stomach, or the part of the body that contains food and liquid-processing organs, comes below that. The legs are the long, muscular body parts that allow humans to move from one spot to another and perform a variety of actions. Each leg contains a thigh (a thick, especially muscular body part used to perform strenuous motions; the upper part of the leg) and a calf (thinner, more flexible body part that absorbs the shock associated with movement; the lower part of the leg). Feet can be found at the bottom of legs, and each foot is comprised of five toes, or small appendages that help balance. Arms are long, powerful body parts that are located on either side of chest, below the shoulders;arms are comprised of biceps (the thicker, more powerful upper portion), and forearms (the thinner, more flexible lower portion). Hands, or small, gripping body parts used for a tremendous number of actions, are at the end of arms. Each hand contains five fingers, or small appendages used to grip objects. The aforementioned shoulders are rounded body parts that aid arms' flexibility. One's back is found on the opposite side of the stomach, and is a flat section of the body that contains important muscles that're intended to protect the lungs and other internal organs, in addition to helping humans perform certain motions and actions.",B2,https://lingua.com/english/reading/body-parts/,lingua,{'title': 'Human body parts and organs'}
