source_text,level,link,name,metadata
"London is a famous and historic city. It is the capital of England in the United Kingdom. The city is quite popular for international tourism because London is home to one of the oldest-standing monarchies in the western hemisphere. Rita and Joanne recently traveled to London. They were very excited for their trip because this was their first journey overseas from the United States. Among the popular sights that Rita and Joanne visited are Big Ben, Buckingham Palace, and the London Eye. Big Ben is one of Londons most famous monuments. It is a large clock tower located at the northern end of Westminster Palace. The clock tower is 96 meters tall. Unfortunately, Rita and Joanne were only able to view the tower from the outside. The women learned that the towers interior is undergoing renovations until 2021. Fortunately, the London Eye, the citys famous Ferris wheel, was open to the public. The London Eye is situated along the southern shores of the Thames River. This attraction stands 135 meters high. It is one of Londons most well-known spots for gaining aerial views of the city. Each capsule of the Ferris wheel can hold up to 25 passengers. When their capsule stopped at the top of the Ferris wheel, the women took spectacular panoramic photographs of the beautiful cityscape below. The last place that Rita and Joanne visited was Buckingham Palace, the home of the Queen of England. The women were impressed by the palaces incredible architecture and historical value. Both Rita and Joanne enjoyed watching the Queens guards outside the palace. These guards wore red tunic uniforms, shiny black boots, and bearskin hats. Despite the womens attempts to catch the attention of the guards, the guards are specifically trained to avoid distractions. Because of this, the guards ignored the women completely. Joanne and Rita had an amazing time visiting the city of London, and they are inspired to seek more international travel destinations in the future.",B1,https://lingua.com/english/reading/london/,lingua,{'title': 'London'}
"In June, Diane visited her friends who live in San Francisco, California. This was Dianes first time in the city, and she enjoyed her opportunities to walk around and explore. On the first day of her trip, Diane visited the Golden Gate Bridge. This red suspension bridge measures 1.7 miles in length. Diane and her friends did not walk across the bridge. However, they viewed it from the Golden Gate National Recreation Area, which offers hiking trails, picnicking areas, and presents spectacular views of the bridge and city. Diane and her friends made sure to take a group photograph here, featuring the bridge in the background. The next day, Diane and her friends visited Alcatraz Island. This island is located 1.25 miles offshore in the San Francisco Bay. It used to serve as a lighthouse, military fort, and prison. Diane and her friends took a small tour boat across bay to reach the island. Their visit included a guided tour through the old military base and prison. They also took a walk around the island to appreciate some of the native wildlife in addition to the views of the city. Diane and her friends spent the final day of her vist in San Franciscos downtown area. Dianes favorite part of her entire trip was taking a trolley to transport her up and down the hilly streets of San Francisco. Diane did a lot of shopping downtown on her last day. She and her friends celebrated the end of her visit by having dinner at one of San Franciscos best restaurants.",B1,https://lingua.com/english/reading/san-francisco/,lingua,{'title': 'San Francisco'}
"When exploring New York City, there are several different options for activities during a day trip. Some visitors come to see a show, visit art museums, or simply to shop in many of the citys high-end retailers. However, many tourists simply come to New York City for the sightseeing. One of the most visited landmarks in New York City is the Empire State Building. The Empire State Building, constructed in 1931, is a 102-story skyscraper, the ninth highest building in the world, and the fourth tallest structure in the United States. It is located in Midtown, Manhattan. This skyscraper is an iconic symbol of the city, having been featured in over 90 popular movies (as of 2018) throughout film history. Tourists come from all over the world to visit this building and view the city from its famous observation decks. Matthew, an enthusiast of historic buildings, was excited for this trip to New York City because he has always appreciated architectural design. Matthew purchased a ticket that granted him access to beautiful 360-degree views of the city. The ticket included an elevator ride that stopped at two different vantage points, one at the 86th floor and the other at the rooftop observatory on the 102nd floor. From these observation decks, Matthew took incredible photographs of the entire New York City skyline. The rooftop views granted Matthew perfect aerial perspectives of Central Park, the Brooklyn Bridge, Times Square, the Statue of Liberty, and many other important city landmarks.",B1,https://lingua.com/english/reading/empire-state-building/,lingua,{'title': 'The Empire State Building'}
"Receptionist: Good afternoon! This is Capitol Hotels in Washington, D.C. How may I help you?  Mr. Abrams: Hi, Id like to schedule a reservation for this upcoming weekend from Friday night until Sunday.  Receptionist: Sure! Let me check and see what rooms are available. Do you need a room with one bed or two?  Mr. Abrams: My wife and I will be visiting the city, but a room with one bed will be just fine.  Receptionist: Alright... It looks like we have several rooms available. Would you care for a room with a balcony?  Mr. Abrams: A single room with no balcony will suit our needs just fine. I did notice on your website that you have a pool and an exercise room. Are these facilities available for all hotel guests?  Receptionist: Yes, all hotel guests are allowed access to those facilities. The hotel stay also includes breakfast. We have a restaurant on-site that also serves lunch and dinner, but those meals are not included in your lodging fee.  Mr. Abrams: Okay, thats fine. What time are both check-in and check-out?  Receptionist: Check-in for you on Friday can be any time after 3:00 p.m. Check-out will be on Sunday before noon.  Mr. Abrams: Sounds great!  Receptionist: I am glad that I could help you today. Is there anything else that you need at this point in time?  Mr. Abrams: Would you like my credit card information now, or can I take care of that upon my arrival to the hotels reception desk?  Receptionist: We can handle payment upon your arrival on Friday. We look forward to seeing you then!  Mr. Abrams: Thank you! I look forward to my stay.  Receptionist: Enjoy the rest of your week!",B1,https://lingua.com/english/reading/hotel-reservation/,lingua,{'title': 'Hotel Reservation'}
"Yesterday, Stephen returned from a trip to Washington, D.C., the capital of the United States. His visit took place during the week prior to the Fourth of July. Logically, there were many activities and celebrations in town in preparation for Independence Day. During his stay in the city, Stephen visited a lot of important historical sites and monuments, and he left with a deeper understanding of the political history of the United States. Stephen spent a lot of time outdoors exploring the important monuments surrounding Capitol Hill. Of course, he saw the White House from its outside gate at 1600 Pennsylvania Avenue. Stephen also visited the Washington Monument, the Jefferson Memorial, and the Lincoln Memorial. These statues and pavilions are dedicated to former U.S. presidents. They commemorate the contributions that these leaders made throughout American history. Washington, D.C. also has several war memorials dedicated to fallen soldiers during the major wars of the 20th century. Away from the Capitol Hill area, Washington, D.C. has many museums and art galleries worth visiting. Stephen enjoyed his visit to Washington, D.C. because he learned a lot more about American history after touring each important landmark.",B1,https://lingua.com/english/reading/washington/,lingua,"{'title': 'Washington, D.C.'}"
"Christina visited Miami during her winter vacation. She is from Boston, where it is cold during the winter months. Miami, however, has a very warm climate. There are many sunny days in Miami, and people can go to the beach all year long. Christina spent a good portion of her trip on the beach to relax and sunbathe. However, she also explored Miami and its surroundings. Inspired by Miamis proximity to the ocean, Christina visited the Miami Seaquarium to learn about marine life. There, she watched a show using trained dolphins, killer whales, and other aquatic mammals. She took a lot of pictures of the sea creatures jumping out of the water and performing tricks. Christina also took an excursion to the Everglades National Park. This park is a protected area spanning 1.5 million acres. Because the park is mostly swampland, it is home to many reptiles. Native animals include snakes, alligators, and crocodiles. The park is also great for birdwatching. Christina enjoyed hiking the trails in the Everglades and observing the wildlife in its natural environment. When Christina returned to the city, she visited Little Havana. This is Miamis Cuban neighborhood. Christina could see that Little Havanas people demonstrated a lot of pride for their Cuban heritage. There were many outdoor shops and vendors, live musicians, and the Cuban cuisine was delicious. Little Havana was Christinas favorite part about her trip to Miami. This neighborhood made Christina feel like she had traveled to Cuba without ever having to leave the United States.",B1,https://lingua.com/english/reading/miami/,lingua,{'title': 'Miami'}
"My job is a long distance from my home, almost 50 miles away. I have to wake up early every morning, as Im always in a rush. Theres never enough time for a relaxed breakfast. At exactly 6:00 AM, I get into my car and start the long drive.   I usually like driving on the highway more than in the city. During the morning rush hour, though, its not very enjoyable. The heavy traffic is a little bit annoying. So I always listen to my favorite classical music CDs in the car – Chopin, Mozart, and Bach. That cheers me up a lot.   The drive to work takes about one hour. Going back home in the evening after work takes even longer, maybe around 70 minutes. Lately Ive been thinking about trying to take the train to work instead of driving. That way, I could still listen to my music with headphones, and even read a novel at the same time.",B1,https://lingua.com/english/reading/going-to-work/,lingua,{'title': 'Going to work in the morning'}
"A Christian holiday signifying the birth of Jesus, Christmas is widely celebrated and enjoyed across the United States and the world. The holiday always falls on 25 December (regardless of the day of the week), and is typically accompanied by decorations, presents, and special meals. Specifically, the legend behind Christmas (and the one that most children are told) is that Santa Claus, a bearded, hefty, jolly, and red-jacket-wearing old man who lives in the North Pole, spends the year crafting presents with his elves, or small, festive, excited Santa-assistants. All the children who behave throughout the year are admitted to the Good List, and will presumably receive their desired gifts on Christmas, while those who don't behave are placed on the Naughty List, and will presumably (although the matter is determined by parents) receive a lump of coal. Santa Claus is said to fly around the Christmas sky in a sled powered by his magical reindeer, or cold-resistant, mythically powered, individually named animals, delivering presents to each child's house in the process. Santa is also expected to slide through chimneys to deliver these presents (homes not equipped with chimneys might ""leave the front door cracked open""), and children sometimes arrange cookies or other treats on a plate for him to enjoy. Gifts are placed underneath a Christmas tree, or a pine tree that's decorated with ornaments and/or lights and is symbolic of the holiday. Additionally, smaller gifts may be placed inside a stocking, or a sock-shaped, holiday-specific piece of fabric that's generally hung on the mantle of a fireplace (homes without fireplaces might use the wall). A Christmas tree's ornaments, or hanging, typically spherical decorations, in addition to the mentioned lights, may be accompanied by a star, or a representation of the Star of Jerusalem that the Three Apostles followed while bringing Baby Jesus gifts and honoring him, in the Bible.",B1,https://lingua.com/english/reading/christmas/,lingua,{'title': 'Christmas'}
"As has been the case for many years, jobs, or forms of employment wherein employees perform a service or duty in exchange for financial compensation, play a prominent role in society. Furthermore, all jobs—even those of seemingly little significance—are important, as they simply wouldn't exist if their specific responsibilities weren't of value to employers (companies or persons that pay others for their work), customers (individuals who pay money for a product or service), and the economy generally. Teachers, or educational professionals tasked with helping students understand certain subjects and topics, are especially crucial today. In short, teachers help their students to become qualified for their future careers. Doctors, or medical professionals who specialize in providing health-related assistance to patients, are some of the most respected individuals in America and the world. It's the responsibility of doctors to help those who feel less-than-stellar to determine the underlying health issue(s) and recommend an effective treatment (or remedy to a disease, disorder, or condition). There are quite a few types of specialty doctors in America (besides MD, which simply means ""medical doctor""), all of whom can be referred to simply as ""Doctor (Name)."" Dentists (mouth/teeth doctors), dermatologists (skin doctors), and psychiatrists (mental-health doctors) are just a few examples of the many different types of doctors. Additionally, nurses are medical professionals who help to administer doctor-ordered treatments to patients. Police officers are law enforcement professionals whose job it is to protect citizens, solve crimes, and assure that rules and regulations are followed. Similarly, firefighters serve the public by responding to fires (and other emergency situations) and using high-tech equipment to extinguish these fires, while bringing any individuals who're in danger to safety. Farmers maintain fields of crops (or vegetable/fruit plants) and/or collections of animals with the intention of selling these products as food. Chefs/cooks prepare meals in professional settings, including restaurants, cafeterias, and other venues wherein food and drink are sold, for customers. Chefs are generally experienced in cooking and managing kitchens. Waiters bring menus, beverages, meals, and ultimately, the check (or a bill of the foods and drinks purchased in a transaction) to tables in restaurants and other establishments that serve food. Artists produce art, or works of creative significance, including music, paintings, drawings, poetry, writing, and more.",B1,https://lingua.com/english/reading/jobs/,lingua,{'title': 'Jobs and Professions'}
"Keith recently came back from a trip to Chicago, Illinois. This midwestern metropolis is found along the shore of Lake Michigan. During his visit, Keith spent a lot of time exploring the city to visit important landmarks and monuments. Keith loves baseball, and he made sure to take a visit to Wrigley Field. Not only did he take a tour of this spectacular stadium, but he also got to watch a Chicago Cubs game. In the stadium, Keith and the other fans cheered for the Cubs. Keith was happy that the Cubs won with a score of 5-4. Chicago has many historic places to visit. Keith found the Chicago Water Tower impressive as it is one of the few remaining landmarks to have survived the Great Chicago Fire of 1871. Keith also took a walk through Jackson Park, a great outdoor space that hosted the Worlds Fair of 1892. The park is great for a leisurely stroll, and it still features some of the original architecture and replicas of monuments that were featured in the Worlds Fair. During the last part of his visit, Keith managed to climb the stairs inside of the Willis Tower, a 110-story skyscraper. Despite the challenge of climbing the many flights of stairs, Keith felt that reaching the top was worth the effort. From the rooftop, Keith received a gorgeous view of the citys skyline with Lake Michigan in the background.",B1,https://lingua.com/english/reading/chicago/,lingua,{'title': 'Chicago'}
"The four seasons are spring, summer, fall, and winter, and although various areas of the United States experience drastically different weather during these times, all portions of the country recognize the seasons; winter in California may bring heat, and winter in New York may bring blizzards, but both periods are nevertheless winter. Following winter, spring begins on 20 March and ends on either 20 June or 21 June, in the United States (this date may vary slightly from year to year and hemisphere to hemisphere). For most, spring is a time of ""thawing,"" when the cold and snow of the winter are replaced by sunshine, reasonable temperatures, green grass, and more. It is also the season wherein previously dormant bees and butterflies reemerge, and when birds become more active. Summer follows spring and spans from about 21 June to 22 September, in America. Summer is the warmest, the longest, and (arguably) the liveliest of the four seasons; students from kindergarten to college are given two or so summer months off from class, and to be sure, there are more young individuals out and about during this season than any other. It's not uncommon to see shorts, t-shirts, and sunglasses worn by those who're soaking up the summer's hot sun, and to stay cool, many individuals crank the air conditioning, take a dip in a swimming pool, and/or explore the ever-comforting ocean waves. Autumn (or fall), more than being a simple precursor to winter, is one of the most beautiful and exciting seasons. Spanning from 22 September to 21 December (technically, that is; snow will begin to fall long before this latter date, in most parts of the country, leading many to classify the period as winter) in the US, autumn is characterized by falling leaves, Halloween (on 31 October), and Thanksgiving. During fall, traditional farmers harvest their produce, and the aforementioned falling leaves change to gorgeous orange, red, and yellow colors; these colors are generally associated with autumn itself, in turn. In the US, winter spans from 21 December to 20 March, and is, as one would expect, the coldest of the four seasons. In the eastern, northern, and central portions of the country, winter snowfall can be considerable; in the western and southern portions of the country, winter snowfall is highly unlikely, but temperatures nevertheless drop from their usual. Winter is most widely known for its snow and the Christmas holiday, but it also boasts New Year's Eve (on December 31, in recognition of the start of a new year) and other special days. Ice skating, sledding, ice hockey, and snowball fights are commonly enjoyed winter activities.",B1,https://lingua.com/english/reading/seasons/,lingua,{'title': 'The four seasons'}
"Thanksgiving is a holiday celebrated predominantly in North America, and it possesses a different meaning in each of the countries where it's acknowledged. In the United States, Thanksgiving is a federal holiday (meaning all government employees and most private employees are given a day off of work), and always takes places on the Fourth Thursday in November, regardless of the date. The holiday signifies the immense progress made by pilgrims, or some of the first travelers to North America, at Plymouth Plantation circa 1621. It was at this time that the hungry and weary Pilgrims were taught (by Native Americans) how to grow and produce food on North America's unique terrain. Once they'd grown (and caught) an abundance of food, the Pilgrims were expectedly thankful, and they celebrated alongside the Native Americans who provided them with such valuable assistance. President Abraham Lincoln initiated the contemporary practice of Thanksgiving by calling for a ""day of Thanksgiving"" during one of his Civil War addresses. In America today, Thanksgiving remains firmly engrained in its historical roots, and is widely considered to be a day for giving thanks for good food, good times, and family. Thanksgiving dinner generally consists of turkey, mashed potatoes, stuffing, vegetables, gravy, and ample desserts. To be sure, indulging in abundance is a cornerstone of the holiday, as doing so could only be possible if one possesses abundance.",B1,https://lingua.com/english/reading/thanksgiving/,lingua,{'title': 'Thanksgiving'}
"While eating at a restaurant is an enjoyable and convenient occasional treat, most individuals and families prepare their meals at home. To make breakfast, lunch, and dinner daily, these persons must have the required foods and ingredients on hand and ready to go; foods and ingredients are typically purchased from a grocery store, or an establishment that distributes foods, drinks, household products, and other items that're used by the typical consumer. Produce, or the term used to describe fresh fruits and vegetables, is commonly purchased by grocery store shoppers. In terms of fruit, most grocery stores offer bananas, apples, oranges, blackberries, raspberries, grapes, pineapples, cantaloupes, watermelons, and more; other grocery stores with larger produce selections might offer the listed fruits in addition to less common fruits, including mangoes, honeydews, starfruits, coconuts, and more. Depending on the grocery store, customers can purchase fruits in a few different ways. Some stores will charge a set amount per pound of fruit, and will weigh customers' fruit purchases and bill them accordingly; other stores will charge customers for each piece of fruit they buy, or for bundles of fruit (a bag of bananas, a bag of apples, etc.); other stores yet will simply charge by the container. Vegetables, including lettuce, corn, tomatoes, onions, celery, cucumbers, mushrooms, and more are also sold at many grocery stores, and are purchased similarly to the way that fruits are. Grocery stores typically stock more vegetables than fruit at any given time, as vegetables remain fresh longer than fruits do, generally speaking. It'd take quite a while to list everything else that today's massive grocery stores sell, but most customers take the opportunity to shop for staples, or foods that play a prominent role in the average diet, at the establishments. Staples include pasta, rice, flour, sugar, milk, meat, and eggs, and bread. All the listed staples are available in prepackaged containers, but can be purchased ""fresh"" in some grocery stores, wherein employees will measure and weigh fresh products and then provide them to customers.",B1,https://lingua.com/english/reading/food/,lingua,{'title': 'Food'}
"Yellowstone National Park, located in Idaho, Montana, and Wyoming, was established as the first national park in the United States. The park is a popular destination for visitors who enjoy ecological tourism as it offers forests, mountains, and abundant ecosystems to explore. Some of Yellowstones most well-known landmarks are its geothermal hot springs and geysers, the most famous of which is named Old Faithful. Last fall, Lisa and her friends decided to take a camping trip to Yellowstone National Park. They arranged to stay at one of the parks many convenient campsites. For their camping trip, they brought their backpacks, sleeping bags, and a cooler of food and drinks. They pitched their tents immediately upon arriving to their campsite. During their trip, Lisa and her friends hiked the many trails of the park, exploring its natural surroundings. In the forest, they saw a lot of local wildlife. Lisa was surprised to see a family of grizzly bears, some gray wolves, and even bald eagles flying overhead. Outside of the woods, they admired the beauty of some of Yellowstones natural cascades. Since Yellowstone contains many hot springs and the worlds largest area of active geysers, Lisa and her friends visited many different geyser sites. They even spent an afternoon swimming in Yellowstones Boiling River. Of all of the sites, Lisa and her friends agreed that Old Faithful was the most impressive. Lisa and her friends waited patiently for the geyser to erupt. After about 40 minutes, a stream of boiling water over 100 feet tall sprayed from the ground and up into the air. Fortunately, no one got wet!",B1,https://lingua.com/english/reading/yellowstone-national-park/,lingua,{'title': 'Yellowstone National Park'}
